### ISSUE TITLE
log-forward blackholes syslog msgs when TCP server is restarted

### ISSUE THREAD

**Issue by dmgeurts-mm** [haproxy/haproxy#3153]
### Detailed Description of the Problem

I configured SYSLOG to two servers in round-robin, and now I’m trying to work out why HAProxy stops using a server when the receiving service there is restarted. Logs don’t show any up/down activity for a mode log backend.

The firewall/appliance forwards to logs to HAProxy, which has two tcp servers configured, where Elastic Agent parses the data to Elasticsearch. Missing data in Elastic != good…

This same HAProxy instance has stats enabled and load-balances MySQL without missing a beat.

Nothing appears in the logs about the backend servers. I added bufsize and on-error to see if they would help mitigate the missing data.

haproxy version is 3.0.12-1ppa1~jammy

Restarting HAProxy fixes it until the receiving server is reloaded. It appears that HAProxy continues to send data to the ringbuffer, but fails to forward it to the server and then drops it?! I can’t prove this as all I have is seeing fewer events in Elastic when a server is affected.

### Expected Behavior

HAProxy able to detect when a mode log backend server is down. Especially when it starts to reject SYN packets with RESETs.

### Steps to Reproduce the Behavior

1. Configure syslog as per [documentation](https://www.haproxy.com/documentation/haproxy-configuration-tutorials/protocol-support/syslog/)
2. Observe syslog data receipt on server
3. Restart syslog server process on server and watch HAProxy being oblivious and blidly hammering the server with SYN packets.

### Do you have any idea what may have caused this?

@lukastribus commented on [Discourse](https://discourse.haproxy.org/t/haproxy-stops-forwarding-syslog/12041):

> This sounds like the TCP backend logging connection is opened once and never recreated, even when the connection fails completely. That is bad.

### What is your configuration?

```haproxy
global
    log /dev/log        local0
    log /dev/log        local1 notice

defaults
    log                     global
    mode                    http
    retries                 3
    timeout queue           1m
    timeout connect         5s
    timeout client          50s
    timeout server          50s
    timeout check           10s
    maxconn                 3000

log-forward syslog
    bind                10.2.2.5:1514
    log                 backend@panoslog user

backend panoslog
    mode        log
    balance     roundrobin

    default-server inter 1s fastinter 500ms fall 3 rise 2 on-error mark-down log-bufsize 8388608
    server log0 10.2.2.51:9001 log-proto octet-count check
    server log1 10.2.2.52:9001 log-proto octet-count check
```

### Output of `haproxy -vv`

```plain
HAProxy version 3.0.12-1ppa1~jammy 2025/10/03 - https://haproxy.org/
Status: long-term supported branch - will stop receiving fixes around Q2 2029.
Known bugs: http://www.haproxy.org/bugs/bugs-3.0.12.html
Running on: Linux 6.8.0-85-generic #85~22.04.1-Ubuntu SMP PREEMPT_DYNAMIC Fri Sep 19 16:18:59 UTC 2 x86_64
Build options :
  TARGET  = linux-glibc
  CC      = x86_64-linux-gnu-gcc
  CFLAGS  = -O2 -g -fwrapv -g -O2 -flto=auto -ffat-lto-objects -flto=auto -ffat-lto-objects -fstack-protector-strong -Wformat -Werror=format-security -Wdate-time -D_FORTIFY_SOURCE=2
  OPTIONS = USE_OPENSSL=1 USE_LUA=1 USE_SLZ=1 USE_SYSTEMD=1 USE_OT=1 USE_QUIC=1 USE_PROMEX=1 USE_PCRE2=1 USE_PCRE2_JIT=1 USE_QUIC_OPENSSL_COMPAT=1
  DEBUG   =

Feature list : -51DEGREES +ACCEPT4 +BACKTRACE -CLOSEFROM +CPU_AFFINITY +CRYPT_H -DEVICEATLAS +DL -ENGINE +EPOLL -EVPORTS +GETADDRINFO -KQUEUE -LIBATOMIC +LIBCRYPT +LINUX_CAP +LINUX_SPLICE +LINUX_TPROXY +LUA +MATH -MEMORY_PROFILING +NETFILTER +NS -OBSOLETE_LINKER +OPENSSL -OPENSSL_AWSLC -OPENSSL_WOLFSSL +OT -PCRE +PCRE2 +PCRE2_JIT -PCRE_JIT +POLL +PRCTL -PROCCTL +PROMEX -PTHREAD_EMULATION +QUIC +QUIC_OPENSSL_COMPAT +RT +SHM_OPEN +SLZ +SSL -STATIC_PCRE -STATIC_PCRE2 +SYSTEMD +TFO +THREAD +THREAD_DUMP +TPROXY -WURFL -ZLIB

Default settings :
  bufsize = 16384, maxrewrite = 1024, maxpollevents = 200

Built with multi-threading support (MAX_TGROUPS=16, MAX_THREADS=256, default=2).
Built with OpenSSL version : OpenSSL 3.0.2 15 Mar 2022
Running on OpenSSL version : OpenSSL 3.0.2 15 Mar 2022
OpenSSL library supports TLS extensions : yes
OpenSSL library supports SNI : yes
OpenSSL library supports : TLSv1.0 TLSv1.1 TLSv1.2 TLSv1.3
OpenSSL providers loaded : default
Built with Lua version : Lua 5.4.4
Built with the Prometheus exporter as a service
Built with network namespace support.
Built with OpenTracing support.
Built with libslz for stateless compression.
Compression algorithms supported : identity("identity"), deflate("deflate"), raw-deflate("deflate"), gzip("gzip")
Built with transparent proxy support using: IP_TRANSPARENT IPV6_TRANSPARENT IP_FREEBIND
Built with PCRE2 version : 10.39 2021-10-29
PCRE2 library supports JIT : yes
Encrypted password support via crypt(3): yes
Built with gcc compiler version 11.4.0

Available polling systems :
      epoll : pref=300,  test result OK
       poll : pref=200,  test result OK
     select : pref=150,  test result OK
Total: 3 (3 usable), will use epoll.

Available multiplexer protocols :
(protocols marked as <default> cannot be specified using 'proto' keyword)
       quic : mode=HTTP  side=FE     mux=QUIC  flags=HTX|NO_UPG|FRAMED
         h2 : mode=HTTP  side=FE|BE  mux=H2    flags=HTX|HOL_RISK|NO_UPG
         h1 : mode=HTTP  side=FE|BE  mux=H1    flags=HTX|NO_UPG
  <default> : mode=HTTP  side=FE|BE  mux=H1    flags=HTX
       fcgi : mode=HTTP  side=BE     mux=FCGI  flags=HTX|HOL_RISK|NO_UPG
       none : mode=TCP   side=FE|BE  mux=PASS  flags=NO_UPG
  <default> : mode=TCP   side=FE|BE  mux=PASS  flags=

Available services : prometheus-exporter
Available filters :
        [BWLIM] bwlim-in
        [BWLIM] bwlim-out
        [CACHE] cache
        [COMP] compression
        [FCGI] fcgi-app
        [  OT] opentracing
        [SPOE] spoe
        [TRACE] trace
```

### Last Outputs and Backtraces

```plain

```

### Additional Information

Using tcpdump, I can see that the server responds with a tcp RESET to received SYN packets until HAProxy is restarted. If I add `fastinter 500ms observe layer4 error-limit 2` then the server is detected as down, but quickly comes back up while it’s still sending tcp RESET to HAProxy’s SYN packets.

```
Oct 08 18:17:17 ha.domain.com haproxy[285424]: [WARNING]  (285424) : Server panoslog/log1 is DOWN, reason: Layer4 connection problem, info: “Connection refused”, check duration: 0ms. 1 active and 0 backup servers left. 1 sessions active, 0 requeued, 0 remaining in queue.
Oct 08 18:17:17 ha.domain.com haproxy[285424]: Server panoslog/log1 is DOWN, reason: Layer4 connection problem, info: “Connection refused”, check duration: 0ms. 1 active and 0 backup servers left. 1 sessions active, 0 requeued, 0 remaining in queue.
Oct 08 18:17:17 ha.domain.com haproxy[285424]: Server panoslog/log1 is DOWN, reason: Layer4 connection problem, info: “Connection refused”, check duration: 0ms. 1 active and 0 backup servers left. 1 sessions active, 0 requeued, 0 remaining in queue.
Oct 08 18:17:20 ha.domain.com haproxy[285424]: [WARNING]  (285424) : Server panoslog/log1 is UP, reason: Layer4 check passed, check duration: 0ms. 2 active and 0 backup servers online. 0 sessions requeued, 0 total in queue.
Oct 08 18:17:20 ha.domain.com haproxy[285424]: Server panoslog/log1 is UP, reason: Layer4 check passed, check duration: 0ms. 2 active and 0 backup servers online. 0 sessions requeued, 0 total in queue.
Oct 08 18:17:20 ha.domain.com haproxy[285424]: Server panoslog/log1 is UP, reason: Layer4 check passed, check duration: 0ms. 2 active and 0 backup servers online. 0 sessions requeued, 0 total in queue.
```

If this is an issue with Elastic Agent, then why can it be fixed by restarting HAProxy? If it’s HAProxy, then why isn’t the server marked and kept down when it sends a tcp RESET back?

**Comment by lukastribus** [comment]
Renamed for better context.

**Comment by Darlelet** [comment]
Hi,

Thanks for the report. As I'm unable to reproduce the issue so far, I have a few questions:

- Is there any firewall between haproxy and syslog tcp servers?
- Do syslog tcp servers accept multiple simultaneous connections from haproxy? (one for the actual data channel, and one for tcp checks)

>@lukastribus commented on [Discourse](https://discourse.haproxy.org/t/haproxy-stops-forwarding-syslog/12041):

>>    This sounds like the TCP backend logging connection is opened once and never recreated, even when the connection fails completely. That is bad.

Potential bugs aside, this is not the case, when haproxy detects that a syslog tcp connection is dead (ie: fails to sends messages), it will try to re-establish a new one, as for regular tcp backends. There may be up to 2 log messages lost during the process of re-establishing the connection (because the kernel doesn't instantly make `send()` syscall fail when the other end becomes unavailable), but it is normally expected that the link between haproxy and the syslog server automatically comes back up without reloading involved

**Comment by dmgeurts-mm** [comment]
> * Is there any firewall between haproxy and syslog tcp servers?

No, they're on the same VLAN/subnet.

> * Do syslog tcp servers accept multiple simultaneous connections from haproxy? (one for the actual data channel, and one for tcp checks)

I would think so, judging by the tcpdump I did. During normal operation, I see no tcp resets from the server. But when the service on the target server is restarted, every SYN yields a RESET until the server is ready. Then it's haproxy which replies to every tcp SYN-ACK with a RESET-ACK.

> Potential bugs aside, this is not the case, when haproxy detects that a syslog tcp connection is dead (ie: fails to sends messages), it will try to re-establish a new one, as for regular tcp backends. There may be up to 2 log messages lost during the process of re-establishing the connection (because the kernel doesn't instantly make `send()` syscall fail when the other end becomes unavailable), but it is normally expected that the link between haproxy and the syslog server automatically comes back up without reloading involved

I can confirm haproxy tries to re-establish the tcp connection. But what I don't understand is why haproxy can only re-establish the tcp connection after restarting haproxy.

The server service is [filebeat syslog with a tcp listener](https://www.elastic.co/docs/reference/beats/filebeat/syslog).

Digging further into the tcpdump data I think I can confirm the following:

During normal operation, haproxy health checks are SYN >, SYN-ACK <, RESET-ACK >; threeway 'handshake':

haproxy: 10.2.2.53
filebeat: 10.2.2.51

```
13:04:45.002883 IP 10.2.2.53.52606 > 10.2.2.51.9001: Flags [S], seq 3260873918, win 64240, options [mss 1460,sackOK,TS val 90259993 ecr 0,nop,wscale 7], length 0
13:04:45.002903 IP 10.2.2.51.9001 > 10.2.2.53.52606: Flags [S.], seq 2930828275, ack 3260873919, win 65160, options [mss 1460,sackOK,TS val 4293324707 ecr 90259993,nop,wscale 7], length 0
13:04:45.002971 IP 10.2.2.53.52606 > 10.2.2.51.9001: Flags [R.], seq 1, ack 1, win 502, options [nop,nop,TS val 90259993 ecr 4293324707], length 0
```

So that looks fine. This is what normal syslog being forwarded looks like (missing the initial three-way handshake but it shows the tcp session being closed when filebeat is restarted, so it's a graceful restart:

```
13:13:37.721971 IP 10.2.2.53.43706 > 10.2.2.51.9001: Flags [P.], seq 4557949:4558320, ack 1, win 502, options [nop,nop,TS val 90792712 ecr 4293857394], length 371
13:13:37.722071 IP 10.2.2.51.9001 > 10.2.2.53.43706: Flags [.], ack 4558320, win 16206, options [nop,nop,TS val 4293857426 ecr 90792712], length 0
13:13:37.751361 IP 10.2.2.53.43706 > 10.2.2.51.9001: Flags [P.], seq 4558320:4558935, ack 1, win 502, options [nop,nop,TS val 90792741 ecr 4293857426], length 615
13:13:37.751450 IP 10.2.2.51.9001 > 10.2.2.53.43706: Flags [.], ack 4558935, win 16202, options [nop,nop,TS val 4293857456 ecr 90792741], length 0
13:13:37.778804 IP 10.2.2.53.43706 > 10.2.2.51.9001: Flags [P.], seq 4558935:4559556, ack 1, win 502, options [nop,nop,TS val 90792769 ecr 4293857456], length 621
13:13:37.778911 IP 10.2.2.53.43706 > 10.2.2.51.9001: Flags [P.], seq 4559556:4560179, ack 1, win 502, options [nop,nop,TS val 90792769 ecr 4293857456], length 623
13:13:37.781495 IP 10.2.2.51.9001 > 10.2.2.53.43706: Flags [.], ack 4560179, win 16193, options [nop,nop,TS val 4293857486 ecr 90792769], length 0
13:13:37.781631 IP 10.2.2.51.9001 > 10.2.2.53.43706: Flags [F.], seq 1, ack 4560179, win 16193, options [nop,nop,TS val 4293857486 ecr 90792769], length 0
13:13:37.781690 IP 10.2.2.53.43706 > 10.2.2.51.9001: Flags [.], ack 2, win 502, options [nop,nop,TS val 90792772 ecr 4293857486], length 0
```

So far so good. Then, while filebeat isn't ready, the server replies with RESET-ACK rather than SYN-ACK to the haproxy health checks and/or syslog tcp requests. HAProxy takes the server down and brings it back up:

```
13:13:38.710897 IP 10.2.2.53.53866 > 10.2.2.51.9001: Flags [S], seq 3381817248, win 64240, options [mss 1460,sackOK,TS val 90793701 ecr 0,nop,wscale 7], length 0
13:13:38.710925 IP 10.2.2.51.9001 > 10.2.2.53.53866: Flags [R.], seq 0, ack 3381817249, win 0, length 0
13:13:39.712383 IP 10.2.2.53.53882 > 10.2.2.51.9001: Flags [S], seq 740477187, win 64240, options [mss 1460,sackOK,TS val 90794702 ecr 0,nop,wscale 7], length 0
13:13:39.712410 IP 10.2.2.51.9001 > 10.2.2.53.53882: Flags [R.], seq 0, ack 740477188, win 0, length 0
13:13:40.713282 IP 10.2.2.53.53898 > 10.2.2.51.9001: Flags [S], seq 752468873, win 64240, options [mss 1460,sackOK,TS val 90795703 ecr 0,nop,wscale 7], length 0
13:13:40.713299 IP 10.2.2.51.9001 > 10.2.2.53.53898: Flags [R.], seq 0, ack 752468874, win 0, length 0
13:13:41.715306 IP 10.2.2.53.53902 > 10.2.2.51.9001: Flags [S], seq 3990092718, win 64240, options [mss 1460,sackOK,TS val 90796705 ecr 0,nop,wscale 7], length 0
13:13:41.715332 IP 10.2.2.51.9001 > 10.2.2.53.53902: Flags [R.], seq 0, ack 3990092719, win 0, length 0
```

Once Filebeat is ready, it again returns a SYN-ACK, and HAProxy returns a RESET-ACK.

```
13:13:42.716788 IP 10.2.2.53.53918 > 10.2.2.51.9001: Flags [S], seq 527043825, win 64240, options [mss 1460,sackOK,TS val 90797707 ecr 0,nop,wscale 7], length 0
13:13:42.716816 IP 10.2.2.51.9001 > 10.2.2.53.53918: Flags [S.], seq 2658256905, ack 527043826, win 65160, options [mss 1460,sackOK,TS val 4293862421 ecr 90797707,nop,wscale 7], length 0
13:13:42.716906 IP 10.2.2.53.53918 > 10.2.2.51.9001: Flags [R.], seq 1, ack 1, win 502, options [nop,nop,TS val 90797707 ecr 4293862421], length 0
13:13:43.717894 IP 10.2.2.53.53920 > 10.2.2.51.9001: Flags [S], seq 3556625215, win 64240, options [mss 1460,sackOK,TS val 90798708 ecr 0,nop,wscale 7], length 0
13:13:43.717925 IP 10.2.2.51.9001 > 10.2.2.53.53920: Flags [S.], seq 2171639898, ack 3556625216, win 65160, options [mss 1460,sackOK,TS val 4293863422 ecr 90798708,nop,wscale 7], length 0
13:13:43.718054 IP 10.2.2.53.53920 > 10.2.2.51.9001: Flags [R.], seq 1, ack 1, win 502, options [nop,nop,TS val 90798708 ecr 4293863422], length 0
```

These look like healthchecks as haproxy (10.2.2.53) is sending RESET-ACK instead of SYN-ACK back to the server.

But, haproxy never opens a new tcp connection to (re)start sending syslog messages, which wouldn't be so bad if it kept the server down and sent all syslog to remaining pool members. However, it does not, effectively blackholing 50% of the syslog messages in a two-server pool.

**Comment by dmgeurts-mm** [comment]
If the server couldn't handle multiple tcp sessions from the same 'client', then the health check should fail and take the server down. This doesn't happen, so if this were an issue on the server side, I would expect haproxy to detect this and take the server out of active service.

**Comment by lukastribus** [comment]
> I can confirm haproxy tries to re-establish the tcp connection. But what I don't understand is why haproxy can only re-establish the tcp connection after restarting haproxy.

Does haproxy always use the same source port even after the RESETs?

I'm not talking about healthchecks, I'm just talking about production non-healthcheck traffic. If the source port never changes, we can run into all kinds of problems, because we reuse a 5 tuple previously used, which the far end TCP stack may not like at all.

**Comment by lukastribus** [comment]
I think it would be helpful to reproduce the issue while all health checks are disabled.

Healthchecks are clearly working, we need to find out prodution traffic doesn't, that's why a tcpdump that doesn't contain any healthchecks would be helpful.

**Comment by dmgeurts-mm** [comment]
Here you go, without the health checks:

```
16:02:47.417819 IP 10.2.2.53.41312 > 10.2.2.51.9001: Flags [P.], seq 19973428:19974065, ack 1, win 502, options [nop,nop,TS val 100942407 ecr 9039826], length 637
16:02:47.417840 IP 10.2.2.53.41312 > 10.2.2.51.9001: Flags [P.], seq 19974065:19974767, ack 1, win 502, options [nop,nop,TS val 100942407 ecr 9039826], length 702
16:02:47.417844 IP 10.2.2.51.9001 > 10.2.2.53.41312: Flags [.], ack 19974065, win 1601, options [nop,nop,TS val 9039826 ecr 100942407], length 0
16:02:47.417863 IP 10.2.2.53.41312 > 10.2.2.51.9001: Flags [P.], seq 19974767:19976180, ack 1, win 502, options [nop,nop,TS val 100942407 ecr 9039826], length 1413
16:02:47.417903 IP 10.2.2.51.9001 > 10.2.2.53.41312: Flags [.], ack 19976180, win 1605, options [nop,nop,TS val 9039826 ecr 100942407], length 0
16:02:47.417990 IP 10.2.2.53.41312 > 10.2.2.51.9001: Flags [P.], seq 19976180:19976877, ack 1, win 502, options [nop,nop,TS val 100942407 ecr 9039826], length 697
16:02:47.418032 IP 10.2.2.51.9001 > 10.2.2.53.41312: Flags [.], ack 19976877, win 1605, options [nop,nop,TS val 9039826 ecr 100942407], length 0
16:02:47.418048 IP 10.2.2.53.41312 > 10.2.2.51.9001: Flags [P.], seq 19976877:19977496, ack 1, win 502, options [nop,nop,TS val 100942408 ecr 9039826], length 619
16:02:47.418079 IP 10.2.2.51.9001 > 10.2.2.53.41312: Flags [.], ack 19977496, win 1605, options [nop,nop,TS val 9039826 ecr 100942408], length 0
16:02:47.424731 IP 10.2.2.53.41312 > 10.2.2.51.9001: Flags [P.], seq 19977496:19978115, ack 1, win 502, options [nop,nop,TS val 100942414 ecr 9039826], length 619
16:02:47.433058 IP 10.2.2.51.9001 > 10.2.2.53.41312: Flags [F.], seq 1, ack 19978115, win 1605, options [nop,nop,TS val 9039841 ecr 100942414], length 0
16:02:47.434008 IP 10.2.2.53.41312 > 10.2.2.51.9001: Flags [.], ack 2, win 502, options [nop,nop,TS val 100942424 ecr 9039841], length 0


16:03:30.915495 IP 10.2.2.53.41312 > 10.2.2.51.9001: Flags [F.], seq 19978115, ack 2, win 502, options [nop,nop,TS val 100985905 ecr 9039841], length 0
16:03:30.915519 IP 10.2.2.51.9001 > 10.2.2.53.41312: Flags [.], ack 19978116, win 1605, options [nop,nop,TS val 9083324 ecr 100985905], length 0
16:03:31.165412 IP 10.2.2.53.55292 > 10.2.2.51.9001: Flags [S], seq 3672908507, win 64240, options [mss 1460,sackOK,TS val 100986155 ecr 0,nop,wscale 7], length 0
16:03:31.165441 IP 10.2.2.51.9001 > 10.2.2.53.55292: Flags [S.], seq 3638111073, ack 3672908508, win 65160, options [mss 1460,sackOK,TS val 9083574 ecr 100986155,nop,wscale 7], length 0
16:03:31.165497 IP 10.2.2.53.55292 > 10.2.2.51.9001: Flags [.], ack 1, win 502, options [nop,nop,TS val 100986155 ecr 9083574], length 0
16:03:32.706747 IP 10.2.2.53.55292 > 10.2.2.51.9001: Flags [P.], seq 1:620, ack 1, win 502, options [nop,nop,TS val 100987696 ecr 9083574], length 619
16:03:32.706768 IP 10.2.2.51.9001 > 10.2.2.53.55292: Flags [.], ack 620, win 505, options [nop,nop,TS val 9085115 ecr 100987696], length 0
16:03:32.721760 IP 10.2.2.53.55292 > 10.2.2.51.9001: Flags [P.], seq 620:1240, ack 1, win 502, options [nop,nop,TS val 100987711 ecr 9085115], length 620
16:03:32.721780 IP 10.2.2.51.9001 > 10.2.2.53.55292: Flags [.], ack 1240, win 501, options [nop,nop,TS val 9085130 ecr 100987711], length 0
16:03:32.740653 IP 10.2.2.53.55292 > 10.2.2.51.9001: Flags [P.], seq 1240:2636, ack 1, win 502, options [nop,nop,TS val 100987730 ecr 9085130], length 1396
16:03:32.740675 IP 10.2.2.51.9001 > 10.2.2.53.55292: Flags [.], ack 2636, win 524, options [nop,nop,TS val 9085149 ecr 100987730], length 0
16:03:32.778483 IP 10.2.2.53.55292 > 10.2.2.51.9001: Flags [P.], seq 2636:3333, ack 1, win 502, options [nop,nop,TS val 100987768 ecr 9085149], length 697
16:03:32.778501 IP 10.2.2.51.9001 > 10.2.2.53.55292: Flags [.], ack 3333, win 546, options [nop,nop,TS val 9085187 ecr 100987768], length 0
```

The gap is where I pressed enter to indicate when haproxy was silent after filebeat closed the session with a FIN.

When restarting haproxy, you can see that the former tcp session is closed again(?!) before a new session is opened with a new source port. I think this shows that haproxy is stuck in a weird state with the old session open when the server has closed it. haproxy doesn't send any traffic to try to recover this apparent frozen state.

**Comment by Darlelet** [comment]
@dmgeurts-mm Are you able to reproduce with 3.2? I'm currently investigating a possible regression that could explain this weird state.

**Comment by lukastribus** [comment]
I can reproduce the issue easily in 3.0.12.
In current 3.2 or in current master it recovers after 2 lost syslog messages automatically, in 3.0 it does not.

In 3.0 the moment the TCP syslog server is shutdown, the socket on haproxy is stuck, doing absolutely nothing.

Here is a simple repro with a few terminals and a little bit of netcat over loopback:

- terminal 1, show backend tcp 9001 traffic with `clear; sudo tcpdump -i lo -pnvs0 port 9001`
- terminal 2, a TCP 9001 backend, it doesn't matter that it can only do 1 connection `sudo nc -l 9001`
- terminal 3, a haproxy instance running the below config: `./haproxy -f ../cert/github3153.cfg -d`
- terminal 4, hitting the UDP frontend with some messages `echo "message" | nc -q0 -u 127.0.0.1 1514` (CTRL-C and repeat it periodically)


```
global
 log stderr syslog debug

defaults
 log      global
 mode     http
 retries     3
 timeout queue     1m
 timeout connect   5s
 timeout client    50s
 timeout server    50s
 timeout check     10s
 maxconn     3000

log-forward syslog
 dgram-bind :1514
 log     backend@panoslog user

backend panoslog
 mode  log
 balance  roundrobin

 default-server on-error mark-down log-bufsize 8388608
 server log0 127.0.0.1:9001 log-proto octet-count

```

**Comment by Darlelet** [comment]
Indeed Lukas we have approximately the same repro, I'm trying to figure out why

**Comment by Darlelet** [comment]
Issue has been introduced by 4a78f766ff758952479bfc2648c946263e0c7521 (at least symptoms) and self-corrected itself via f2848e6146faa0794a9878610602d03608af07df, but I think f2848e6146faa0794a9878610602d03608af07df is a side-effect and not the proper fix for the underlying issue

**Comment by dmgeurts-mm** [comment]
> [@dmgeurts-mm](https://github.com/dmgeurts-mm) Are you able to reproduce with 3.2? I'm currently investigating a possible regression that could explain this weird state.

Not as quickly. HAProxy v3.0 is our production version, but as v3.2 is the next LTS version I'll need to test it sooner or later anyway...

**Comment by Darlelet** [comment]
Ok no worries.
Do you think building a custom 3.0 version and deploying it would be quicker?

I'm interested in seeing if manually picking  https://github.com/haproxy/haproxy/commit/f2848e6146faa0794a9878610602d03608af07df for 3.0 helps, it shouldn't harm

**Comment by dmgeurts-mm** [comment]
If there's a .deb file I can download I can give it a go quickly. Otherwise I'll try v3.2 if that helps.

**Comment by dmgeurts-mm** [comment]
Except there's no Ubuntu 22.04 repository for HAProxy v3.2...

**Comment by Darlelet** [comment]
Ok so it turns out that since https://github.com/haproxy/haproxy/commit/4a78f766ff758952479bfc2648c946263e0c7521, since syslog applet is woken up BEFORE the applet is actually released (triggered by `appctx_shut()`), it detects that the `SE_FL_SHW` flag is set and immediately stops trying to push pending data through the applet.

Due to the current nature of the applet API, it is required that the applet does another attempt at writing data for the applet to detect that the connection is really dead (both shut for read and writes), so that the applet is automatically destroyed.

By erroneously catching the `SE_FL_SHW` flag within the syslog io handler function, we prevent the applet from being destroyed, which explains why haproxy completely stops processing logs.

Unlike what the commit description suggests in parent commit from https://github.com/haproxy/haproxy/commit/f2848e6146faa0794a9878610602d03608af07df:

>Once set, the applet's I/O handler was no longer called. Tests on
these flags are useless. There is no chance to match them.

 the flag can be seen from the handler before the applet is effectively destroyed, and the commit itself is currently mandatory with https://github.com/haproxy/haproxy/commit/4a78f766ff758952479bfc2648c946263e0c7521 so that the `SE_FL_SHW` is ignored by the syslog io handler, which only needs to take into account terminal errors (APPCTX_FL_EOS|APPCTX_FL_ERROR)

f2848e6146faa0794a9878610602d03608af07df was first seen in 3.1 so it is missing in 3.0 where the problematic commit (4a78f766ff758952479bfc2648c946263e0c7521) was introduced

ccing @capflam which knows this part best

**Comment by dmgeurts-mm** [comment]
Thank you for looking into this, much appreciated!

**Comment by capflam** [comment]
@Darlelet, you're right. Good catch.  f2848e6146faa0794a9878610602d03608af07df must be backported to 3.0.

**Comment by lukastribus** [comment]
Is there a way to not make dropping at least 2 (but possibly a lot more) syslog messages expected behavior in this situation?


> Due to the current nature of the applet API, it is required that the applet does another attempt at writing data for the applet to detect that the connection is really dead (both shut for read and writes), so that the applet is automatically destroyed.

I would argue that when the TCP connection is clearly in a non working state from a OS perspective (the FD has been closed), the applet should by destroyed immediately, so that it can be restored ASAP, possibly even before new messages come in therefore avoiding black holing those log messages.

It's not like we are unaware that the far end is closing the socket:


```
23:11:29.403444 gettimeofday({tv_sec=1760389889, tv_usec=403516}, NULL) = 0
23:11:29.403625 clock_gettime(CLOCK_MONOTONIC, {tv_sec=1616822, tv_nsec=423903599}) = 0
23:11:29.403811 clock_gettime(CLOCK_THREAD_CPUTIME_ID, {tv_sec=0, tv_nsec=143230669}) = 0
23:11:29.403985 recvmsg(12, {msg_name=NULL, msg_namelen=0, msg_iov=[{iov_base="", iov_len=16384}], msg_iovlen=1, msg_controllen=0, msg_flags=0}, 0) = 0
23:11:29.404200 clock_gettime(CLOCK_THREAD_CPUTIME_ID, {tv_sec=0, tv_nsec=143335609}) = 0
23:11:29.404358 clock_gettime(CLOCK_MONOTONIC, {tv_sec=1616822, tv_nsec=424635770}) = 0
23:11:29.404513 epoll_wait(3, [{EPOLLIN|EPOLLRDHUP, {u32=12, u64=111669149708}}], 200, 60000) = 1
23:11:29.404672 gettimeofday({tv_sec=1760389889, tv_usec=404721}, NULL) = 0
23:11:29.404824 clock_gettime(CLOCK_MONOTONIC, {tv_sec=1616822, tv_nsec=425101354}) = 0
23:11:29.404977 clock_gettime(CLOCK_THREAD_CPUTIME_ID, {tv_sec=0, tv_nsec=143502401}) = 0
23:11:29.405134 epoll_ctl(3, EPOLL_CTL_DEL, 12, 0x7ffd0250812c) = 0
23:11:29.405282 clock_gettime(CLOCK_THREAD_CPUTIME_ID, {tv_sec=0, tv_nsec=143573213}) = 0
23:11:29.405441 clock_gettime(CLOCK_MONOTONIC, {tv_sec=1616822, tv_nsec=425718202}) = 0

```



Buffering or redispatching is another alternative to avoid loosing syslog messages, I don't know what is supported with syslogs.

**Comment by Darlelet** [comment]
haproxy immediately sees the FIN (translatated as a read() = 0), but by default it doesn't consider the socket as dead, only partially closed (ie: the other end won't send any data, but may still be interested in our data)

**Comment by Darlelet** [comment]
It is only when the actual send itself fails and that the applet is both shut for read and writes, that the applet is destroyed
But at that time the previous message (which was blackholed), didn't cause the previous `send()` to fail, so from the applet point of view we are not aware that the message was lost (since the `send()` succeeded, ie: half close issue)

**Comment by Darlelet** [comment]
This alone explains why we loose 1 message

Now for the second/extra lost message, it is caused by syslog handler + ring API logic itself indeed (and there may a way to fix that extra lost message)

When the `send()` fails from the handler, the applet is destroyed and recreated immediately, but unfortunately the message (which caused `send()` to fail) was already consumed, and we have no way from the handler to tell that the message should be put back in the ring / marked as unconsumed, so it is lost at this point, and only upcoming messages will be transferred through the newly created applet.

**Comment by Darlelet** [comment]
>haproxy immediately sees the FIN (translatated as a read() = 0), but by default it doesn't consider the socket as dead, only partially closed (ie: the other end won't send any data, but may still be interested in our data)

For this one, if the syslog server doesn't close its write socket after accepting the connection, maybe an option (disabled by default) to tell that the connection must be considered as dead when we receive a FIN could help, but it would completely depend on the syslog server itself, since some implementations may decide to close the write socket right after accepting a new connection since log messages are sent unidirectional, and this would cause the applet to be destroyed in loop.

**Comment by Darlelet** [comment]
> [@Darlelet](https://github.com/Darlelet), you're right. Good catch. [f2848e6](https://github.com/haproxy/haproxy/commit/f2848e6146faa0794a9878610602d03608af07df) must be backported to 3.0.

the fix was backported

**Comment by dmgeurts-mm** [comment]
Thank you for fixing. When will this fix be available in the Ubuntu/Debian repositories?

**Comment by Darlelet** [comment]
When 3.0.13 will be emitted, but I can't provide an exact date

**Comment by jhaumont** [comment]
Hello
I face a similar issue with the version 3.3.4 of HA proxy.
We have n8n, which push syslog event to HAProxy, then HAProxy send them to vector which push them to Elastic.

At some time (and I think it's after a restart of n8n), HA proxy stop to consume syslog event and n8n log a connection timed out error.

When we restart HAProxy pods, everything back to normal.

Our HAProxy configuration:
```lua
global
    log stdout format raw local0 notice
    maxconn 4096
    stats socket /tmp/haproxy
    hard-stop-after 60s

defaults
    log     global
    option  dontlognull
    retries 3
    option  redispatch
    option  allbackups
    timeout client 5s
    timeout server 5s
    timeout connect 5s

log-forward vector-syslog
    bind :9000
    log backend@vector-syslog-back local0

backend vector-syslog-back
    mode log
    balance roundrobin
    option tcp-check
    server-template srv 10 _syslog._tcp.vector-headless.vector.svc.cluster.local resolvers coredns check
``` 

Sorry, I'm a noob with the tool and in network 🙏 
If needed, I can open another issue
