### ISSUE TITLE
http-request wait-for-body breaks Expect: 100-continue causing connection reset on early server rejection

### ISSUE THREAD

**Issue by ygkat** [haproxy/haproxy#3316]
### Detailed Description of the Problem

When `http-request wait-for-body time 5s at-least 1k` is configured (e.g. for slow POST/RUDY attack mitigation), clients sending large PUT requests with `Expect: 100-continue` receive a `connection reset` (Broken pipe) instead of the backend's early error response (e.g. HTTP 400).

The root cause is that `http_wait_for_msg_body()` unconditionally calls `http_handle_expect_hdr()`, which sends `100 Continue` directly from HAProxy and removes the `Expect` header.

In `http_wait_for_msg_body()` (`src/http_ana.c`):
```c
	/* Do nothing for bodyless and CONNECT requests */
	if (txn->meth == HTTP_METH_CONNECT || (msg->flags & HTTP_MSGF_BODYLESS))
		goto end;

	if (!(chn->flags & CF_ISRESP)) {
		if (http_handle_expect_hdr(s, htx, msg) == -1) {  // <-- unconditional call
			ret = HTTP_RULE_RES_ERROR;
			goto end;
		}
	}
```

`http_handle_expect_hdr()` (`src/http_ana.c`):
```c
static int http_handle_expect_hdr(struct stream *s, struct htx *htx, struct http_msg *msg)
{
	/* If we have HTTP/1.1 message with a body and Expect: 100-continue,
	 * then we must send an HTTP/1.1 100 Continue intermediate response.
	 */
	if (!(msg->flags & HTTP_MSGF_EXPECT_CHECKED) &&
	    (msg->flags & HTTP_MSGF_VER_11) &&
	    (msg->flags & (HTTP_MSGF_CNT_LEN|HTTP_MSGF_TE_CHNK))) {
		struct ist hdr = { .ptr = "Expect", .len = 6 };
		struct http_hdr_ctx ctx;

		ctx.blk = NULL;
		/* Expect is allowed in 1.1, look for it */
		if (http_find_header(htx, hdr, &ctx, 0) &&
		    unlikely(isteqi(ctx.value, ist2("100-continue", 12)))) {
			if (http_reply_100_continue(s) == -1)   // <-- sends 100 Continue to client
				return -1;
			http_remove_header(htx, &ctx);           // <-- removes Expect header
		}
	}
	msg->flags |= HTTP_MSGF_EXPECT_CHECKED;
	return 0;
}
```

This causes the following sequence:
- Client receives `100 Continue` from HAProxy and begins transmitting the (large) request body
- HAProxy forwards the request headers to the backend **without** the `Expect` header
- Backend evaluates the request and immediately returns `400` (e.g. "object too large") before the body is fully received
- Backend closes its side of the connection (`SC_FL_SHUT_DONE`)
- HAProxy detects server shutdown while request body data is still pending, triggers `return_srv_abort` (see below)
- Client, still writing body data, receives `RST` / `Broken pipe` — the 400 response is never delivered

The abort is triggered in `http_request_forward_body()` (`src/http_ana.c`):
```c
	if ((s->scb->flags & SC_FL_SHUT_DONE) && co_data(req)) {
		/* request errors are most likely due to the server aborting the
		 * transfer. But handle server aborts only if the response was
		 * not received yet. Otherwise, let the response analyzer the
		 * responsability to handle the error. It is especially
		 * important to properly handle L7-retries but also K/A silent close.
		 */
		if (txn->rsp.msg_state >= HTTP_MSG_BODY && htx_is_empty(htxbuf(&s->res.buf)))
			goto return_srv_abort;
	}
```

HAProxy logs show termination state `SL--` (S = server closed, L = last data phase).

This was observed with AWS SDK (Java) sending 5GB+ PUT requests to an S3-compatible backend. The SDK uses `Expect: 100-continue` to allow the server to reject oversized uploads before body transmission begins.

### Expected Behavior

Without `wait-for-body`, HAProxy does **not** intercept the `Expect: 100-continue` header. As documented in `http_request_forward_body()` (`src/http_ana.c`):

```c
	/* Note that we don't have to send 100-continue back because we don't
	 * need the data to complete our job, and it's up to the server to
	 * decide whether to return 100, 417 or anything else in return of
	 * an "Expect: 100-continue" header.
	 */
	if (msg->msg_state == HTTP_MSG_BODY)
		msg->msg_state = HTTP_MSG_DATA;
```

In this normal flow, the backend receives the `Expect` header, can reject the request with `400` before body transmission, and the client receives the error response cleanly:

```
S3Exception: Your proposed upload exceeds the maximum allowed object size. (Status Code: 400)
```

With `wait-for-body` enabled, the client instead gets:

```
SdkClientException: Unable to execute HTTP request: Broken pipe (Write failed)
```

The expected behavior is that `wait-for-body` should not prevent clients from receiving early error responses from the backend when `Expect: 100-continue` is in use.

### Steps to Reproduce the Behavior

1. Configure HAProxy with `http-request wait-for-body time 5s at-least 1k`
2. Use a client that sends `Expect: 100-continue` with a large request body (e.g. AWS SDK Java with a 5GB+ PUT to S3)
3. Ensure the backend rejects the request with an early error response (e.g. 400) before the body is fully received
4. Observe that the client receives `Broken pipe` / `connection reset` instead of the 400 response
5. Remove the `wait-for-body` configuration and repeat — client now correctly receives the 400 response

### Do you have any idea what may have caused this?

`http_wait_for_msg_body()` unconditionally calls `http_handle_expect_hdr()` to send `100 Continue` and strip the `Expect` header. This is necessary for `wait-for-body` to receive body data (the client won't send it without a `100 Continue`), but it has the side effect of removing the backend's ability to reject the request before body transmission.

The conflict then manifests in `http_request_forward_body()` where `SC_FL_SHUT_DONE` is detected (backend closed after sending 400) while `co_data(req) > 0` (client body data still pending), resulting in `return_srv_abort`:

```c
	if ((s->scb->flags & SC_FL_SHUT_DONE) && co_data(req)) {
		if (txn->rsp.msg_state >= HTTP_MSG_BODY && htx_is_empty(htxbuf(&s->res.buf)))
			goto return_srv_abort;
	}
```

### Do you have an idea how to solve the issue?

A few possible approaches:

1. **Don't call `http_handle_expect_hdr()` in `http_wait_for_msg_body()` when `Expect: 100-continue` is present.** Instead, forward the `Expect` header to the backend and let the backend decide. If the backend responds with `100 Continue`, then proceed with body buffering. If the backend responds with an error, forward it to the client. This preserves the `Expect` protocol semantics but requires `wait-for-body` to coordinate with the backend response path.

2. **Add a keyword option to `wait-for-body`** (e.g. `no-100-continue`) to control whether HAProxy should auto-respond with `100 Continue` or delegate to the backend.

3. **Document the interaction** and recommend ACL-based exclusion as a workaround.

Current workaround:
```
http-request wait-for-body time 5s at-least 1k if !{ req.hdr(Expect) -m found }
```

### What is your configuration?

```haproxy
frontend http
...
    http-request wait-for-body time 5s at-least 1k
...
```

### Output of `haproxy -vv`

```plain
HAProxy version 3.2.13-awslc_v20 2026/02/19 - https://haproxy.org/
Status: long-term supported branch - will stop receiving fixes around Q2 2030.
Known bugs: http://www.haproxy.org/bugs/bugs-3.2.13.html
Running on: Linux 5.14.0-570.42.2.el9_6.x86_64 #1 SMP PREEMPT_DYNAMIC Fri Sep 26 16:42:42 KST 2025 x86_64
Build options :
  TARGET  = linux-glibc
  CC      = cc
  CFLAGS  = -O2 -g -Og -march=native -fwrapv -fvect-cost-model=very-cheap -DTLS_TICKETS_NO=4
  OPTIONS = USE_OPENSSL_AWSLC=1 USE_LUA=1 USE_ZLIB=1 USE_QUIC=1 USE_STATIC_PCRE2=1 USE_PCRE2=1 USE_PCRE2_JIT=1
  DEBUG   =

Feature list : -51DEGREES +ACCEPT4 +BACKTRACE -CLOSEFROM +CPU_AFFINITY +CRYPT_H -DEVICEATLAS +DL -ENGINE +EPOLL -EVPORTS +GETADDRINFO -KQUEUE -LIBATOMIC +LIBCRYPT +LINUX_CAP +LINUX_SPLICE +LINUX_TPROXY +LUA +MATH -MEMORY_PROFILING +NETFILTER +NS -OBSOLETE_LINKER +OPENSSL +OPENSSL_AWSLC -OPENSSL_WOLFSSL -OT -PCRE +PCRE2 +PCRE2_JIT -PCRE_JIT +POLL +PRCTL -PROCCTL -PROMEX -PTHREAD_EMULATION +QUIC -QUIC_OPENSSL_COMPAT +RT -SLZ +SSL -STATIC_PCRE +STATIC_PCRE2 +TFO +THREAD +THREAD_DUMP +TPROXY -WURFL +ZLIB +ACME

Default settings :
  bufsize = 16384, maxrewrite = 1024, maxpollevents = 200

Built with multi-threading support (MAX_TGROUPS=32, MAX_THREADS=1024, default=8).
Built with SSL library version : OpenSSL 1.1.1 (compatible; AWS-LC 1.66.0)
Running on SSL library version : AWS-LC 1.66.0
SSL library supports TLS extensions : yes
SSL library supports SNI : yes
SSL library FIPS mode : no
SSL library supports : TLSv1.0 TLSv1.1 TLSv1.2 TLSv1.3
QUIC: connection socket-owner mode support : yes
QUIC: GSO emission support : yes
Built with Lua version : Lua 5.3.5
Built with network namespace support.
Built with Naver SSL Client Hello request capture. version: RB-1.1.2:136415
Built with zlib version : 1.2.12
Running on zlib version : 1.2.12
Compression algorithms supported : identity("identity"), deflate("deflate"), raw-deflate("deflate"), gzip("gzip")
Built with transparent proxy support using: IP_TRANSPARENT IPV6_TRANSPARENT IP_FREEBIND
Built with PCRE2 version : 10.43 2024-02-16
PCRE2 library supports JIT : yes
Encrypted password support via crypt(3): yes
Built with gcc compiler version 11.5.0 20240719 (Red Hat 11.5.0-5)

Available polling systems :
      epoll : pref=300,  test result OK
       poll : pref=200,  test result OK
     select : pref=150,  test result OK
Total: 3 (3 usable), will use epoll.

Available multiplexer protocols :
(protocols marked as <default> cannot be specified using 'proto' keyword)
       quic : mode=HTTP  side=FE     mux=QUIC  flags=HTX|NO_UPG|FRAMED
         h2 : mode=HTTP  side=FE|BE  mux=H2    flags=HTX|HOL_RISK|NO_UPG
  <default> : mode=HTTP  side=FE|BE  mux=H1    flags=HTX
         h1 : mode=HTTP  side=FE|BE  mux=H1    flags=HTX|NO_UPG
       fcgi : mode=HTTP  side=BE     mux=FCGI  flags=HTX|HOL_RISK|NO_UPG
  <default> : mode=SPOP  side=BE     mux=SPOP  flags=HOL_RISK|NO_UPG
       spop : mode=SPOP  side=BE     mux=SPOP  flags=HOL_RISK|NO_UPG
  <default> : mode=TCP   side=FE|BE  mux=PASS  flags=
       none : mode=TCP   side=FE|BE  mux=PASS  flags=NO_UPG

Available services : none

Available filters :
	[BWLIM] bwlim-in
	[BWLIM] bwlim-out
	[CACHE] cache
	[COMP] compression
	[FCGI] fcgi-app
	[ SUB] replace-body
	[SPOE] spoe
	[TRACE] trace
```

### Last Outputs and Backtraces

```plain
No crash. Relevant log entry shows termination state `SL--`
```

### Additional Information

- The issue is reproducible with any HTTP client that uses `Expect: 100-continue` for large uploads (AWS SDK Java, curl with large `--data-binary`, etc.)
- The backend (S3-compatible) returns `400` within ~9ms, well before the 5s `wait-for-body` timeout
- RUDY attack mitigation is the primary use case for `wait-for-body`, and RUDY attack tools do not typically send `Expect: 100-continue`, so excluding requests with this header from `wait-for-body` is a viable workaround without reducing protection

**Comment by capflam** [comment]
Replying with a `100-continue` when HAProxy is waiting for the request payload is mandatory. Otherwise, there will have a delay before receiving the payload (typically 1s with curl by default). Note that the server cannot handle the expect header on its own because when HAProxy is waiting for the payload, nothing is forwarded to the server. This happen during the request analysis, so before the server selection.

However, I'm a bit surprised, because in H1, since the 3.0, in such case the request is drained on client side.  So the 400 response is sent to the client. If he continues to send the request payload, data are just discarded but the connection is not closed.  On older versions, the connection is indeed closed after sending the response. So it is possible to emit a RST destroying all data in fly.

In H2, the response is sent and then the stream is reset with a `RST_STREAM` frame. So it shouldn't be a problem either.

I tried with the 3.4 and 3.2 (HEAD and 3.2.13) and it works as expected. So there is something else. If your configuration is complex, you can try to reproduce the issue with a minimal config.

Here is the configuration I used:
```
global
    stats socket /tmp/haproxy
    log stdout len 4096 local0 debug

frontend http
    bind *:8889
    bind *:8890 proto h2
    http-request wait-for-body time 5s at-least 1k
    default_backend back-http

backend back-http
   server www 127.0.0.1:8000
``` 

My server replies a 400-bad-request immediately and close the connection. On the client side, sending huge file in H1, I can confirm the response is received and I'm able to send all the request before closing.

Note that in that case, a `SD` or `SL` termination state is normal. And the log is emitted before the end of the request but it is drained then.

**Comment by ygkat** [comment]
Hi @capflam , thank you for the response. I was able to reproduce this consistently on HAProxy 3.2.13. Here are the detailed results.

## Environment

- **HAProxy**: 3.2.13 (custom build with AWS-LC)
- **Client**: AWS SDK Java 2.31.20 with Apache HttpClient
- **Backend**: S3-compatible object storage (single PUT max 5GB)
- **Protocol**: Client → HAProxy (H1 over TLS 1.3) → Backend (H1)
- **Test file**: 5.1GB file created with `fallocate -l 5.1G` (exceeds 5GB single PUT limit to trigger early 400 rejection)

## Test 1: `wait-for-body` WITHOUT Expect exclusion → **Broken pipe**

### Config
```
acl rudy_method method POST PUT
http-request wait-for-body time 5s at-least 1k if rudy_method
```

### Client result
```
Upload failed!
Exception type: software.amazon.awssdk.core.exception.SdkClientException
Message: Unable to execute HTTP request: Broken pipe (SDK Attempt Count: 1)
Caused by: java.net.SocketException: Broken pipe
```

### HAProxy log (key fields)
```
status_code: 400
tsc: SL--
bc_err: "Poller reported POLLERR"
upload: 2552146        # 2.4MB already sent before abort
time_event: Ti:6/Tw:0/Tc:2/Tt:688
```

Note: the `Expect` header is **absent** in the forwarded request headers — HAProxy consumed it via `http_handle_expect_hdr()`.

## Test 2: `wait-for-body` WITH Expect exclusion → **400 properly received**

### Config
```
acl rudy_method method POST PUT
acl is_expect req.hdr(Expect) -m found
http-request wait-for-body time 5s at-least 1k if rudy_method !is_expect
```

### Client result
```
Upload failed!
Exception type: software.amazon.awssdk.services.s3.model.S3Exception
Message: Your proposed upload exceeds the maximum allowed object size.
(Service: S3, Status Code: 400)
```

### HAProxy log (key fields)
```
status_code: 400
tsc: CL--
bc_err: "Success"
upload: 826            # only headers sent, no body
time_event: Ti:6/Tw:0/Tc:1/Tt:220
```

Note: the `Expect: 100-continue` header is **present** in the forwarded request headers — backend handles the 100-continue decision.

## Analysis

| | Without exclusion | With `!is_expect` |
|---|---|---|
| **tsc** | `SL--` (server abort) | `CL--` (client close) |
| **bc_err** | `Poller reported POLLERR` | `Success` |
| **upload bytes** | 2,552,146 (2.4MB body sent) | 826 (headers only) |
| **Expect header forwarded** | No (removed by HAProxy) | Yes (passed through) |
| **Client receives 400** | No (Broken pipe) | Yes |

The sequence in Test 1:
1. Client sends PUT with `Expect: 100-continue` and `Content-Length: 5476083302`
2. `wait-for-body` calls `http_handle_expect_hdr()` → HAProxy replies `100 Continue` and **removes** the `Expect` header
3. Client begins body transmission
4. HAProxy forwards headers (without `Expect`) to backend
5. Backend sees `Content-Length` exceeds limit → replies `400` and closes
6. HAProxy receives server-side shutdown while client is still sending body → `SL--` / `POLLERR`
7. Client gets `Broken pipe` instead of the 400 response

## Suggestion

I understand that replying with `100 Continue` is necessary for `wait-for-body` to avoid the 1-second client timeout. However, the current behavior means backend early rejection responses are lost when the client is streaming a large body.

The workaround `!is_expect` works but disables `wait-for-body` entirely for `Expect` requests. Would it be possible to handle this at the HAProxy level — for example, by draining/aborting the client body transmission when the backend sends an early error response, and then forwarding that response to the client?

**Comment by capflam** [comment]
Well, what I suspect here is that your client is unhappy to receive a 400-bad-request after a 100-continue and during the upload, and it triggers an exception. On my side, with curl or nc, I'm unable to have any error. The 400-bad-request is properly received by the client. And if the request is still uploaded, it is drained. The `POLLERR` on server side is normal. I can even send another request on the same connection. Because the request is drained, it can be kept alive.

With Curl, I have this output for instance:

```
> POST / HTTP/1.1
> Host: 127.0.0.1:8889
> User-Agent: curl/8.3.0-DEV
> Accept: */*
> expect: 100-continue
> Content-Length: 10324441
> Content-Type: application/x-www-form-urlencoded
> 
< HTTP/1.1 100 Continue
< HTTP/1.1 400 Bad Request
< content-length: 0
* HTTP error before end of send, stop sending
```

Curl decides to stop to upload the request. But the `400-bad-request` was received.

About the way the `Expect` is handled when HAProxy is waiting for body, it is mandatory. Otherwise there is no way to get the payload.

I guess you can try to enable the trace on HAProxy side. But with huge file, this will be pretty verbose. At least a tcpdump between the client and HAproxy could show who is closing the connection.

**Comment by ygkat** [comment]
@capflam Here are the tcpdump and HAProxy trace results from the same reproduction described above (HAProxy 3.2.13, AWS SDK Java 2.31.20, PUT 5.1GB to S3 backend).

We also tried reproducing with curl (`--http1.1`), but curl detects the server response mid-upload and stops sending early (`abort upload after having sent 393216 bytes`), so HAProxy only needs to drain a small amount of data and the error response is delivered successfully. We also tested with a blocking Java client against a nginx backend (which closes with FIN instead of RST) and the client received `413` normally after sending 4,760MB. It seems both a blocking I/O client and a backend that sends RST on early rejection are needed to trigger this.

## tcpdump: HAProxy to S3 Backend

```
# HAProxy forwarding body data to S3
10:21:30.369257  HAProxy > S3: Flags [P.], seq 115894:124086, length 8192
10:21:30.370184  HAProxy > S3: Flags [P.], seq 124086:132278, length 8192
  ...

# S3 sends 400 response + FIN while HAProxy is still writing body
10:21:30.391459  S3 > HAProxy: Flags [P.], seq 1:669, length 668      < 400 response
10:21:30.391459  S3 > HAProxy: Flags [F.], seq 669                     < FIN (close)

# HAProxy still forwarding body data after S3 closed
10:21:30.391512  HAProxy > S3: Flags [P.], seq 213046:236726, length 23680

# S3 receive window exhausted, then RST
10:21:30.432267  S3 > HAProxy: win 0
10:21:30.891535  S3 > HAProxy: Flags [R.], seq 670                     < RST
```

## HAProxy Trace at the moment of backend RST

Captured via `trace h1 sink buf0; trace h1 level developer; trace h1 start now`.

```
# HAProxy forwarding client body to S3
10:24:54.950144  [F,RUN] waiting for more room
                 [B,RUN] h1_done_ff() / h1_send(): data sent

# 384ms gap (S3 sends 400 + RST as shown in tcpdump above)

# Backend connection error detected
10:24:55.334485  [B,RUN] h1_send(): connection error
10:24:55.334494  [B,RUN] report (ERR_PENDING|ERROR) to SE
10:24:55.334526  [B,RUN] shutdown on connection (ERROR)
10:24:55.334528  [B,CLI] h1_shutw_conn()

# Frontend tries to drain remaining client data before closing
10:24:55.334541  [F,RUN] defer shutdown to drain request first
10:24:55.334688  [F,DRN] Deferring H1S destroy to drain message
```

## tcpdump: Client to HAProxy (after backend RST)

```
# Client still sending body, unaware that S3 already rejected
10:21:30.837753  Client > HAProxy: Flags [.], length 65483

# HAProxy stops accepting data while in DRN state
10:21:31.064131  HAProxy > Client: win 0

# About 60 seconds of keepalive probes, both sides stuck
10:21:31 ~ 10:22:28  Client <> HAProxy: keepalive probes (win 0)

# HAProxy eventually closes the connection
10:22:35.892625  HAProxy > Client: Flags [P.], length 24              < TLS close_notify
10:22:35.892650  HAProxy > Client: Flags [F.]                         < FIN
10:22:35.893162  HAProxy > Client: Flags [R.]                         < RST (Broken pipe)
```

Raw pcap files and full HAProxy trace logs are available if needed. Happy to send them via email.

**Comment by capflam** [comment]
I'm not sure to understand. Maybe I missed something. But your traces and tcpdump suggest the request was properly drained, or at least HAProxy was waiting to drain the request but the client didn't send anything. I guess HAProxy waited  for the client timeout before closing it. And your test with curl shown everything worked as expected. I'm tempted to think your client is unhappy to receive an early response while it starts the upload. In that case, this triggers an error but the client leaves the connexion opened.  

If I'm right, it is an issue with the client. And except by fixing the client, your workaround with the `wait-for-body` action is probably the best. Because, I don't see what we can do here. You can possibly trigger the 413 from HAProxy by testing the content-length using `req.body_size` .

If you think I'm wrong, you can send me the trace and the tcpdumps for analysis. I may have missed something.

**Comment by ygkat** [comment]
@capflam Looking at the tcpdump more closely, I think the client was not idle in this case.

HAProxy advertised `win 0` to the client at 17:37:16, which means HAProxy stopped accepting data from the client. The client was blocked on `write()` because there was no receive window available. The keepalive probes for about 60 seconds were both sides stuck, not the client choosing not to send.

```
17:37:16  HAProxy > Client: win 0              < HAProxy stops accepting
17:37:16~17:38:15  keepalive probes (both sides stuck)
17:38:21  HAProxy > Client: [F.]               < FIN
17:38:21  HAProxy > Client: [R.]               < RST
```

The S3 400 response did arrive at HAProxy (the backend pcap confirms it) but was never forwarded to the client. The client only received FIN + RST after the timeout.

I reproduced this over plain HTTP (no TLS) so the pcap files show the full HTTP content in cleartext. I can send you the files via email. Could you let me know the best address?

**Comment by capflam** [comment]
Copy that. You can sent it me to cfaulet_at_haproxy.com. Thanks !

**Comment by capflam** [comment]
I finally found the issue. Thanks for the traces ! The fix will be backported as usual. In the mean time, you can apply the following patch on the 3.2 if you want.

[0001-BUG-MEDIUM-mux-h1-Disable-0-copy-forwarding-when-dra.patch.txt](https://github.com/user-attachments/files/26460816/0001-BUG-MEDIUM-mux-h1-Disable-0-copy-forwarding-when-dra.patch.txt)

Otherwise, as workaround, you can disable the 0-copy data forwarding, by adding `-dZ` option on the command line or `tune.h1.zero-copy-fwd-recv off` directive in your global section. This will slowdown the uploads and downloads in H1,  especially if your are relying on the kernel splicing.

**Comment by ygkat** [comment]
@capflam 

Thank you for the patch. We've applied it to our HAProxy 3.2.13 and confirmed that the client now correctly receives the backend's 400 response instead of `Broken pipe`.

Regarding our earlier analysis: we initially suspected `http_handle_expect_hdr()` removing the `Expect` header as the root cause, but we now understand this is intended behavior for `wait-for-body`.

We also noticed that with `wait-for-body` and `Expect: 100-continue`, the client experiences a delay receiving the 400 response on large uploads. HAProxy logs show the 400 response within ~600ms (`Tt:596`), but the client is still transmitting body data at that point. HAProxy drains the remaining body after logging, so the client only processes the 400 after the body transfer completes (e.g. ~10s for 5GB on loopback, longer on real networks).

Separate from the patch, we may still need the `!is_expect` ACL workaround to exclude `Expect: 100-continue` requests from `wait-for-body`, as the drain delay can impact client experience on large uploads.

Thanks again for the quick fix!

**Comment by wtarreau** [comment]
Regarding the last point, it will depend on the client. When a client receives a response during an upload, they will decide whether or not to continue uploading. Some may simply decide that there's very little left to be sent and will prefer to continue sending in order to keep the connection alive, or see that the amount of data left to be sent is too high and that it's better to abort and create a new connection. Most will just not care and either systematically abort, or systematically continue sending. Between application components, it's easier because clients can also use transfer-encoding, and decide to stop sending by just terminating the current chunk and sending 0. But this is not used over the internet for historical reasons (not supported in HTTP/1.0 and long disabled on most common HTTP/1.1 servers). In the past haproxy would close by itself after sending the response, but that cause a TCP RST to be emitted in response to next uploaded data, which the client interpreted as an error (typically the broken pipe you're seen). So the best is to rely on the client's choice. With that said, if you're working between application components, you'd have much more flexibility with HTTP/2 because there, streams can simply be aborted without breaking the connection.
