### ISSUE TITLE
haproxy set Incorrect ToS value

### ISSUE THREAD

**Issue by Slepwin** [haproxy/haproxy#2879]
### Detailed Description of the Problem

Setup ToS value 0x20 for frontend response to the client:

frontend 10.26.98.10:80
    bind 10.26.98.10:80
    mode http
    option httplog
    default_backend 10-26-98-10_80_1

backend 10-26-98-10_80_1
    mode http
    balance roundrobin
    option httpchk
    tcp-request content **set-fc-tos 0x20**
    http-check send hdr host example.com meth GET uri / ver HTTP/1.1
    http-check expect status 200
    default-server check port 8080 inter 5s fall 3 rise 3
    server 10.28.138.20:80 10.28.138.20:80
    server 10.28.138.127:80 10.28.138.127:80

On the client side tcpdump:
13:45:53.124520 IP (tos **0x28**, ttl 62, id 30692, offset 0, flags [DF], proto TCP (6), length 2625)
    10.26.98.10.http > 10.28.138.208.49324: Flags [P.], cksum 0x645d (correct), seq 1:2574, ack 76, win 52, options [nop,nop,TS val 1675562711 ecr 353221461], length 2573: HTTP, length: 2573

Same incorrect behavior (haproxy -> tcpdump):
0x20 -> 0x28, 
0x40 -> 0x48,
0x60 -> 0x68,
0x80 -> 0x88,
0xB8 -> 0xA0

### Expected Behavior

Correct behavior (haproxy -> tcpdump):
0x20 -> 0x20, 
0x40 -> 0x40,
0x60 -> 0x60,
0x80 -> 0x80,
0xB8 -> 0xB8

### Steps to Reproduce the Behavior

1. Setup haproxy config:

frontend http_front
    bind *:80
    mode http
    default_backend http_backend

backend http_backend
    mode http
    balance roundrobin
    option httpchk
    tcp-request content **set-fc-tos 0x20**

2. On client: curl http://example.com --resolve example.com:80:{{ip address http_front}}
3. On client: tcpdump -i enp3s0 -v -n -s0 '(tcp port 80)'
4. Check ToS value from 10.26.98.10 response

### Do you have any idea what may have caused this?

No

### Do you have an idea how to solve the issue?

No

### What is your configuration?

```haproxy
global
        log 127.0.0.1:10514 local7 warning
        log 127.0.0.1:10514 local7 err
        log 127.0.0.1:10514 local7 alert
        maxconn 100000
        stats timeout 30s
        stats socket /opt/lbosse/run/haproxy.sock mode 664 level admin

defaults
        default-server maxconn 100000 on-marked-down shutdown-sessions
        log     global
        mode    http
        option  httplog
        option  dontlognull
        timeout connect 5000
        timeout client  10m
        timeout server  10m
        timeout http-request 1m
        errorfile 400 /etc/haproxy/errors/400.http
        errorfile 403 /etc/haproxy/errors/403.http
        errorfile 408 /etc/haproxy/errors/408.http
        errorfile 500 /etc/haproxy/errors/500.http
        errorfile 502 /etc/haproxy/errors/502.http
        errorfile 503 /etc/haproxy/errors/503.http
        errorfile 504 /etc/haproxy/errors/504.http

frontend http_front
    bind *:80
    mode http
    option httplog
    default_backend http_backend

backend http_backend
    mode http
    balance roundrobin
    option httpchk
    tcp-request content set-fc-tos 0x20
    http-check send hdr host example.com meth GET uri / ver HTTP/1.1
    http-check expect status 200
    default-server check port 8080 inter 5s fall 3 rise 3
    server srv01:80 1.1.1.1:80
    server srv02:80 2.2.2.2:80
```

### Output of `haproxy -vv`

```plain
$ ./haproxy -vv
HAProxy version 3.0.4-7a59afa 2024/09/03 - https://haproxy.org/
Status: long-term supported branch - will stop receiving fixes around Q2 2029.
Known bugs: http://www.haproxy.org/bugs/bugs-3.0.4.html
Running on: Linux 4.18.0-553.34.1.sl8_10^1.x86_64 #1 SMP Thu Jan 9 09:39:02 UTC 2025 x86_64
Build options :
  TARGET  = linux-glibc
  CC      = cc
  CFLAGS  = -O2 -g -fwrapv
  OPTIONS = USE_THREAD=1 USE_OPENSSL=1 USE_LUA=1 USE_ZLIB=1 USE_TFO=1 USE_PROMEX=1 USE_PCRE=1 USE_PCRE_JIT=1
  DEBUG   =
 
Feature list : -51DEGREES +ACCEPT4 +BACKTRACE -CLOSEFROM +CPU_AFFINITY +CRYPT_H -DEVICEATLAS +DL -ENGINE +EPOLL -EVPORTS +GETADDRINFO -KQUEUE -LIBATOMIC +LIBCRYPT +LINUX_CAP +LINUX_SPLICE +LINUX_TPROXY +LUA +MATH -MEMORY_PROFILING +NETFILTER +NS -OBSOLETE_LINKER +OPENSSL -OPENSSL_AWSLC -OPENSSL_WOLFSSL -OT +PCRE -PCRE2 -PCRE2_JIT +PCRE_JIT +POLL +PRCTL -PROCCTL +PROMEX
-PTHREAD_EMULATION -QUIC -QUIC_OPENSSL_COMPAT +RT +SHM_OPEN -SLZ +SSL -STATIC_PCRE -STATIC_PCRE2 +SYSTEMD +TFO +THREAD +THREAD_DUMP +TPROXY -WURFL +ZLIB
 
Default settings :
  bufsize = 16384, maxrewrite = 1024, maxpollevents = 200
 
Built with multi-threading support (MAX_TGROUPS=16, MAX_THREADS=256, default=2).
Built with OpenSSL version : OpenSSL 1.1.1k  FIPS 25 Mar 2021
Running on OpenSSL version : OpenSSL 1.1.1k  FIPS 25 Mar 2021
OpenSSL library supports TLS extensions : yes
OpenSSL library supports SNI : yes
OpenSSL library supports : TLSv1.0 TLSv1.1 TLSv1.2 TLSv1.3
Built with Lua version : Lua 5.3.4
Built with the Prometheus exporter as a service
Built with network namespace support.
Built with zlib version : 1.2.11
Running on zlib version : 1.2.11
Compression algorithms supported : identity("identity"), deflate("deflate"), raw-deflate("deflate"), gzip("gzip")
Built with transparent proxy support using: IP_TRANSPARENT IPV6_TRANSPARENT IP_FREEBIND
Built with PCRE version : 8.42 2018-03-20
Running on PCRE version : 8.42 2018-03-20
PCRE library supports JIT : yes
Encrypted password support via crypt(3): yes
Built with gcc compiler version 8.5.0 20210514 (Platform V SberLinux 8.5.0-22)
 
Available polling systems :
      epoll : pref=300,  test result OK
       poll : pref=200,  test result OK
     select : pref=150,  test result OK
Total: 3 (3 usable), will use epoll.
 
Available multiplexer protocols :
(protocols marked as <default> cannot be specified using 'proto' keyword)
         h2 : mode=HTTP  side=FE|BE  mux=H2    flags=HTX|HOL_RISK|NO_UPG
  <default> : mode=HTTP  side=FE|BE  mux=H1    flags=HTX
         h1 : mode=HTTP  side=FE|BE  mux=H1    flags=HTX|NO_UPG
       fcgi : mode=HTTP  side=BE     mux=FCGI  flags=HTX|HOL_RISK|NO_UPG
  <default> : mode=TCP   side=FE|BE  mux=PASS  flags=
       none : mode=TCP   side=FE|BE  mux=PASS  flags=NO_UPG
 
Available services : prometheus-exporter
Available filters :
        [BWLIM] bwlim-in
        [BWLIM] bwlim-out
        [CACHE] cache
        [COMP] compression
        [FCGI] fcgi-app
        [SPOE] spoe
        [TRACE] trace
```

### Last Outputs and Backtraces

```plain

```

**Comment by capflam** [comment]
On my side, I'm unable to reproduce the issue. When `set-fc-tos` action is not set, there is no ToS set in IP packets. When the action is added, the right value is set. Could you check with a TCP dump on haproxy side ?

**Comment by Slepwin** [comment]
> On my side, I'm unable to reproduce the issue. When `set-fc-tos` action is not set, there is no ToS set in IP packets. When the action is added, the right value is set. Could you check with a TCP dump on haproxy side ?

What the value you trying to use in set-fc-tos` action?
The **incorrect** values only for: 0x20, 0x40, 0x60, 0x80, 0xB8
Other ToS values are set correctly.

Tcpdump from haproxy (frontend bind 10.28.138.20:80), when setup **0x20:**

16:42:55.594735 IP (tos **0x28**, ttl 62, id 58150, offset 0, flags [DF], proto TCP (6), length 2649)
    10.28.138.20.http > 10.28.154.41.52694: Flags [P.], cksum 0xeccc (correct), seq 1:2598, ack 76, win 52, options [nop,nop,TS val 170292069 ecr 466537107], length 2597: HTTP, length: 2597
	HTTP/1.1 200 OK

**Comment by wtarreau** [comment]
With the config above, for me it looks fine:
```
18:25:50.608639 IP (tos 0x20, ttl 64, id 36234, offset 0, flags [DF], proto TCP (6), length 52)
    10.0.3.2.80 > 10.0.3.82.39174: Flags [.], cksum 0x1a7a (incorrect -> 0x928a), ack 2515738085, win 509, options [nop,nop,TS val 3112345196 ecr 4006720824], length 0
18:25:50.632331 IP (tos 0x20, ttl 64, id 36235, offset 0, flags [DF], proto TCP (6), length 181)
    10.0.3.2.80 > 10.0.3.82.39174: Flags [P.], cksum 0x1afb (incorrect -> 0x27de), seq 4293426896:4293427025, ack 2515738085, win 509, options [nop,nop,TS val 3112345219 ecr 4006720824], length 129: HTTP, length: 129
        HTTP/1.1 200 OK
        content-length: 0
        x-req: size=72, time=0 ms
        x-rsp: id=dummy, code=200, cache=1, size=0, time=0 ms (0 real)

```
Do you have anything on the operating system that could manipulate the TOS ? E.g. ip rules, netfilter output rules or any such thing ? Just in case of doubt, you could run your process under strace:

```
$ strace -fe trace=setsockopt ./haproxy -f test.cfg
...
[pid 10324] setsockopt(30, SOL_TCP, TCP_NODELAY, [1], 4) = 0
[pid 10324] setsockopt(30, SOL_IP, IP_TOS, [32], 4) = 0
[pid 10324] setsockopt(31, SOL_TCP, TCP_NODELAY, [1], 4) = 0
...
```
Here it's clear that the call was properly made. If you see anything different, it could indicate either a bug, or something that intercepts the setsockopt() call (library?) or local patches being applied maybe ? If the value is correct, it will mean it's altered somewhere else.

Please note, about your TTL 62. You're not on the sending machine, and you're at least after two hops. It's very possible that one of them changes these bits in your back.

**Comment by Slepwin** [comment]
> Do you have anything on the operating system that could manipulate the TOS ? E.g. ip rules, netfilter output rules or any such thing ? 

No, just fresh installed OS, also the last tcpdump from haproxy VM (not from sending machine).
But thanks for strace output!

I noticed that in the `strace` output and tcpdump, the field is set correctly when running as root. Most likely, the issue is related to the absence of a specific Linux capability when running as an unprivileged user.

**Comment by wtarreau** [comment]
Hmmm that could indeed be an explanation. Maybe it only uses a losely relateed one in this case, I don't know. Anyway thanks for checking.
