### ISSUE TITLE
SPOE requests hanging until processing time is met when doing a reload

### ISSUE THREAD

**Issue by prodion23** [haproxy/haproxy#2478]
### Detailed Description of the Problem

We are observing an issue where upon reloading haproxy(`systemctl reload haproxy`) we see SPOE requests hanging until the max processing time, failing, & then continuing

This is on haproxy 2.4.17, but we’ve also tried upgrading to 2.4.25 to see if one of the other haproxy spoe patches resolved this but we see it there as well. 

This seems fairly easy to reproduce as it occurs when we do a haproxy reload.
ex: `systemctl reload haproxy`

What we observe is that the slowest request will take roughly as long as the max processing time for the SPOE filter. ex:

```jsx
spoe-agent tspoe-agent
    ...
    timeout processing 5s
```

We see the Slowest reqs reported as ~5.xseconds. 

eg: 

```jsx
  Slowest:	5.4082 secs
  Fastest:	        0.0378 secs
  Average:	0.1276 secs
```

To start at the top, we run: systemctl reload haproxy. 

```jsx
Mar 04 11:01:11 ip-172-31-85-206.ec2.internal systemd[1]: Reloading haproxy.service - HAProxy Load Balancer...
```

After the reload, we’ll eventually see some haproxy logs that look like this:

```jsx
Mar  4 11:02:01 localhost haproxy[308642]: SPOE: [tspoe-agent] <GROUP:tspoe-rescap-grp> sid=3107 
            st=1 0/0/-1/-1/50001 0/0 0/21 7/6183
Mar  4 11:02:01 localhost haproxy[308642]: SPOE: [tspoe-agent] <GROUP:tspoe-rescap-grp> sid=3024 
             st=1 0/0/-1/-1/50001 0/0 0/22 6/6182
```

If we look at our agent logs, we can see that we tried to write a response but it was already closed.

```jsx
Mar 04 11:01:11 ip-172-31-85-206.ec2.internal tspoe-service[308536]: TRACE: 2024/03/04 11:01:11 
        log.go:31: error: StreamID: 3107 total_ms: 0, err: ack frame write failed: cannot write frame to connection: 
        write tcp 127.0.0.1:5444->127.0.0.1:48970: use of closed network connection
Mar 04 11:01:11 ip-172-31-85-206.ec2.internal tspoe-service[308536]: TRACE: 2024/03/04 11:01:11 
        log.go:31: error: StreamID: 3024 total_ms: 0, err: ack frame write failed: cannot write frame to connection: 
        write tcp 127.0.0.1:5444->127.0.0.1:48970: use of closed network connection
```

Checking the TCPdump for this port:

```jsx
11:01:11.760362 lo    In  IP 127.0.0.1.48970 > 127.0.0.1.5444: Flags [S], seq 3172278822, win 65495, options [mss 65495,sackOK,TS val 460810819 ecr 0,nop,wscale 7], length 0
11:01:11.760369 lo    In  IP 127.0.0.1.5444 > 127.0.0.1.48970: Flags [S.], seq 2424647446, ack 3172278823, win 65483, options [mss 65495,sackOK,TS val 460810819 ecr 460810819,nop,wscale 7], length 0
11:01:11.760376 lo    In  IP 127.0.0.1.48970 > 127.0.0.1.5444: Flags [.], ack 1, win 512, options [nop,nop,TS val 460810820 ecr 460810819], length 0
11:01:11.760481 lo    In  IP 127.0.0.1.48970 > 127.0.0.1.5444: Flags [P.], seq 1:134, ack 1, win 512, options [nop,nop,TS val 460810820 ecr 460810819], length 133
11:01:11.760488 lo    In  IP 127.0.0.1.5444 > 127.0.0.1.48970: Flags [.], ack 134, win 511, options [nop,nop,TS val 460810820 ecr 460810820], length 0
11:01:11.760524 lo    In  IP 127.0.0.1.5444 > 127.0.0.1.48970: Flags [P.], seq 1:75, ack 134, win 512, options [nop,nop,TS val 460810820 ecr 460810820], length 74
11:01:11.760530 lo    In  IP 127.0.0.1.48970 > 127.0.0.1.5444: Flags [.], ack 75, win 512, options [nop,nop,TS val 460810820 ecr 460810820], length 0
11:01:11.760558 lo    In  IP 127.0.0.1.48970 > 127.0.0.1.5444: Flags [P.], seq 134:536, ack 75, win 512, options [nop,nop,TS val 460810820 ecr 460810820], length 402
11:01:11.760566 lo    In  IP 127.0.0.1.48970 > 127.0.0.1.5444: Flags [P.], seq 536:577, ack 75, win 512, options [nop,nop,TS val 460810820 ecr 460810820], length 41
11:01:11.760573 lo    In  IP 127.0.0.1.5444 > 127.0.0.1.48970: Flags [.], ack 577, win 512, options [nop,nop,TS val 460810820 ecr 460810820], length 0
11:01:11.760611 lo    In  IP 127.0.0.1.5444 > 127.0.0.1.48970: Flags [P.], seq 75:137, ack 577, win 512, options [nop,nop,TS val 460810820 ecr 460810820], length 62
11:01:11.760624 lo    In  IP 127.0.0.1.5444 > 127.0.0.1.48970: Flags [F.], seq 137, ack 577, win 512, options [nop,nop,TS val 460810820 ecr 460810820], length 0
11:01:11.760663 lo    In  IP 127.0.0.1.48970 > 127.0.0.1.5444: Flags [F.], seq 577, ack 138, win 512, options [nop,nop,TS val 460810820 ecr 460810820], length 0
11:01:11.760671 lo    In  IP 127.0.0.1.5444 > 127.0.0.1.48970: Flags [.], ack 578, win 512, options [nop,nop,TS val 460810820 ecr 460810820], length 0
```

The “hanging” log time don’t match up with the tcpdump or our service logs, but they do match the streamid & show a hang. 

This seems normal where after a reload we will often see the spoe logs with this pattern, where the processing time shows exceeded.

```jsx
0/0/-1/-1/50001
```

Let me know if you need any extra information or this doesn’t seem complete. 
At first we thought this was an issue in our SPOE agent service; but after debugging there it seems like the hang is happening on haproxy end after reload

### Expected Behavior

During a reload if a SPOE connection is dropped I would expect the request to be sent upstream immediately, even if `processing time` is not yet exceeded.

### Steps to Reproduce the Behavior

1.) Setup haproxy with a SPOE integration, set processing time(I've included a snippet of the cfgs we are using below) 
2.) Run some load through haproxy
3.) Perform a reload

### What is your configuration?

```haproxy
haproxy.cfg

global
	log 127.0.0.1:514 local0 debug
	chroot /var/lib/haproxy
	stats socket /run/haproxy/admin.sock mode 660 level admin expose-fd listeners
	stats timeout 30s
	user haproxy
	group haproxy
	daemon

	# Default SSL material locations
	ca-base /etc/ssl/certs
	crt-base /etc/ssl/private

	# See: https://ssl-config.mozilla.org/#server=haproxy&server-version=2.0.3&config=intermediate
        ssl-default-bind-ciphers ECDHE-ECDSA-AES128-GCM-SHA256:ECDHE-RSA-AES128-GCM-SHA256:ECDHE-ECDSA-AES256-GCM-SHA384:ECDHE-RSA-AES256-GCM-SHA384:ECDHE-ECDSA-CHACHA20-POLY1305:ECDHE-RSA-CHACHA20-POLY1305:DHE-RSA-AES128-GCM-SHA256:DHE-RSA-AES256-GCM-SHA384
        ssl-default-bind-ciphersuites TLS_AES_128_GCM_SHA256:TLS_AES_256_GCM_SHA384:TLS_CHACHA20_POLY1305_SHA256
        ssl-default-bind-options ssl-min-ver TLSv1.2 no-tls-tickets

defaults
	log	global
	mode	http
	option	httplog
	option	dontlognull
        timeout connect 5000
        timeout client  50000
        timeout server  50000

frontend main  
    bind *:80  
    filter spoe engine tspoe config /home/ec2-user/tspoe.conf
    http-request send-spoe-group tspoe tspoe-reqcap-grp
    http-response send-spoe-group tspoe tspoe-rescap-grp
    http-request deny deny_status 403 if { var(sess.tspoe.block_request) -m bool }
    default_backend app  

backend app
    mode http
    http-request set-header traceparent %[var(sess.tspoe.trace_context.traceparent)]
    # http-request return status 200 content-type "text/plain" string "Welcome!\n"
    server backend <REPLACED> check
    
backend tspoe
    mode tcp
    balance roundrobin
    timeout connect 5s 
    timeout server  3m
    option spop-check

    server agent localhost:5444 check
```

referenced tspoe.conf
```
[tspoe]
spoe-agent tspoe-agent
    groups tspoe-reqcap-grp
    groups tspoe-rescap-grp
    option var-prefix tspoe
    timeout hello 2s
    timeout idle  2m
    timeout processing 5s
    use-backend tspoe
    log global

spoe-group tspoe-reqcap-grp
    messages tspoe-reqcap

spoe-group tspoe-rescap-grp
    messages tspoe-rescap
    
spoe-message tspoe-reqcap
    args ip=src
    args port=src_port
    args base=base
    args query=query
    args ssl_fc=ssl_fc
    args method=method
    args body=req.body
    args hdrs=req.hdrs_bin

spoe-message tspoe-rescap
    args start_timestamp=var(sess.tspoe.start_timestamp)
    args trace_context.traceparent=var(sess.tspoe.trace_context.traceparent)
    args url=var(sess.tspoe.http_url)
    args target=var(sess.tspoe.http_target)
    args status=status
```
```


### Output of `haproxy -vv`

```plain
[ec2-user@ip-172-31-85-206 ~]$ haproxy -vv
HAProxy version 2.4.17-9f97155 2022/05/13 - https://haproxy.org/
Status: long-term supported branch - will stop receiving fixes around Q2 2026.
Known bugs: http://www.haproxy.org/bugs/bugs-2.4.17.html
Running on: Linux 6.1.77-99.164.amzn2023.x86_64 #1 SMP PREEMPT_DYNAMIC Tue Feb 13 19:20:28 UTC 2024 x86_64
Build options :
  TARGET  = linux-glibc
  CPU     = generic
  CC      = cc
  CFLAGS  = -O2 -g -Wall -Wextra -Wdeclaration-after-statement -fwrapv -Wno-address-of-packed-member -Wno-unused-label -Wno-sign-compare -Wno-unused-parameter -Wno-clobbered -Wno-missing-field-initializers -Wno-cast-function-type -Wtype-limits -Wshift-negative-value -Wshift-overflow=2 -Wduplicated-cond -Wnull-dereference
  OPTIONS = USE_OPENSSL=1 USE_LUA=1 USE_SYSTEMD=1
  DEBUG   = 

Feature list : +EPOLL -KQUEUE +NETFILTER -PCRE -PCRE_JIT -PCRE2 -PCRE2_JIT +POLL -PRIVATE_CACHE +THREAD -PTHREAD_PSHARED +BACKTRACE -STATIC_PCRE -STATIC_PCRE2 +TPROXY +LINUX_TPROXY +LINUX_SPLICE +LIBCRYPT +CRYPT_H +GETADDRINFO +OPENSSL +LUA +FUTEX +ACCEPT4 -CLOSEFROM -ZLIB +SLZ +CPU_AFFINITY +TFO +NS +DL +RT -DEVICEATLAS -51DEGREES -WURFL +SYSTEMD -OBSOLETE_LINKER +PRCTL -PROCCTL +THREAD_DUMP -EVPORTS -OT -QUIC -PROMEX -MEMORY_PROFILING

Default settings :
  bufsize = 16384, maxrewrite = 1024, maxpollevents = 200

Built with multi-threading support (MAX_THREADS=64, default=2).
Built with OpenSSL version : OpenSSL 3.0.8 7 Feb 2023
Running on OpenSSL version : OpenSSL 3.0.8 7 Feb 2023
OpenSSL library supports TLS extensions : yes
OpenSSL library supports SNI : yes
OpenSSL library supports : TLSv1.0 TLSv1.1 TLSv1.2 TLSv1.3
Built with Lua version : Lua 5.4.4
Built with network namespace support.
Built with libslz for stateless compression.
Compression algorithms supported : identity("identity"), deflate("deflate"), raw-deflate("deflate"), gzip("gzip")
Built with transparent proxy support using: IP_TRANSPARENT IPV6_TRANSPARENT IP_FREEBIND
Built without PCRE or PCRE2 support (using libc's regex instead)
Encrypted password support via crypt(3): yes
Built with gcc compiler version 11.4.1 20230605 (Red Hat 11.4.1-2)

Available polling systems :
      epoll : pref=300,  test result OK
       poll : pref=200,  test result OK
     select : pref=150,  test result OK
Total: 3 (3 usable), will use epoll.

Available multiplexer protocols :
(protocols marked as <default> cannot be specified using 'proto' keyword)
              h2 : mode=HTTP       side=FE|BE     mux=H2       flags=HTX|CLEAN_ABRT|HOL_RISK|NO_UPG
            fcgi : mode=HTTP       side=BE        mux=FCGI     flags=HTX|HOL_RISK|NO_UPG
       <default> : mode=HTTP       side=FE|BE     mux=H1       flags=HTX
              h1 : mode=HTTP       side=FE|BE     mux=H1       flags=HTX|NO_UPG
       <default> : mode=TCP        side=FE|BE     mux=PASS     flags=
            none : mode=TCP        side=FE|BE     mux=PASS     flags=NO_UPG

Available services : none

Available filters :
	[SPOE] spoe
	[CACHE] cache
	[FCGI] fcgi-app
	[COMP] compression
	[TRACE] trace
```

### Additional Information

The processing time of `5s` was too high.
We've also reduced this to `1s`; but I think the question remains if this is expected behavior, should we expect a hang upon reload equivalent to the configured processing time.

**Comment by capflam** [comment]
Thanks for report. There are 2 points in the issue. First, yes it is expected to try to process all pending messages, even during the stopping stage. And by extension, to wait for responses to all in-fly messages, for at most the configured processing timeout. The same is performed for in-fly HTTP requests. Now, I don't know if it is expected in your case to hit the processing timeout.

Then, it seems there is an issue because the processing timeout seems to be ignored for some messages. the client or the server timeout of the main stream (50s) is reported in logs. It means the processing timeout was ignored and the SPOE processing was aborted because the main stream timed out. I'm able to reproduce it for 2.8 and higher but not for older versions. It is possibly the same bug, it may be just harder to trigger it. And in my case, it is independent of the reload. I must investigate because I'm also surprised the connection with the agent was quickly closed while the message processing was not aborted.

**Comment by capflam** [comment]
I pushed a patch that should fix strange timing value you observed ( a processing timeout around 50s). It is not backported yet but it will be when we will flush the pipe. Because the other point is expected, I mark it as fixed. Thanks !
