### ISSUE TITLE
"Read early data error" (OpenSSL 3) with multiplexing multiple HTTP/2 streams

### ISSUE THREAD

**Issue by hont512** [haproxy/haproxy#3416]
### Detailed Description of the Problem

In some cases when a client (specifically FireFox 151.0.4) resumes a TLS 1.3 session (using 0-RTT early data) and sends multiple HTTP/2 requests in first batch (e.g., fetching multiple images), the connection aborts.
HAProxy logs show a "Read early data error" in ssl_sock.c, followed by a "FIN,ACK" sent to the client (FIN issued after "Server Hello...Finished").

<details>
<summary>Client side traffic dump</summary>

**Client-to-server ping ~60ms**

```
181126 1882.834485800 1.1.1.1 2.2.2.2 TCP 52 14148 → 443 [SYN] Seq=0 Win=65535 Len=0 MSS=1336 WS=256 SACK_PERM
181134 1882.894827100 2.2.2.2 1.1.1.1 TCP 52 443 → 14148 [SYN, ACK] Seq=0 Ack=1 Win=42340 Len=0 MSS=1460 SACK_PERM WS=1024
181135 1882.894890500 1.1.1.1 2.2.2.2 TCP 40 14148 → 443 [ACK] Seq=1 Ack=1 Win=65280 Len=0
181136 1882.895897300 1.1.1.1 2.2.2.2 TCP 1376 14148 → 443 [ACK] Seq=1 Ack=1 Win=65280 Len=1336 [TCP PDU reassembled in 181137]
181137 1882.895897300 1.1.1.1 2.2.2.2 TLSv1.3 1164 Client Hello (SNI=domain.com)
181138 1882.895960500 1.1.1.1 2.2.2.2 TLSv1.3 46 Change Cipher Spec
181139 1882.896002000 1.1.1.1 2.2.2.2 HTTP2 689 Magic, SETTINGS[0], WINDOW_UPDATE[0], HEADERS[3]: GET /aaaaaaaaaaaaaaaaaaaaaaaaaaaaaaaaaaaaaaaaaaaaaaaaaaaaaaaaaaaaaaaaaaaaaaaaaaaaaaaaaaaaaaaaaaaaaaaaaaaaaaaaaaaaaaaaaaaaaaaaaaaaaaaaaaaaaaaaaaaaaaaaaaaaaaaaa.jpeg, WINDOW_UPDATE[3]
181140 1882.896162600 1.1.1.1 2.2.2.2 HTTP2 253 HEADERS[5]: GET /bbbbbbbbbbbbbbbbbbbbbbbbbbbbbbbbbbbbbbbbbbbbbbbbbbbbbbbbbbbbbbbbbbbbbbbbbbbbbbbbbbbbbbbbbbbbbbbbbbbbbbbbbbbbbbbbbbbbbbbbbbbbbbbbbbbbbbbbbbbbbbbbbbbbbbbbb.jpeg, WINDOW_UPDATE[5]
181141 1882.896235500 1.1.1.1 2.2.2.2 HTTP2 172 HEADERS[7]: GET /ccccccccccccccccccccccccccccccccccccccccccccccccc.png, WINDOW_UPDATE[7]
181142 1882.896336400 1.1.1.1 2.2.2.2 HTTP2 247 HEADERS[9]: GET /dddddddddddddddddddddddddddddddddddddddddddddddddddddddddddddddddddddddddddddddddddddddddddddddddddddddddddddddddddddddddddddddddddddddddddddddddd.jpeg, WINDOW_UPDATE[9]
181153 1882.896607300 1.1.1.1 2.2.2.2 HTTP2 184 HEADERS[11]: GET /eeeeeeeeeeeeeeeeeeeeeeeeeeeeeeeeeeeeeeeeeeeeeeeeeeeeeeeeeeeeee.jpeg, WINDOW_UPDATE[11]
181639 1882.955878000 2.2.2.2 1.1.1.1 TCP 40 443 → 14148 [ACK] Seq=1 Ack=1337 Win=46080 Len=0
181640 1882.956034800 2.2.2.2 1.1.1.1 TCP 40 443 → 14148 [ACK] Seq=1 Ack=2461 Win=46080 Len=0
181641 1882.956052600 2.2.2.2 1.1.1.1 TCP 40 443 → 14148 [ACK] Seq=1 Ack=2467 Win=46080 Len=0
181642 1882.956060600 2.2.2.2 1.1.1.1 TCP 40 443 → 14148 [ACK] Seq=1 Ack=3116 Win=46080 Len=0
181643 1882.956253700 2.2.2.2 1.1.1.1 TCP 40 443 → 14148 [ACK] Seq=1 Ack=3329 Win=46080 Len=0
181644 1882.956271200 2.2.2.2 1.1.1.1 TCP 40 443 → 14148 [ACK] Seq=1 Ack=3461 Win=46080 Len=0
181645 1882.956279300 2.2.2.2 1.1.1.1 TCP 40 443 → 14148 [ACK] Seq=1 Ack=3668 Win=46080 Len=0
181646 1882.956702200 2.2.2.2 1.1.1.1 TLSv1.3 282 Server Hello, Change Cipher Spec, Encrypted Extensions, Finished
181659 1882.957793200 1.1.1.1 2.2.2.2 TLSv1.3 124 End of Early Data, Finished
181669 1882.958792100 2.2.2.2 1.1.1.1 TCP 40 443 → 14148 [FIN, ACK] Seq=243 Ack=3812 Win=47104 Len=0
181670 1882.958825000 1.1.1.1 2.2.2.2 TCP 40 14148 → 443 [ACK] Seq=3896 Ack=244 Win=65280 Len=0
181671 1882.958939700 1.1.1.1 2.2.2.2 HTTP2 79 GOAWAY[0]
181672 1882.959071900 1.1.1.1 2.2.2.2 TLSv1.3 64 Alert (Level: Warning, Description: Close Notify)
181674 1882.959089000 1.1.1.1 2.2.2.2 TCP 40 14148 → 443 [FIN, ACK] Seq=3959 Ack=244 Win=65280 Len=0
```

</details>

In related SSL-log you can see successfull part read of early data: 
```
read early data : [F(https-in)] conn=0x7fffe7d92400(0x8880c300) : size=1113
```
1113 bytes - is exact size  of 4 frames
Magick (689-62)+Headers-5 (253-62)+Headers-7 (172-62)+ Headers-9(247-62)=1113

So, Headers[11] shoud be processed in next attempt, but failed:
```
18:12:26 [00|ssl|5|l_sock.c:6024] ssl_sock_handshake(): entering : [F(https-in)] conn=0x7fffe7d92400(0x8880c300)
18:12:26 [00|ssl|0|l_sock.c:6085] Read early data error : [F(https-in)] conn=0x7fffe7d92400(0x8880c300) servername=domain.com alpn=h2 tls_vers=TLSv1.3 cipher=TLS_AES_128_GCM_SHA256 subject="/CN=domain.com"
```

<details>
<summary>Server side traffic dump (for another request)</summary>

```
17039	89.783233803	1.1.1.1	2.2.2.2	TCP	66	48630 → 443 [SYN] Seq=0 Win=65535 Len=0 MSS=1336 WS=256 SACK_PERM
17040	89.783400513	2.2.2.2	1.1.1.1	TCP	66	443 → 48630 [SYN, ACK] Seq=0 Ack=1 Win=42340 Len=0 MSS=1460 SACK_PERM WS=1024
17043	89.844628760	1.1.1.1	2.2.2.2	TCP	56	48630 → 443 [ACK] Seq=1 Ack=1 Win=65280 Len=0
17044	89.845417174	1.1.1.1	2.2.2.2	TLSv1.3	2514	Client Hello (SNI=domain.com)
17045	89.845422181	1.1.1.1	2.2.2.2	TLSv1.3	60	Change Cipher Spec
17046	89.845424324	1.1.1.1	2.2.2.2	HTTP2	701	Magic, SETTINGS[0], WINDOW_UPDATE[0], HEADERS[3]: GET /xxxxxxxxxxxxxxxxxxxxxxxxxxxxxxxxxxxxxxxxxxxxxxxxxxxxxxxxxxxxxxxxxxxxxxxxxxxxxxxxxxxxxxxxxxxxxxxxxxxxxxxxxxxxxxxxxxxxxxxxxxxxxxxxxxxxxxxxxxxxxxxxxxxxxxxxxxxxxx.png, WINDOW_UPDATE[3]
17047	89.845426176	1.1.1.1	2.2.2.2	HTTP2	331	HEADERS[5]: GET /yyyyyyyyyyyyyyyyyyyyyyyyyyyyyyyyyyyyyyyyyyyyyyyyyyyyyyyyyyyyyyyyyyyyyyyyyyyyyyyyyyyyyyyyy.webm, WINDOW_UPDATE[5]
17048	89.845440989	2.2.2.2	1.1.1.1	TCP	54	443 → 48630 [ACK] Seq=1 Ack=2461 Win=48128 Len=0
17049	89.845449211	2.2.2.2	1.1.1.1	TCP	54	443 → 48630 [ACK] Seq=1 Ack=2467 Win=48128 Len=0
17050	89.845455380	2.2.2.2	1.1.1.1	TCP	54	443 → 48630 [ACK] Seq=1 Ack=3114 Win=50176 Len=0
17051	89.845459046	2.2.2.2	1.1.1.1	TCP	54	443 → 48630 [ACK] Seq=1 Ack=3391 Win=50176 Len=0
17052	89.845707068	1.1.1.1	2.2.2.2	HTTP2	260	HEADERS[7]: GET /aaaaaaaaaaaaaaaaaaaaaaaaaaaaaaaaaaaaaaaaaaaaaaaaaaaaaaaaaaaaaaaaaaaaaaaaaaaaaaaaaaaaaaaaaaaaaaaaaaaaaaaaaaaaaaaaaaaaaaaaaaaaaaaaaaaaaaaaaaa.webm, WINDOW_UPDATE[7]
17053	89.845710574	1.1.1.1	2.2.2.2	HTTP2	214	HEADERS[9]: GET /bbbbbbbbbbbbbbbbbbbbbbbbbbbbbbbbbbbbbbbbbbbbbbbbbbbbbbbbbbbbbbbbbbbbbbbbbb.jpeg, WINDOW_UPDATE[9]
17054	89.845721560	2.2.2.2	1.1.1.1	TCP	54	443 → 48630 [ACK] Seq=1 Ack=3597 Win=51200 Len=0
17055	89.845730614	2.2.2.2	1.1.1.1	TCP	54	443 → 48630 [ACK] Seq=1 Ack=3757 Win=51200 Len=0
17056	89.845867810	2.2.2.2	1.1.1.1	TLSv1.3	296	Server Hello, Change Cipher Spec, Encrypted Extensions, Finished
17057	89.846044885	1.1.1.1	2.2.2.2	HTTP2	188	HEADERS[11]: GET /cccccccccccccccccccccccccccccccccccccccccccccccc.jpeg, WINDOW_UPDATE[11]
17058	89.847000459	2.2.2.2	1.1.1.1	TCP	54	443 → 48630 [FIN, ACK] Seq=243 Ack=3891 Win=53248 Len=0
17071	89.907330688	1.1.1.1	2.2.2.2	TCP	56	48630 → 443 [ACK] Seq=3891 Ack=244 Win=65280 Len=0
17072	89.907544860	1.1.1.1	2.2.2.2	TLSv1.3	138	End of Early Data, Finished
17073	89.907571710	2.2.2.2	1.1.1.1	TCP	54	443 → 48630 [RST] Seq=244 Win=0 Len=0
17074	89.907702507	1.1.1.1	2.2.2.2	HTTP2	93	GOAWAY[0]
17075	89.907712251	2.2.2.2	1.1.1.1	TCP	54	443 → 48630 [RST] Seq=244 Win=0 Len=0
17076	89.908331250	1.1.1.1	2.2.2.2	TLSv1.3	78	Alert (Level: Warning, Description: Close Notify)
17077	89.908336388	1.1.1.1	2.2.2.2	TCP	56	48630 → 443 [FIN, ACK] Seq=4038 Ack=244 Win=65280 Len=0
```

</details>

Extra problem: at the moment when error triggers some requests might be already sent partly. In this case they appear in logs with code 200 and "CD" termination flags. It makes think that the bug is client related.

### Expected Behavior

<details>
<summary>Good 0-RTT request part dump</summary>

```
45965	286.041561200	1.1.1.1	2.2.2.2	HTTP2	640	Magic, SETTINGS[0], WINDOW_UPDATE[0], HEADERS[3]: GET /xxxxxxxxxxxxxxxxxxxxxxxxxxxxxxxxxxxxxxxxxxxxxxxxxxxxxxxxxxxxxxxxxxxxxxxxxxxxxxxxxxxxxxxxxxx.jpeg, WINDOW_UPDATE[3]
45966	286.041691100	1.1.1.1	2.2.2.2	HTTP2	243	HEADERS[5]: GET /yyyyyyyyyyyyyyyyyyyyyyyyyyyyyyyyyyyyyyyyyyyyyyyyyyyyyyyyyyyyyyyyyyyyyyyyyyyyyyyyyyyyyyyyyyyyyyyyyyyyyyyyyyyyyyyyyyyyyyyyyyyyyyyyyyyyyyyyyyyyy.jpeg, WINDOW_UPDATE[5]
46024	286.102558200	2.2.2.2	1.1.1.1	TLSv1.3	282	Server Hello, Change Cipher Spec, Encrypted Extensions, Finished
46029	286.103362200	1.1.1.1	2.2.2.2	TLSv1.3	124	End of Early Data, Finished
46124	286.163635900	2.2.2.2	1.1.1.1	TLSv1.3	319	New Session Ticket
46152	286.167450100	2.2.2.2	1.1.1.1	HTTP2	1376	SETTINGS[0], SETTINGS[0], HEADERS[3]: 200 OK, DATA[3]
```

</details>

+ Considering another termination flag for this error

### Steps to Reproduce the Behavior

1. Enable 0-RTT, set low keep-alive to make more 0-RTT resumes
2. Get FireFox and check that it really uses 0-RTT (antiviruses might block) 
3. Browse  website with a lot of simultaneously loaded pictures on each page (to get streams with multiple requests), making delays to get session disappear
4. In my case it happen randomly in 3-10 minutes

### Do you have any idea what may have caused this?

- Probably race condition or excessive strictness of the OpenSSL 3.5 state machine 

### Do you have an idea how to solve the issue?

Disable of 0-RTT option helps. 
Didn't notice with QuicTLS.

Without any success tried to increase: tune.bufsize, tune.h2.initial-window-size, tune.ssl.maxrecord, tune.h2.max-concurrent-streams 

### What is your configuration?

```haproxy
global
setcap cap_net_bind_service,cap_net_admin
tune.lua.bool-sample-conversion normal
lua-load-per-thread /etc/haproxy/haproxy.lua
stats socket /run/haproxy.sock level admin
stats timeout 30s
log-tag haproxy
ulimit-n 1048576
fd-hard-limit 1048576
nbthread 1
master-worker no-exit-on-failure
user haproxy
group haproxy
maxconn 32000
spread-checks 3
tune.lua.burst-timeout 3000
tune.bufsize 32768
tune.ssl.default-dh-param 2048
tune.ssl.maxrecord 4257
tune.h2.max-concurrent-streams 256
tune.http.maxhdr 150
ssl-default-bind-options no-sslv3
ssl-default-bind-ciphers ECDHE-ECDSA-AES128-GCM-SHA256:ECDHE-ECDSA-CHACHA20-POLY1305:ECDHE-ECDSA-AES128-SHA256:ECDHE-ECDSA-AES256-GCM-SHA384:ECDHE-ECDSA-AES256-SHA384:ECDHE-RSA-AES128-GCM-SHA256:ECDHE-RSA-CHACHA20-POLY1305:ECDHE-RSA-AES128-SHA:ECDHE-RSA-AES128-SHA256:AES128-GCM-SHA256:AES128-SHA:AES128-SHA256:ECDHE-RSA-AES256-GCM-SHA384:ECDHE-RSA-AES256-SHA:ECDHE-RSA-AES256-SHA384:AES256-GCM-SHA384:AES256-SHA:AES256-SHA256:ECDHE-ECDSA-AES128-SHA:DES-CBC3-SHA
ssl-default-bind-ciphersuites TLS_AES_128_GCM_SHA256:TLS_CHACHA20_POLY1305_SHA256:TLS_AES_256_GCM_SHA384
ssl-default-server-ciphers ECDHE-ECDSA-AES128-GCM-SHA256:ECDHE-ECDSA-AES256-GCM-SHA384:ECDHE-ECDSA-AES128-SHA256:ECDHE-ECDSA-AES128-SHA:ECDHE-ECDSA-AES256-SHA384:ECDHE-ECDSA-AES256-SHA:ECDHE-RSA-AES128-GCM-SHA256:ECDHE-RSA-AES256-GCM-SHA384:DHE-RSA-AES128-GCM-SHA256:DHE-DSS-AES128-GCM-SHA256:kEDH+AESGCM:ECDHE-RSA-AES128-SHA256:ECDHE-RSA-AES128-SHA:ECDHE-RSA-AES256-SHA384:ECDHE-RSA-AES256-SHA:DHE-RSA-AES128-SHA256:DHE-RSA-AES128-SHA:DHE-DSS-AES128-SHA256:DHE-RSA-AES256-SHA256:DHE-DSS-AES256-SHA:DHE-RSA-AES256-SHA:AES128-GCM-SHA256:AES256-GCM-SHA384:AES128-SHA256:AES256-SHA256:AES128-SHA:AES256-SHA:AES:CAMELLIA:DES-CBC3-SHA:!aNULL:!eNULL:!EXPORT:!DES:!RC4:!MD5:!PSK:!aECDH:!EDH-DSS-DES-CBC3-SHA:!EDH-RSA-DES-CBC3-SHA:!KRB5-DES-CBC3-SHA
ssl-default-server-ciphersuites TLS_AES_128_GCM_SHA256:TLS_CHACHA20_POLY1305_SHA256:TLS_AES_256_GCM_SHA384
defaults
balance source
hash-type consistent
default_backend b403
errorfile 408 /dev/null
errorfile 503 /etc/haproxy/errors/503.http
errorfile 403 /etc/haproxy/errors/403.http
option allbackups
option tcp-smart-accept
option tcp-smart-connect
http-reuse safe
mode http
log global
option abortonclose
option dontlognull
timeout connect 3300ms
timeout client-hs 9s
timeout client 300s
timeout server 300s
timeout server-fin 30s
timeout client-fin 30s
timeout tunnel 55s
timeout http-request 30s
timeout queue 30s
timeout tarpit 45s
backlog 10000
default-server verify none inter 500 fastinter 1ms fall 3 rise 2 maxqueue 1 error-limit 1 on-error mark-down pool-max-conn 100
retries 3

frontend https-in
maxconn 9000
no option tcp-smart-accept
option forwardfor
compression algo gzip
bind *:443 tfo ssl crt /etc/haproxy/certs/ allow-0rtt alpn h2,http/1.1 curves X25519:P-256:P-384:P-224:P-521
bind quic4@*:443 ssl crt /etc/haproxy/certs/ allow-0rtt alpn h3 curves X25519:P-256:P-384:P-224:P-521
timeout http-keep-alive 3s

backend s_5
http-reuse always
retry-on conn-failure 0rtt-rejected empty-response response-timeout
```

### Output of `haproxy -vv`

```plain
HAProxy version 3.3.10-410502-117 2026/06/03 - https://haproxy.org/
Status: stable branch - will stop receiving fixes around Q1 2027.
Known bugs: http://www.haproxy.org/bugs/bugs-3.3.10.html
Running on: Linux 7.0.12 #1 SMP PREEMPT Sun Jun 14 02:38:50 UTC 2026 x86_64
Build options :
  TARGET  = linux-glibc
  CC      = cc
  CFLAGS  = -O3 -flto -fwrapv -fno-strict-aliasing -g0 -march=native -mtune=native -fwrapv -fvect-cost-model=very-cheap
  OPTIONS = USE_TPROXY= USE_GETADDRINFO=1 USE_OPENSSL=1 USE_LUA=1 USE_ZLIB=1 USE_TFO=1 USE_NS= USE_QUIC=1 USE_STATIC_PCRE2=1 USE_PCRE2=1 USE_PCRE2_JIT=1 USE_KTLS=1
  DEBUG   =

Feature list : -51DEGREES +ACCEPT4 +BACKTRACE -CLOSEFROM +CPU_AFFINITY +CRYPT_H -DEVICEATLAS +DL -ECH -ENGINE +EPOLL -EVPORTS +GETADDRINFO -KQUEUE +KTLS -LIBATOMIC +LIBCRYPT +LINUX_CAP +LINUX_SPLICE +LINUX_TPROXY +LUA +MATH -MEMORY_PROFILING +NETFILTER -NS -OBSOLETE_LINKER +OPENSSL -OPENSSL_AWSLC -OPENSSL_WOLFSSL -OT -PCRE +PCRE2 +PCRE2_JIT -PCRE_JIT +POLL +PRCTL -PROCCTL -PROMEX -PTHREAD_EMULATION +QUIC -QUIC_OPENSSL_COMPAT +RT +SHM_OPEN -SLZ +SSL -STATIC_PCRE +STATIC_PCRE2 +TFO +THREAD +THREAD_DUMP -TPROXY -WURFL +ZLIB +ACME +HAVE_TCP_MD5SIG

Default settings :
  bufsize = 16384, maxrewrite = 1024, maxpollevents = 200

Built with multi-threading support (MAX_TGROUPS=32, MAX_THREADS=1024, default=2).
Built with SSL library version : OpenSSL 3.5.7 9 Jun 2026
Running on SSL library version : OpenSSL 3.5.7 9 Jun 2026
SSL library supports TLS extensions : yes
SSL library supports SNI : yes
SSL library supports : TLSv1.0 TLSv1.1 TLSv1.2 TLSv1.3
OpenSSL providers loaded : default
QUIC: connection sock-per-conn mode support : yes
QUIC: GSO emission support : yes
Built with Lua version : Lua 5.3.6
Built with zlib version : 1.3.1.zlib-ng
Running on zlib version : 1.3.1.zlib-ng
Compression algorithms supported : identity("identity"), deflate("deflate"), raw-deflate("deflate"), gzip("gzip")
Built with transparent proxy support using: IP_TRANSPARENT IPV6_TRANSPARENT IP_FREEBIND
Built with PCRE2 version : 10.42 2022-12-11
PCRE2 library supports JIT : yes
Encrypted password support via crypt(3): yes
Built with gcc compiler version 14.3.0

Available polling systems :
      epoll : pref=300,  test result OK
       poll : pref=200,  test result OK
     select : pref=150,  test result OK
Total: 3 (3 usable), will use epoll.

Available multiplexer protocols :
(protocols marked as <default> cannot be specified using 'proto' keyword)
       quic : mode=HTTP  side=FE|BE  mux=QUIC  flags=HTX|NO_UPG|FRAMED
         h2 : mode=HTTP  side=FE|BE  mux=H2    flags=HTX|HOL_RISK|NO_UPG
         h1 : mode=HTTP  side=FE|BE  mux=H1    flags=HTX|NO_UPG
  <default> : mode=HTTP  side=FE|BE  mux=H1    flags=HTX
       fcgi : mode=HTTP  side=BE     mux=FCGI  flags=HTX|HOL_RISK|NO_UPG
       spop : mode=SPOP  side=BE     mux=SPOP  flags=HOL_RISK|NO_UPG
  <default> : mode=SPOP  side=BE     mux=SPOP  flags=HOL_RISK|NO_UPG
       none : mode=TCP   side=FE|BE  mux=PASS  flags=NO_UPG
  <default> : mode=TCP   side=FE|BE  mux=PASS  flags=

Available services : none

Available filters :
        [BWLIM] bwlim-in
        [BWLIM] bwlim-out
        [CACHE] cache
        [COMP] compression
        [FCGI] fcgi-app
        [SPOE] spoe
        [TRACE] trace
```

### Last Outputs and Backtraces

```plain

```

### Additional Information

These logs related to "client side traffic dump"

<details>
<summary>Haproxy - SSL trace</summary>

```
Jun 14 18:12:12 [00|ssl|5|l_sock.c:5793] ssl_sock_init(): entering : [B(s_11_ssl)] conn=0x7fffe7d92400(0x00002000)
Jun 14 18:12:12 [00|ssl|5|l_sock.c:5878] ssl_sock_init(): leaving : [B(s_11_ssl)] conn=0x7fffe7d92400(0x08802000)
Jun 14 18:12:12 [00|ssl|5|l_sock.c:6878] ssl_sock_io_cb(): entering : [B(s_11_ssl)] conn=0x7fffe7d92400(0x18c02300)
Jun 14 18:12:12 [00|ssl|5|l_sock.c:6024] ssl_sock_handshake(): entering : [B(s_11_ssl)] conn=0x7fffe7d92400(0x18c02300)
Jun 14 18:12:12 [00|ssl|5|l_sock.c:6225] ssl_sock_handshake(): Want write (post SSL_do_handshake) : [B(s_11_ssl)] conn=0x7fffe7d92400(0x18c02300) servername=(null) alpn= tls_vers=TLSv1.3 cipher=(NONE)
Jun 14 18:12:12 [00|ssl|5|l_sock.c:7009] ssl_sock_io_cb(): leaving : [B(s_11_ssl)] conn=0x7fffe7d92400(0x18c02300)
Jun 14 18:12:12 [00|ssl|5|l_sock.c:6878] ssl_sock_io_cb(): entering : [B(s_11_ssl)] conn=0x7fffe7d92400(0x18802300)
Jun 14 18:12:12 [00|ssl|5|l_sock.c:6024] ssl_sock_handshake(): entering : [B(s_11_ssl)] conn=0x7fffe7d92400(0x18802300)
Jun 14 18:12:12 [00|ssl|5|l_sock.c:6233] ssl_sock_handshake(): Want read (post SSL_do_handshake) : [B(s_11_ssl)] conn=0x7fffe7d92400(0x18802300) servername=(null) alpn= tls_vers=TLSv1.3 cipher=(NONE)
Jun 14 18:12:12 [00|ssl|5|l_sock.c:7009] ssl_sock_io_cb(): leaving : [B(s_11_ssl)] conn=0x7fffe7d92400(0x18802300)
Jun 14 18:12:12 [00|ssl|5|l_sock.c:6878] ssl_sock_io_cb(): entering : [B(s_11_ssl)] conn=0x7fffe7d92400(0x18802300)
Jun 14 18:12:12 [00|ssl|5|l_sock.c:6024] ssl_sock_handshake(): entering : [B(s_11_ssl)] conn=0x7fffe7d92400(0x18802300)
Jun 14 18:12:12 [00|ssl|3|l_sock.c:6317] Successful SSL_do_handshake : [B(s_11_ssl)] conn=0x7fffe7d92400(0x18802300) servername=(null) alpn= tls_vers=TLSv1.3 cipher=TLS_AES_128_GCM_SHA256
Jun 14 18:12:12 [00|ssl|5|l_sock.c:6352] ssl_sock_handshake(): leaving : [B(s_11_ssl)] conn=0x7fffe7d92400(0x18802300) servername=(null) alpn= tls_vers=TLSv1.3 cipher=TLS_AES_128_GCM_SHA256
Jun 14 18:12:12 [00|ssl|5|l_sock.c:7009] ssl_sock_io_cb(): leaving : [B(s_11_ssl)] conn=0x7fffe7d92400(0x10002300)
Jun 14 18:12:12 [00|ssl|5|l_sock.c:7521] ssl_sock_shutw(): entering : [B(s_11_ssl)] conn=0x7fffe7d92400(0x10002300)
Jun 14 18:12:12 [00|ssl|5|l_sock.c:7563] ssl_sock_shutw(): leaving : [B(s_11_ssl)] conn=0x7fffe7d92400(0x10002300)
Jun 14 18:12:12 [00|ssl|5|l_sock.c:7437] ssl_sock_close(): entering : [B(s_11_ssl)] conn=0x7fffe7d92400(0x10082300)
Jun 14 18:12:12 [00|ssl|5|l_sock.c:7511] ssl_sock_close(): leaving : [B(s_11_ssl)] conn=0x7fffe7d92400(0x10082300)
Jun 14 18:12:14 [00|ssl|5|l_sock.c:5793] ssl_sock_init(): entering : [B(s_5_ssl)] conn=0x7fffe7d92400(0x00002000)
Jun 14 18:12:14 [00|ssl|5|l_sock.c:5878] ssl_sock_init(): leaving : [B(s_5_ssl)] conn=0x7fffe7d92400(0x08802000)
Jun 14 18:12:14 [00|ssl|5|l_sock.c:6878] ssl_sock_io_cb(): entering : [B(s_5_ssl)] conn=0x7fffe7d92400(0x18c02300)
Jun 14 18:12:14 [00|ssl|5|l_sock.c:6024] ssl_sock_handshake(): entering : [B(s_5_ssl)] conn=0x7fffe7d92400(0x18c02300)
Jun 14 18:12:14 [00|ssl|5|l_sock.c:6225] ssl_sock_handshake(): Want write (post SSL_do_handshake) : [B(s_5_ssl)] conn=0x7fffe7d92400(0x18c02300) servername=(null) alpn= tls_vers=TLSv1.3 cipher=(NONE)
Jun 14 18:12:14 [00|ssl|5|l_sock.c:7009] ssl_sock_io_cb(): leaving : [B(s_5_ssl)] conn=0x7fffe7d92400(0x18c02300)
Jun 14 18:12:14 [00|ssl|5|l_sock.c:6878] ssl_sock_io_cb(): entering : [B(s_5_ssl)] conn=0x7fffe7d92400(0x18802300)
Jun 14 18:12:14 [00|ssl|5|l_sock.c:6024] ssl_sock_handshake(): entering : [B(s_5_ssl)] conn=0x7fffe7d92400(0x18802300)
Jun 14 18:12:14 [00|ssl|5|l_sock.c:6233] ssl_sock_handshake(): Want read (post SSL_do_handshake) : [B(s_5_ssl)] conn=0x7fffe7d92400(0x18802300) servername=(null) alpn= tls_vers=TLSv1.3 cipher=(NONE)
Jun 14 18:12:14 [00|ssl|5|l_sock.c:7009] ssl_sock_io_cb(): leaving : [B(s_5_ssl)] conn=0x7fffe7d92400(0x18802300)
Jun 14 18:12:14 [00|ssl|5|l_sock.c:6878] ssl_sock_io_cb(): entering : [B(s_5_ssl)] conn=0x7fffe7d92400(0x18802300)
Jun 14 18:12:14 [00|ssl|5|l_sock.c:6024] ssl_sock_handshake(): entering : [B(s_5_ssl)] conn=0x7fffe7d92400(0x18802300)
Jun 14 18:12:14 [00|ssl|3|l_sock.c:6317] Successful SSL_do_handshake : [B(s_5_ssl)] conn=0x7fffe7d92400(0x18802300) servername=(null) alpn= tls_vers=TLSv1.3 cipher=TLS_AES_128_GCM_SHA256
Jun 14 18:12:14 [00|ssl|5|l_sock.c:6352] ssl_sock_handshake(): leaving : [B(s_5_ssl)] conn=0x7fffe7d92400(0x18802300) servername=(null) alpn= tls_vers=TLSv1.3 cipher=TLS_AES_128_GCM_SHA256
Jun 14 18:12:14 [00|ssl|5|l_sock.c:7009] ssl_sock_io_cb(): leaving : [B(s_5_ssl)] conn=0x7fffe7d92400(0x10002300)
Jun 14 18:12:14 [00|ssl|5|l_sock.c:7521] ssl_sock_shutw(): entering : [B(s_5_ssl)] conn=0x7fffe7d92400(0x10002300)
Jun 14 18:12:14 [00|ssl|5|l_sock.c:7563] ssl_sock_shutw(): leaving : [B(s_5_ssl)] conn=0x7fffe7d92400(0x10002300)
Jun 14 18:12:14 [00|ssl|5|l_sock.c:7437] ssl_sock_close(): entering : [B(s_5_ssl)] conn=0x7fffe7d92400(0x10082300)
Jun 14 18:12:14 [00|ssl|5|l_sock.c:7511] ssl_sock_close(): leaving : [B(s_5_ssl)] conn=0x7fffe7d92400(0x10082300)

Jun 14 18:12:26 [00|ssl|5|l_sock.c:5793] ssl_sock_init(): entering : [F(https-in)] conn=0x7fffe7d92400(0x00000000)
Jun 14 18:12:26 [00|ssl|5|l_sock.c:5922] ssl_sock_init(): leaving : [F(https-in)] conn=0x7fffe7d92400(0x08804000)
Jun 14 18:12:26 [00|ssl|5|l_sock.c:6878] ssl_sock_io_cb(): entering : [F(https-in)] conn=0x7fffe7d92400(0x08804300)
Jun 14 18:12:26 [00|ssl|5|l_sock.c:6024] ssl_sock_handshake(): entering : [F(https-in)] conn=0x7fffe7d92400(0x08804300)
Jun 14 18:12:26 [00|ssl|0|l_sock.c:6085] Read early data error : [F(https-in)] conn=0x7fffe7d92400(0x08804300) servername=(null) alpn= tls_vers=TLSv1.3 cipher=(NONE)
Jun 14 18:12:26 [00|ssl|5|l_sock.c:6233] ssl_sock_handshake(): Want read (post SSL_do_handshake) : [F(https-in)] conn=0x7fffe7d92400(0x08804300) servername=(null) alpn= tls_vers=TLSv1.3 cipher=(NONE)
Jun 14 18:12:26 [00|ssl|5|l_sock.c:7009] ssl_sock_io_cb(): leaving : [F(https-in)] conn=0x7fffe7d92400(0x08804300)
Jun 14 18:12:26 [00|ssl|5|l_sock.c:6878] ssl_sock_io_cb(): entering : [F(https-in)] conn=0x7fffe7d92400(0x08804300)
Jun 14 18:12:26 [00|ssl|5|l_sock.c:6024] ssl_sock_handshake(): entering : [F(https-in)] conn=0x7fffe7d92400(0x08804300)
Jun 14 18:12:26 [00|ssl|5|nthello.c:171] ssl_sock_switchctx_cbk(): entering : [F(https-in)] conn=0x7fffe7d92400(0x08804300)
Jun 14 18:12:26 [00|ssl|3|nthello.c:263] Server_name extension parsed : [F(https-in)] conn=0x7fffe7d92400(0x08804300) : servername="domain.com"
Jun 14 18:12:26 [00|ssl|4|nthello.c:310] Sigalg extension value : [F(https-in)] conn=0x7fffe7d92400(0x08804300) value=ecdsa_secp256r1_sha256(0x0403):ecdsa_secp384r1_sha384(0x0503):ecdsa_secp521r1_sha512(0x0603):rsa_pss_rsae_sha256(0x0804):rsa_pss_rsae_sha384(0x0805):rsa_pss_rsae_sha512(0x0806):rsa_pkcs1_sha256(0x0401):rsa_pkcs1_sha384(0x0501):rsa_pkcs1_sha512(0x0601):ecdsa_sha1(0x0203):rsa_pkcs1_sha1(0x0201)
Jun 14 18:12:26 [00|ssl|5|nthello.c:320] ssl_sock_switchctx_cbk(): Sigalg parsing: has_ecdsa_sig : [F(https-in)] conn=0x7fffe7d92400(0x08804300)
Jun 14 18:12:26 [00|ssl|5|nthello.c:320] ssl_sock_switchctx_cbk(): Sigalg parsing: has_ecdsa_sig : [F(https-in)] conn=0x7fffe7d92400(0x08804300)
Jun 14 18:12:26 [00|ssl|5|nthello.c:320] ssl_sock_switchctx_cbk(): Sigalg parsing: has_ecdsa_sig : [F(https-in)] conn=0x7fffe7d92400(0x08804300)
Jun 14 18:12:26 [00|ssl|5|nthello.c:333] ssl_sock_switchctx_cbk(): Sigalg parsing: has_rsa_sig (RSA-PSS) : [F(https-in)] conn=0x7fffe7d92400(0x08804300)
Jun 14 18:12:26 [00|ssl|4|nthello.c:360] Ciphers value : [F(https-in)] conn=0x7fffe7d92400(0x08804300) value=TLS_AES_128_GCM_SHA256,TLS_CHACHA20_POLY1305_SHA256,TLS_AES_256_GCM_SHA384,ECDHE-ECDSA-AES128-GCM-SHA256,ECDHE-RSA-AES128-GCM-SHA256,ECDHE-ECDSA-CHACHA20-POLY1305,ECDHE-RSA-CHACHA20-POLY1305,ECDHE-ECDSA-AES256-GCM-SHA384,ECDHE-RSA-AES256-GCM-SHA384,ECDHE-ECDSA-AES256-SHA,ECDHE-RSA-AES128-SHA,ECDHE-RSA-AES256-SHA,AES128-GCM-SHA256,AES256-GCM-SHA384,AES128-SHA,AES256-SHA
Jun 14 18:12:26 [00|ssl|4|nthello.c:375] Elliptic curves : [F(https-in)] conn=0x7fffe7d92400(0x08804300) value=sect571r1(0x000E):0x11EC:ecdh_x25519(0x001D):secp256r1(0x0017):secp384r1(0x0018):secp521r1(0x0019):ffdhe2048(0x0100):ffdhe3072(0x0101)
Jun 14 18:12:26 [00|ssl|5|enthello.c:47] ssl_sock_choose_sni_ctx(): entering : [F(https-in)] conn=0x7fffe7d92400(0x08804300) : servername="domain.com"
Jun 14 18:12:26 [00|ssl|3|nthello.c:112] ECDSA node picked : [F(https-in)] conn=0x7fffe7d92400(0x08804300) : servername="domain.com" crt="/etc/haproxy/certs/4600_domain.com.pem.ecdsa"
Jun 14 18:12:26 [00|ssl|5|nthello.c:128] ssl_sock_choose_sni_ctx(): leaving : [F(https-in)] conn=0x7fffe7d92400(0x08804300)
Jun 14 18:12:26 [00|ssl|5|nthello.c:527] ssl_sock_switchctx_cbk(): leaving : [F(https-in)] conn=0x7fffe7d92400(0x08804300)
Jun 14 18:12:26 [00|ssl|5|l_sock.c:6089] ssl_sock_handshake(): Early data read : [F(https-in)] conn=0x7fffe7d92400(0x08804300) servername=domain.com alpn=h2 tls_vers=TLSv1.3 cipher=TLS_AES_128_GCM_SHA256 subject="/CN=domain.com"
Jun 14 18:12:26 [00|ssl|5|l_sock.c:6089] ssl_sock_handshake(): Early data read : [F(https-in)] conn=0x7fffe7d92400(0x0880c300) servername=domain.com alpn=h2 tls_vers=TLSv1.3 cipher=TLS_AES_128_GCM_SHA256 subject="/CN=domain.com"
Jun 14 18:12:26 [00|ssl|5|l_sock.c:6089] ssl_sock_handshake(): Early data read : [F(https-in)] conn=0x7fffe7d92400(0x0880c300) servername=domain.com alpn=h2 tls_vers=TLSv1.3 cipher=TLS_AES_128_GCM_SHA256 subject="/CN=domain.com"
Jun 14 18:12:26 [00|ssl|5|l_sock.c:6089] ssl_sock_handshake(): Early data read : [F(https-in)] conn=0x7fffe7d92400(0x0880c300) servername=domain.com alpn=h2 tls_vers=TLSv1.3 cipher=TLS_AES_128_GCM_SHA256 subject="/CN=domain.com"
Jun 14 18:12:26 [00|ssl|0|l_sock.c:6085] Read early data error : [F(https-in)] conn=0x7fffe7d92400(0x0880c300) servername=domain.com alpn=h2 tls_vers=TLSv1.3 cipher=TLS_AES_128_GCM_SHA256 subject="/CN=domain.com"
Jun 14 18:12:26 [00|ssl|5|l_sock.c:6233] ssl_sock_handshake(): Want read (post SSL_do_handshake) : [F(https-in)] conn=0x7fffe7d92400(0x0880c300) servername=domain.com alpn=h2 tls_vers=TLSv1.3 cipher=TLS_AES_128_GCM_SHA256 subject="/CN=domain.com"
Jun 14 18:12:26 [00|h2|1|mux_h2.c:1459] new H2 connection : h2c=0x7fffed2b3a00(F=https-in,PRF,0x80000) : conn=0x7fffe7d92400(IN) fe=https-in SSL/tcpv4 src=1.1.1.1:14148 .dbuf=0@(nil)+0/0 .mbuf=[1..1|32],h=[0@(nil)+0/0],t=[0@(nil)+0/0]
Jun 14 18:12:26 [00|h2|5|mux_h2.c:1488] h2_init(): leaving : h2c=0x7fffed2b3a00(F=https-in,PRF,0x80000) : conn=0x7fffe7d92400(IN) fe=https-in SSL/tcpv4 src=1.1.1.1:14148 .dbuf=0@(nil)+0/0 .mbuf=[1..1|32],h=[0@(nil)+0/0],t=[0@(nil)+0/0]
Jun 14 18:12:26 [00|ssl|5|l_sock.c:7009] ssl_sock_io_cb(): leaving : [F(https-in)] conn=0x7fffe7d92400(0x8880c300)
Jun 14 18:12:26 [00|ssl|5|l_sock.c:7027] ssl_sock_to_buf(): entering : [F(https-in)] conn=0x7fffe7d92400(0x8880c300)
Jun 14 18:12:26 [00|ssl|3|l_sock.c:7044] read early data : [F(https-in)] conn=0x7fffe7d92400(0x8880c300) : size=1113
Jun 14 18:12:26 [00|ssl|5|l_sock.c:7027] ssl_sock_to_buf(): entering : [F(https-in)] conn=0x7fffe7d92400(0x8880c300)
Jun 14 18:12:26 [00|ssl|5|l_sock.c:7056] ssl_sock_to_buf(): leaving : [F(https-in)] conn=0x7fffe7d92400(0x8880c300)
Jun 14 18:12:26 [00|ssl|5|l_sock.c:6878] ssl_sock_io_cb(): entering : [F(https-in)] conn=0x7fffe7d92400(0x8880c300)
Jun 14 18:12:26 [00|ssl|5|l_sock.c:6024] ssl_sock_handshake(): entering : [F(https-in)] conn=0x7fffe7d92400(0x8880c300)
Jun 14 18:12:26 [00|ssl|0|l_sock.c:6085] Read early data error : [F(https-in)] conn=0x7fffe7d92400(0x8880c300) servername=domain.com alpn=h2 tls_vers=TLSv1.3 cipher=TLS_AES_128_GCM_SHA256 subject="/CN=domain.com"
Jun 14 18:12:26 [00|ssl|5|l_sock.c:7009] ssl_sock_io_cb(): leaving : [F(https-in)] conn=0x7fffe7d92400(0x8890c300)
Jun 14 18:12:26 [00|ssl|5|l_sock.c:7027] ssl_sock_to_buf(): entering : [F(https-in)] conn=0x7fffe7d92400(0x8890c300)
Jun 14 18:12:26 [00|ssl|5|l_sock.c:7056] ssl_sock_to_buf(): leaving : [F(https-in)] conn=0x7fffe7d92400(0x8890c300)
Jun 14 18:12:26 [00|ssl|5|l_sock.c:7521] ssl_sock_shutw(): entering : [F(https-in)] conn=0x7fffe7d92400(0x0890c700)
Jun 14 18:12:26 [00|ssl|5|l_sock.c:7437] ssl_sock_close(): entering : [F(https-in)] conn=0x7fffe7d92400(0x0890c700)
Jun 14 18:12:26 [00|ssl|5|l_sock.c:7511] ssl_sock_close(): leaving : [F(https-in)] conn=0x7fffe7d92400(0x0890c700)

```

</details>

Haproxy - H2 trace
[log-h2-part.txt](https://github.com/user-attachments/files/28937383/log-h2-part.txt)

**Comment by cognet** [comment]
Hi @hont512,

I think I finally got it! I first suspected a problem with OpenSSL, but I was wrong, it was purely a bug in haproxy.
Commit 8e1c51378e9949ae5f87a0cd107d9f388b0ba5c0 should hopefully fix it, if you want to test it, it should apply cleanly on 3.3 too.
Thanks a lot for reporting!

**Comment by capflam** [comment]
backported as far as 2.8
