### ISSUE TITLE
SSL handshake failure after idle with ca-file + verify optional — browser aborts after CertificateRequest during PSK resumption

### ISSUE THREAD

**Issue by sikysikov** [haproxy/haproxy#3304]
### Detailed Description of the Problem

When `ca-file` is present on a `bind` line (with either `verify optional` or `verify required`), browsers consistently fail the first TLS handshake after an idle period of 5–10 minutes. The immediate retry always succeeds within 1–2 seconds.

tcpdump capture confirms the sequence:

1. After idle, browser opens a new TCP connection (new source port)
2. Browser sends a small ClientHello (267 bytes — PSK/session resumption attempt)
3. HAProxy/OpenSSL responds with ServerHello + `CertificateRequest` (3264 bytes)
4. Browser immediately sends FIN — closes the connection
5. Browser retries with a full ClientHello (1828 bytes, includes client certificate)
6. Full handshake succeeds

The problem occurs because `CertificateRequest` is sent during every handshake when `ca-file` is configured, even when the client is attempting PSK-based session resumption without a client certificate ready. The browser is not prepared to provide a certificate during resumption and aborts.

**Removing `ca-file` from the bind line completely eliminates the issue.** All other tuning options have no effect (see below).

### Expected Behavior

With `verify optional`, HAProxy should either:

- Not send `CertificateRequest` during PSK session resumption when the client has not offered a certificate in the ClientHello, or
- Gracefully handle the case where the client closes the connection after receiving `CertificateRequest` without producing a handshake failure

Ideally, `verify optional` combined with session resumption should allow the resumed session to proceed without requiring a client certificate, since the original session already completed certificate verification.

### Steps to Reproduce the Behavior

1. Configure HAProxy with mTLS on a frontend:

```
bind :443 ssl crt /path/to/server.pem ca-file /path/to/ca.pem verify optional crt-ignore-err all
```

2. Access any HTTPS page from a browser (Chrome/Edge tested) with a valid client certificate installed
3. Wait 5–10 minutes without any activity (all HTTP connections will time out and close)
4. Reload the page in the browser
5. First connection attempt fails with `SSL handshake failure` in HAProxy logs
6. Browser automatically retries and succeeds

tcpdump capture of the failing vs succeeding handshake:

```
# FAILING connection (after idle):
09:48:14.870267 IP client.54733 > server.443: Flags [S], seq 2333356636, length 0
09:48:14.871783 IP server.443 > client.54733: Flags [S.], seq 1153711546, ack 2333356637, length 0
09:48:14.880991 IP client.54733 > server.443: Flags [.], ack 1, length 0
09:48:14.884548 IP client.54733 > server.443: Flags [P.], seq 1:268, length 267      # Small ClientHello (PSK resumption)
09:48:14.889047 IP server.443 > client.54733: Flags [.], seq 1:1461, length 1460     # ServerHello + CertificateRequest
09:48:14.889059 IP server.443 > client.54733: Flags [.], seq 1461:2921, length 1460
09:48:14.889067 IP server.443 > client.54733: Flags [P.], seq 2921:3265, length 344
09:48:14.911377 IP client.54733 > server.443: Flags [F.], ack 3265, length 0         # Browser sends FIN immediately

# SUCCEEDING connection (retry):
09:48:15.959929 IP client.63410 > server.443: Flags [S], seq 287828327, length 0
09:48:15.978467 IP client.63410 > server.443: Flags [.], seq 1:1461, length 1460     # Large ClientHello (with certificate)
09:48:15.979160 IP client.63410 > server.443: Flags [P.], seq 1461:1829, length 368
# ... full handshake completes successfully
```

### Do you have any idea what may have caused this?

The presence of `ca-file` on the bind line causes OpenSSL to include `CertificateRequest` in the ServerHello response for every new handshake, regardless of whether the client is attempting PSK session resumption. After an idle period, the browser's TLS stack attempts to resume the session using a PSK ticket but does not have the client certificate ready for immediate presentation. Upon receiving `CertificateRequest`, the browser aborts rather than falling back to a full handshake within the same connection.

This was verified by testing session resumption with `openssl s_client` from the same machine:

```bash
# Session creation — works fine
(sleep 2; echo) | openssl s_client -connect server:443 -servername host.example.com -sess_out /tmp/sess.pem
# Output: New, TLSv1.3, Cipher is TLS_AES_128_GCM_SHA256, Post-Handshake New Session Ticket arrived

# Session resumption — works fine from openssl
(sleep 2; echo) | openssl s_client -connect server:443 -servername host.example.com -sess_in /tmp/sess.pem
# Output: Reused, TLSv1.3, Cipher is TLS_AES_128_GCM_SHA256
```

OpenSSL `s_client` handles the resumption + CertificateRequest gracefully, but browsers (Chrome, Edge) do not — they abort the connection.

### Do you have an idea how to solve the issue?

A possible approach: when `verify optional` is set and the client is performing PSK-based session resumption, suppress the `CertificateRequest` message. The client certificate status from the original session could be carried forward via the session ticket/PSK context. If the server needs to re-verify the client certificate, it could use TLS 1.3 post-handshake authentication (`CertificateRequest` after the handshake completes) instead of during the handshake, giving the browser time to prepare the certificate.

Alternatively, document this as a known interaction between `ca-file` + `verify optional` and browser PSK resumption behavior, so users can implement workarounds.

**Current workaround:** Route connections that don't need mTLS (whitelisted IPs, public subdomains) to a separate frontend without `ca-file` using a TCP frontend with source-IP and SNI-based routing.

## What I tested (all still fail with `ca-file` present)

| Change | Result |
|--------|--------|
| `verify optional` instead of `verify required` | Still fails |
| Removing `no-tls-tickets` from bind line | Still fails |
| Removing `no-tls-tickets` globally (patched haproxy.inc) | Still fails |
| `tune.ssl.cachesize 0` + `tune.ssl.lifetime 0` | Still fails |
| TLS 1.2 only (`ssl-min-ver TLSv1.2 ssl-max-ver TLSv1.2`) | Still fails |
| Direct bind on WAN IP (no TCP proxy / PROXY protocol) | Still fails |
| **Removing `ca-file` from bind entirely** | **Works — no failures** |

### What is your configuration?

```haproxy
global
    tune.ssl.cachesize 20000
    tune.ssl.lifetime 300s
    ssl-default-bind-ciphersuites TLS_AES_128_GCM_SHA256:TLS_AES_256_GCM_SHA384:TLS_CHACHA20_POLY1305_SHA256
    ssl-default-bind-options ssl-min-ver TLSv1.3 no-tls-tickets

frontend mTLS-frontend
    bind :443 ssl crt /path/to/server.pem ca-file /path/to/ca.pem verify optional crt-ignore-err all no-tls-tickets
    mode http
    option forwardfor
    timeout client 300000
    timeout http-keep-alive 300s
    # ACL-based authorization on HTTP layer
    acl cert_valid ssl_c_verify 0
    http-request deny if !cert_valid !whitelisted
```

### Output of `haproxy -vv`

```plain
HAProxy version 2.9.14-7c591d5 2025/01/29 - https://haproxy.org/
Status: stable branch - will stop receiving fixes around Q1 2025.
Running on: FreeBSD 15.0-CURRENT
Build options :
  TARGET  = freebsd
  CPU     = generic
  OPTIONS = USE_GETADDRINFO=1 USE_OPENSSL=1 USE_LUA=1 USE_ACCEPT4=1 USE_ZLIB=1
            USE_CPU_AFFINITY=1 USE_QUIC=1 USE_PROMEX=1 USE_STATIC_PCRE=1
            USE_PCRE=1 USE_PCRE_JIT=1 USE_QUIC_OPENSSL_COMPAT=1
Built with OpenSSL version : OpenSSL 3.0.16 11 Feb 2025
Running on OpenSSL version : OpenSSL 3.0.16 11 Feb 2025
```

### Last Outputs and Backtraces

```plain
HAProxy log showing the pattern (successful request, idle period, handshake failure, immediate retry success):


09:27:48 haproxy[53825]: x.x.x.x:63901 [...] https-frontend-mTLS~ host_ipvANY/host 0/0/4/308/312 200 9217 "GET https://host.example.com/ HTTP/2.0"
# ~10 minutes idle
09:37:26 haproxy[53825]: x.x.x.x:49552 [...] https-frontend-mTLS/x.x.x.x:443: SSL handshake failure
09:37:27 haproxy[53825]: x.x.x.x:64471 [...] https-frontend-mTLS~ host_ipvANY/host 0/0/3/307/310 200 9176 "GET https://host.example.com/ HTTP/2.0"
```

### Additional Information

- Tested with Chrome and Edge on Windows — both exhibit the same behavior
- The issue is independent of TLS version (occurs with both TLS 1.2 and TLS 1.3)
- The issue is independent of `no-tls-tickets` setting
- `openssl s_client` session resumption works correctly — the issue is specific to browser TLS stacks
- Running on pfSense (FreeBSD 15.0-CURRENT) but the issue is likely platform-independent since it's in the OpenSSL/browser interaction layer

**Comment by rlebreton** [comment]
I've been trying to reproduce your issue for some time and I faced some handshake issues that might be the same as yours but don't seem to disappear when I remove the ca-file parameter like you so it might be something else.
I do have the failed handshake followed by a complete one that ends up succeeding and it always came from the client/browser side that closed the connection after the ServerHello but I never had a CertificateRequest sent by haproxy. That makes me think that I might be looking at the wrong thing. I use "fake" self-signed certificates on haproxy side which might introduce some other issues in the tests.

I noticed that you are working with a pretty old and not maintained anymore version of haproxy which will make it even harder to debug. Is there any way for you to upgrade to a newer version ? Starting with branch 3.2 we added some ssl traces that could help understand your issue more.
If possible could you also provide a full pcap capture of one of your failed handshake please.

**Comment by sikysikov** [comment]
Hi, thank you for looking on this. I know that my haproxy is quite outdated, unfortunately it is latest stable package version in pfSense CE 2.8.1. There is also devel version haproxy-devel-3.0.d13, should I try this? I got PCAP capture, how should I send it?

**Comment by rlebreton** [comment]
Just bumping to 3.0 would probably not change much, let's try with the pcap first. You can send it to me directly if you want (rlebreton at haproxy.com).

**Comment by rlebreton** [comment]
Do you use actual CA-signed certificate on your bind line or self signed test certificates ? I'm just asking to be sure because when I test with self signed certificates I do see what you describe (first handshake fails then second one succeeds) but it seems to be because the browser does not like my certificate (I get a "Certificate unknown" error).
Could you run the same test with TLS1.2 and send me the pcap please ? There might be a bit more info in the handshake than with TLS1.3.

**Comment by sikysikov** [comment]
The server certificate is a valid Let's Encrypt certificate (CA: R13), not self-signed. The client CA is a private CA used for issuing client certificates. Both are properly chained. I'll provide a TLS 1.2 PCAP shortly.
