### ISSUE TITLE
DNS Server templates: TCP healthcheck connection refused after host is removed and readded via DNS

### ISSUE THREAD

**Issue by boi4** [haproxy/haproxy#2578]
### Detailed Description of the Problem

In the latest HAProxy 3.0-dev12 container, when using server-templates with DNS discovery (A records) + TCP healthchecks, after a DNS entry has disappeared and later re-appeared, the TCP health check fails with that server "L4 Conneciton Refused" (although the server is reachable) and marks the corresponding server as down.

I could also reproduce this bug starting with 3.0-dev1 and also with the debian version of it. In HAProxy 2.9, the bug does not appear.

### Expected Behavior

After the DNS Entry has re-appeared and is reachable, the health check should pass and HAProxy should forward requests to the server.

### Steps to Reproduce the Behavior

1. Put the config from below into a file called `haproxy.cfg`
2. Make sure to enable and run systemd-resolved or a similar DNS server (adjust the myresolver accordingly)
3. Add an entry to the `/etc/hosts` file. For example, `127.0.0.1 myhost`
4. Start a http service on localhost port 8000. For example, `python3 -m http.server`
5. Run HAProxy via `docker run -it --network host -v $PWD/haproxy.cfg:/usr/local/etc/haproxy/haproxy.cfg --rm haproxy:3.0-dev`.
6. Remove the `myhost` entry from `/etc/hosts` and wait for HAProxy to mark the server+backend as down.
7. Readd  the `myhost` entry to `/etc/hosts` and observe the following output from HAProxy:
```
[NOTICE]   (1) : New worker (8) forked
[NOTICE]   (1) : Loading success.
[WARNING]  (8) : Server mybackend/myserver1 is going DOWN for maintenance (DNS refused status). 0 active and 0 backup servers left. 0 sessions active, 0 requeued, 0 remaining in queue.
[ALERT]    (8) : backend 'mybackend' has no server available!
[WARNING]  (8) : mybackend/myserver1: IP changed from '(none)' to '127.0.0.1' by 'myresolver/ns1'.
[WARNING]  (8) : Server mybackend/myserver1 ('myhost') is UP/READY (resolves again).
[WARNING]  (8) : Server mybackend/myserver1 administratively READY thanks to valid DNS answer.
[WARNING]  (8) : Server mybackend/myserver1 is DOWN, reason: Layer4 connection problem, info: "Connection refused", check duration: 0ms. 0 active and 0 backup servers left. 0 sessions active, 0 requeued, 0 remaining in queue.
```

### Do you have any idea what may have caused this?

I have sniffed localhost with wireshark and observed the following TCP health checks at the beginning:
```
No.	Time       Source	Destination	Protocol	Length	Info
1363	193.805402113	127.0.0.1	127.0.0.1	TCP	74	38822 → 8000 [SYN] Seq=0 Win=33280 Len=0 MSS=65495 SACK_PERM TSval=2066562200 TSecr=0 WS=128
1364	193.805433382	127.0.0.1	127.0.0.1	TCP	74	8000 → 38822 [SYN, ACK] Seq=0 Ack=1 Win=33280 Len=0 MSS=65495 SACK_PERM TSval=2066562200 TSecr=2066562200 WS=128
```
After the DNS entry has been removed and readded, the TCP health check suddendly tries to connect to port 0:
```
No.	        Time	Source	Destination	Protocol	Length	Info
1581	225.850715363	127.0.0.1	127.0.0.1	TCP	74	51112 → 0 [SYN] Seq=0 Win=33280 Len=0 MSS=65495 SACK_PERM TSval=2066594246 TSecr=0 WS=128
1582	225.850737514	127.0.0.1	127.0.0.1	TCP	54	0 → 51112 [RST, ACK] Seq=1 Ack=1 Win=0 Len=0
```

### Do you have an idea how to solve the issue?

Speculation: After the DNS entry re-appears some struct is zero-initialized and the port is not copied over from the server-template.

### What is your configuration?

```haproxy
global
    log stdout len 4096 format raw local0 info
    maxconn  300

defaults
    mode     http
    timeout  connect 5s
    timeout  client  10s
    timeout  server  10s

resolvers myresolver
    # systemd-resolved in my case
    nameserver ns1 127.0.0.53:53

frontend myfrontend
    mode http
    bind 127.0.0.1:8080

use_backend mybackend

backend mybackend
    mode http
    server-template myserver 1 myhost:8000 check inter 1s resolvers myresolver
```
```


### Output of `haproxy -vv`

```plain
HAProxy version 3.0-dev12-d236b43 2024/05/18 - https://haproxy.org/
Status: development branch - not safe for use in production.
Known bugs: https://github.com/haproxy/haproxy/issues?q=is:issue+is:open
Running on: Linux 6.9.1-arch1-1 #1 SMP PREEMPT_DYNAMIC Fri, 17 May 2024 16:56:38 +0000 x86_64
Build options :
  TARGET  = linux-glibc
  CC      = cc
  CFLAGS  = -O2 -g -fwrapv
  OPTIONS = USE_GETADDRINFO=1 USE_OPENSSL=1 USE_LUA=1 USE_PROMEX=1 USE_PCRE2=1 USE_PCRE2_JIT=1
  DEBUG   = 

Feature list : -51DEGREES +ACCEPT4 +BACKTRACE -CLOSEFROM +CPU_AFFINITY +CRYPT_H -DEVICEATLAS +DL -ENGINE +EPOLL -EVPORTS +GETADDRINFO -KQUEUE -LIBATOMIC +LIBCRYPT +LINUX_CAP +LINUX_SPLICE +LINUX_TPROXY +LUA +MATH -MEMORY_PROFILING +NETFILTER +NS -OBSOLETE_LINKER +OPENSSL -OPENSSL_AWSLC -OPENSSL_WOLFSSL -OT -PCRE +PCRE2 +PCRE2_JIT -PCRE_JIT +POLL +PRCTL -PROCCTL +PROMEX -PTHREAD_EMULATION -QUIC -QUIC_OPENSSL_COMPAT +RT +SHM_OPEN +SLZ +SSL -STATIC_PCRE -STATIC_PCRE2 +SYSTEMD +TFO +THREAD +THREAD_DUMP +TPROXY -WURFL -ZLIB

Default settings :
  bufsize = 16384, maxrewrite = 1024, maxpollevents = 200

Built with multi-threading support (MAX_TGROUPS=16, MAX_THREADS=256, default=16).
Built with OpenSSL version : OpenSSL 3.0.11 19 Sep 2023
Running on OpenSSL version : OpenSSL 3.0.11 19 Sep 2023
OpenSSL library supports TLS extensions : yes
OpenSSL library supports SNI : yes
OpenSSL library supports : TLSv1.0 TLSv1.1 TLSv1.2 TLSv1.3
OpenSSL providers loaded : default
Built with Lua version : Lua 5.4.4
Built with the Prometheus exporter as a service
Built with network namespace support.
Built with libslz for stateless compression.
Compression algorithms supported : identity("identity"), deflate("deflate"), raw-deflate("deflate"), gzip("gzip")
Built with transparent proxy support using: IP_TRANSPARENT IPV6_TRANSPARENT IP_FREEBIND
Built with PCRE2 version : 10.42 2022-12-11
PCRE2 library supports JIT : yes
Encrypted password support via crypt(3): yes
Built with gcc compiler version 12.2.0

Available polling systems :
      epoll : pref=300,  test result OK
       poll : pref=200,  test result OK
     select : pref=150,  test result OK
Total: 3 (3 usable), will use epoll.

Available multiplexer protocols :
(protocols marked as <default> cannot be specified using 'proto' keyword)
         h2 : mode=HTTP  side=FE|BE  mux=H2    flags=HTX|HOL_RISK|NO_UPG
       fcgi : mode=HTTP  side=BE     mux=FCGI  flags=HTX|HOL_RISK|NO_UPG
  <default> : mode=HTTP  side=FE|BE  mux=H1    flags=HTX
         h1 : mode=HTTP  side=FE|BE  mux=H1    flags=HTX|NO_UPG
  <default> : mode=TCP   side=FE|BE  mux=PASS  flags=
       none : mode=TCP   side=FE|BE  mux=PASS  flags=NO_UPG

Available services : prometheus-exporter
Available filters :
	[BWLIM] bwlim-in
	[BWLIM] bwlim-out
	[CACHE] cache
	[COMP] compression
	[FCGI] fcgi-app
	[SPOE] spoe
	[TRACE] trace
```
```


### Last Outputs and Backtraces

_No response_

### Additional Information

_No response_

**Comment by wtarreau** [comment]
Thanks for your report! I'm wondering if it couldn't be related to this patch that went into 3.0-dev1: 64c9c8ef39 ("BUG/MINOR: server/dns: use server_set_inetaddr() to unset srv addr from DNS"). It precisely changes the way the server address and port are reset, in order to address a race condition that did exist previously. The way it updates the port is not clear to me, I've lost track about it but I'm not much at ease with the event handler API so I could be missing something. @Darlelet any idea ?

**Comment by Darlelet** [comment]
@wtarreau indeed, there could be an issue in this patch serie or a side-effect due to the postponed address:port update, I must check :/
I remember that I did test server-templating and removing/adding servers via DNS, but perhaps I didn't check how it behaves with tcp checks.

I'll give it a look and report back (I should be able to reproduce on my end), thanks for opening the issue

**Comment by Darlelet** [comment]
I was able to reproduce :)

@wtarreau you were correct, regression was indeed introduced by 64c9c8e!

except for `resolv_srvrq_cleanup_srv()` (when SRV records time out), we must only clear the server's address, not the port (because with A or AAAA records the port is learned at parsing time from the config, and not from DNS, thus we must never clear it unless we're asked to, ie: from cli) to comply with pre `3.0-dev1` behavior.

This patch should correct the issue (the redacted patch should land soon):
```diff
diff --git a/src/resolvers.c b/src/resolvers.c
index 1a0020b63..47b0cce44 100644
--- a/src/resolvers.c
+++ b/src/resolvers.c
@@ -725,7 +725,7 @@ static void resolv_srvrq_cleanup_srv(struct server *srv)
 	ha_free(&srv->hostname_dn);
 	srv->hostname_dn_len = 0;
 	memset(&srv_addr, 0, sizeof(srv_addr));
-	/* unset server's addr */
+	/* unset server's addr AND port */
 	server_set_inetaddr(srv, &srv_addr, SERVER_INETADDR_UPDATER_NONE, NULL);
 	srv->flags |= SRV_F_NO_RESOLUTION;
 
diff --git a/src/server.c b/src/server.c
index 48984fe5c..af02e37f2 100644
--- a/src/server.c
+++ b/src/server.c
@@ -4546,8 +4546,9 @@ int snr_resolution_cb(struct resolv_requester *requester, struct dns_counters *c
 	if (has_no_ip && !snr_set_srv_down(s)) {
 		struct server_inetaddr srv_addr;
 
-		memset(&srv_addr, 0, sizeof(srv_addr));
-		/* unset server's addr */
+		/* unset server's addr, keep port */
+		server_get_inetaddr(s, &srv_addr);
+		memset(&srv_addr.addr, 0, sizeof(srv_addr.addr));
 		server_set_inetaddr(s, &srv_addr, SERVER_INETADDR_UPDATER_NONE, NULL);
 	}
 	return 1;
@@ -4560,8 +4561,9 @@ int snr_resolution_cb(struct resolv_requester *requester, struct dns_counters *c
 	if (has_no_ip && !snr_set_srv_down(s)) {
 		struct server_inetaddr srv_addr;
 
-		memset(&srv_addr, 0, sizeof(srv_addr));
-		/* unset server's addr */
+		/* unset server's addr, keep port */
+		server_get_inetaddr(s, &srv_addr);
+		memset(&srv_addr.addr, 0, sizeof(srv_addr.addr));
 		server_set_inetaddr(s, &srv_addr, SERVER_INETADDR_UPDATER_NONE, NULL);
 	}
 	return 0;
@@ -4646,8 +4648,9 @@ int snr_resolution_error_cb(struct resolv_requester *requester, int error_code)
 	if (!snr_set_srv_down(s)) {
 		struct server_inetaddr srv_addr;
 
-		memset(&srv_addr, 0, sizeof(srv_addr));
-		/* unset server's addr */
+		/* unset server's addr, keep port */
+		server_get_inetaddr(s, &srv_addr);
+		memset(&srv_addr.addr, 0, sizeof(srv_addr.addr));
 		server_set_inetaddr(s, &srv_addr, SERVER_INETADDR_UPDATER_NONE, NULL);
 		HA_SPIN_UNLOCK(SERVER_LOCK, &s->lock);
 		resolv_detach_from_resolution_answer_items(requester->resolution, requester);
```

@boi4 thanks again for reporting this, you spare us from another unexpected regression as we're getting very close to 3.0 release.

**Comment by wtarreau** [comment]
Cool! That's the advantage of well-documented issues ;-)

**Comment by Darlelet** [comment]
Indeed, thanks guys, and sorry for the inconvenience 

...now merged! :)

**Comment by boi4** [comment]
Thank you two for the quick response and for the great work you're doing :)
