### ISSUE TITLE
pool-purge-delay enforced even if the connection is not idle

### ISSUE THREAD

**Issue by bedis** [haproxy/haproxy#473]
# Output of `haproxy -vv` and `uname -a`
```
Linux itchy 4.15.0-74-generic #84-Ubuntu SMP Thu Dec 19 08:06:28 UTC 2019 x86_64 x86_64 x86_64 GNU/Linux

HA-Proxy version 2.0.12-ba0244-39 2020/01/24 - https://haproxy.org/
Build options :
  TARGET  = linux-glibc
  CPU     = generic
  CC      = gcc
  CFLAGS  = -O2 -g -fno-strict-aliasing -Wdeclaration-after-statement -fwrapv -Wno-unused-label -Wno-sign-compare -Wno-unused-parameter -Wno-old-style-declaration -Wno-ignored-qualifiers -Wno-clobbered -Wno-missing-field-initializers -Wno-implicit-fallthrough -Wno-stringop-overflow -Wtype-limits -Wshift-negative-value -Wshift-overflow=2 -Wduplicated-cond -Wnull-dereference
  OPTIONS = USE_PCRE=1 USE_OPENSSL=1 USE_LUA=1 USE_SLZ=1

Feature list : +EPOLL -KQUEUE -MY_EPOLL -MY_SPLICE +NETFILTER +PCRE -PCRE_JIT -PCRE2 -PCRE2_JIT +POLL -PRIVATE_CACHE +THREAD -PTHREAD_PSHARED -REGPARM -STATIC_PCRE -STATIC_PCRE2 +TPROXY +LINUX_TPROXY +LINUX_SPLICE +LIBCRYPT +CRYPT_H -VSYSCALL +GETADDRINFO +OPENSSL +LUA +FUTEX +ACCEPT4 -MY_ACCEPT4 -ZLIB +SLZ +CPU_AFFINITY +TFO +NS +DL +RT -DEVICEATLAS -51DEGREES -WURFL -SYSTEMD -OBSOLETE_LINKER +PRCTL +THREAD_DUMP -EVPORTS

Default settings :
  bufsize = 16384, maxrewrite = 1024, maxpollevents = 200

Built with multi-threading support (MAX_THREADS=64, default=4).
Built with OpenSSL version : OpenSSL 1.1.1c  28 May 2019
Running on OpenSSL version : OpenSSL 1.1.1c  28 May 2019
OpenSSL library supports TLS extensions : yes
OpenSSL library supports SNI : yes
OpenSSL library supports : TLSv1.0 TLSv1.1 TLSv1.2 TLSv1.3
Built with Lua version : Lua 5.3.4
Built with network namespace support.
Built with transparent proxy support using: IP_TRANSPARENT IPV6_TRANSPARENT IP_FREEBIND
Built with libslz for stateless compression.
Compression algorithms supported : identity("identity"), deflate("deflate"), raw-deflate("deflate"), gzip("gzip")
Built with PCRE version : 8.39 2016-06-14
Running on PCRE version : 8.39 2016-06-14
PCRE library supports JIT : no (USE_PCRE_JIT not set)
Encrypted password support via crypt(3): yes

Available polling systems :
      epoll : pref=300,  test result OK
       poll : pref=200,  test result OK
     select : pref=150,  test result OK
Total: 3 (3 usable), will use epoll.

Available multiplexer protocols :
(protocols marked as <default> cannot be specified using 'proto' keyword)
              h2 : mode=HTTP       side=FE        mux=H2
              h2 : mode=HTX        side=FE|BE     mux=H2
       <default> : mode=HTX        side=FE|BE     mux=H1
       <default> : mode=TCP|HTTP   side=FE|BE     mux=PASS

Available services : none

Available filters :
        [SPOE] spoe
        [COMP] compression
        [CACHE] cache
        [TRACE] trace
```

## What's the configuration?

```
global
 stats socket unix@./socket level admin
 nbthread 1
 log stdout format raw local0 info
 tune.ssl.default-dh-param 1024

defaults
 log global
 log-format %rt
 timeout client 10s
 timeout server 10s
 timeout connect 5s
 mode http
 default-server inter 60s fall 3 rise 3

frontend f
 bind 127.0.0.1:9000 ssl crt ./www.haproxy.local.pem alpn h2,h1
 default_backend b

backend b
 http-reuse aggressive
 server sslh2mtls 127.0.0.1:9005  ssl ca-file ./ca.crt crt ./www.haproxy.local.pem proto h2 alpn h2
```

Webserver is nginx, here is the configuration:
```
worker_processes  1;
#error_log  logs/error.log;
#pid        logs/nginx.pid;
#worker_rlimit_nofile 8192;

events {
  worker_connections  4096;  ## Default: 1024
}

http {
  keepalive_requests 4294967295;

  index index.html index.htm
  access_log   /home/baptiste/labs/nginx/logs/access.log;
  error_log    /home/baptiste/labs/nginx/logs/debug.log   debug;

  server {
    listen 9001;
    listen 9002 ssl;
    listen 9003 ssl http2;

    server_name _;
    root /home/baptiste/labs/nginx/wwwroot/;

    ssl_certificate /home/baptiste/ca/www.haproxy.local.crt;
    ssl_certificate_key /home/baptiste/ca/www.haproxy.local.key;

    ssl_protocols TLSv1.2;
  }

  server {
    listen 9004 ssl;
    listen 9005 ssl http2;

    server_name _;
    root /home/baptiste/labs/nginx/wwwroot/;

    ssl_certificate /home/baptiste/ca/www.haproxy.local.crt;
    ssl_certificate_key /home/baptiste/ca/www.haproxy.local.key;

    # mTLS
    ssl_verify_client on;
    ssl_client_certificate /home/baptiste/ca/ca.crt;

    ssl_protocols TLSv1.2;
  }
}

```

## Steps to reproduce the behavior

1. run nginx with the configuration above
2. run HAProxy with the configuration above `haproxy -db -f ./haproxy.cfg`
3. run tcpdump to capture syn on port 9005 (port used by HAProxy to reach nginx: `sudo tcpdump -ttttt -nn -i lo "tcp[tcpflags] & (tcp-syn) != 0" and dst port '(9001 or 9002 or 9003 or 9004 or 9005)'`
4. run curl in a loop every 1s: `while true ; do curl https://127.0.0.1:9000/ ; sleep 1 ; done`

## Actual behavior

After 5s (default value for `pool-purge-delay`), HAProxy closes the connection and opens a new one.
This can easily be observed by checking the output of tcpdump while the bash loop is running
```
 00:00:00.000000 IP 127.0.0.1.18601 > 127.0.0.1.9005: Flags [S], seq 669315428, win 65495, options [mss 65495,sackOK,TS val 2538739680 ecr 0,nop,wscale 7], length 0
 00:00:05.185722 IP 127.0.0.1.18647 > 127.0.0.1.9005: Flags [S], seq 118839801, win 65495, options [mss 65495,sackOK,TS val 2538744866 ecr 0,nop,wscale 7], length 0
 00:00:10.431792 IP 127.0.0.1.18691 > 127.0.0.1.9005: Flags [S], seq 3535758699, win 65495, options [mss 65495,sackOK,TS val 2538750112 ecr 0,nop,wscale 7], length 0
```

## Expected behavior

All traffic should pass through the established socket since we don't have those 5s of idle time

## Do you have any idea what may have caused this?

no

## Do you have an idea how to solve the issue?

might be due to an idle timer not updated on the connection or a bug in the purge function

**Comment by capflam** [comment]
@bedis, I don't know if this issue is still relevant. can we close it or do we still have to investigate ?

**Comment by capflam** [comment]
I'm closing this issue now. Feel free to reopen it if necessary.
