### ISSUE TITLE
When do Default Server settings apply?

### ISSUE THREAD

**Issue by ygkat** [haproxy/haproxy#2885]
### Detailed Description of the Problem

The following default settings are applied

`default-server maxconn 2000 inter 5s fastinter 2s downinter 10s rise 3 fall 2 slowstart 10s`

When adding a server to the backend using add server without specifying the inter option, the health check operates with the default inter value of 2 seconds instead of the expected default of 5 seconds. However, after restarting the service, the inter 5s setting from default-server is applied.

ex) `add server bkname/testsrv 10.10.10.10:80 check weight 1 maxconn 20000`

I expected the default-server settings(5s) to take effect immediately. Is this the intended behavior?

```bash
tcpdump: verbose output suppressed, use -v or -vv for full protocol decode
listening on any, link-type LINUX_SLL (Linux cooked), capture size 262144 bytes
17:16:32.891178 IP 10.0.0.1.53770 > 10.0.0.2.http: Flags [S], seq 3296218329, win 42340, options [mss 1460,sackOK,TS val 3051754203 ecr 0,nop,wscale 11], length 0
17:16:32.893162 IP 10.0.0.2.http > 10.0.0.1.53770: Flags [S.], seq 3814645763, ack 3296218330, win 28960, options [mss 1460,sackOK,TS val 2385610548 ecr 3051754203,nop,wscale 7], length 0
17:16:32.893275 IP 10.0.0.1.53770 > 10.0.0.2.http: Flags [P.], seq 1:108, ack 1, win 21, options [nop,nop,TS val 3051754205 ecr 2385610548], length 107: HTTP: GET /health-check HTTP/1.1
17:16:32.895204 IP 10.0.0.2.http > 10.0.0.1.53770: Flags [.], ack 108, win 227, options [nop,nop,TS val 2385610550 ecr 3051754205], length 0
17:16:32.895322 IP 10.0.0.2.http > 10.0.0.1.53770: Flags [P.], seq 1:304, ack 108, win 227, options [nop,nop,TS val 2385610550 ecr 3051754205], length 303: HTTP: HTTP/1.1 200 OK
17:16:32.895394 IP 10.0.0.2.http > 10.0.0.1.53770: Flags [F.], seq 304, ack 108, win 227, options [nop,nop,TS val 2385610550 ecr 3051754205], length 0
17:16:32.895491 IP 10.0.0.1.53770 > 10.0.0.2.http: Flags [R.], seq 108, ack 305, win 22, options [nop,nop,TS val 0 ecr 2385610550], length 0

17:16:34.812983 IP 10.0.0.1.53774 > 10.0.0.2.http: Flags [S], seq 3258558252, win 42340, options [mss 1460,sackOK,TS val 3051756125 ecr 0,nop,wscale 11], length 0
17:16:34.814950 IP 10.0.0.2.http > 10.0.0.1.53774: Flags [S.], seq 1009316655, ack 3258558253, win 28960, options [mss 1460,sackOK,TS val 2385612470 ecr 3051756125,nop,wscale 7], length 0
17:16:34.815025 IP 10.0.0.1.53774 > 10.0.0.2.http: Flags [P.], seq 1:108, ack 1, win 21, options [nop,nop,TS val 3051756127 ecr 2385612470], length 107: HTTP: GET /health-check HTTP/1.1
17:16:34.816947 IP 10.0.0.2.http > 10.0.0.1.53774: Flags [.], ack 108, win 227, options [nop,nop,TS val 2385612472 ecr 3051756127], length 0
17:16:34.817223 IP 10.0.0.2.http > 10.0.0.1.53774: Flags [P.], seq 1:304, ack 108, win 227, options [nop,nop,TS val 2385612472 ecr 3051756127], length 303: HTTP: HTTP/1.1 200 OK
17:16:34.817269 IP 10.0.0.2.http > 10.0.0.1.53774: Flags [F.], seq 304, ack 108, win 227, options [nop,nop,TS val 2385612472 ecr 3051756127], length 0
17:16:34.817307 IP 10.0.0.1.53774 > 10.0.0.2.http: Flags [R.], seq 108, ack 305, win 22, options [nop,nop,TS val 0 ecr 2385612472], length 0

```

### Expected Behavior

I expected the default-server settings to take effect immediately

### Steps to Reproduce the Behavior

It occurs when adding a server using the add server command after setting default-server.

### What is your configuration?

```haproxy
`default-server maxconn 2000 inter 5s fastinter 2s downinter 10s rise 3 fall 2 slowstart 10s`
```

### Output of `haproxy -vv`

```plain
HAProxy version 2.8.14-5
```

### Last Outputs and Backtraces

```plain

```

**Comment by wlallemand** [comment]
Hello,

Indeed this is intended:

http://docs.haproxy.org/dev/management.html#add%20server

"Also note that no settings will be
reused from an hypothetical 'default-server' statement in the same backend."

**Comment by ygkat** [comment]
Hello sir,

Oops, I missed something.

thank you.
