### ISSUE TITLE
Quic ERR_HANDSHAKE_TIMEOUT with haproxy 3.2.x

### ISSUE THREAD

**Issue by awlx** [haproxy/haproxy#3141]
### Detailed Description of the Problem

When doing a curl with enforce http3 support, sometimes the connection just hangs and ends in `ERR_HANDSHAKE_TIMEOUT`. It only happens every 10-20 tries.

working curl:
```
➜  ~ curl -o/dev/null -v --http3-only https://stats.ffmuc.net -I --resolve stats.ffmuc.net:443:\[2001:678:ed0:ff00::3\]
* Added stats.ffmuc.net:443:[2001:678:ed0:ff00::3] to DNS cache
* Hostname stats.ffmuc.net was found in DNS cache
  % Total    % Received % Xferd  Average Speed   Time    Time     Time  Current
                                 Dload  Upload   Total   Spent    Left  Speed
  0     0    0     0    0     0      0      0 --:--:-- --:--:-- --:--:--     0*   Trying [2001:678:ed0:ff00::3]:443...
* SSL connection using TLSv1.3 / TLS_AES_128_GCM_SHA256 / x25519 / RSASSA-PSS
* Server certificate:
*  subject: CN=ffmuc.net
*  start date: Sep 10 14:51:12 2025 GMT
*  expire date: Dec  9 14:51:11 2025 GMT
*  subjectAltName: host "stats.ffmuc.net" matched cert's "*.ffmuc.net"
*  issuer: C=US; O=Let's Encrypt; CN=R13
*  SSL certificate verify ok.
*   Certificate level 0: Public key type RSA (2048/112 Bits/secBits), signed using sha256WithRSAEncryption
*   Certificate level 1: Public key type RSA (2048/112 Bits/secBits), signed using sha256WithRSAEncryption
*   Certificate level 2: Public key type RSA (4096/152 Bits/secBits), signed using sha256WithRSAEncryption
* Established connection to stats.ffmuc.net (2001:678:ed0:ff00::3 port 443) from fd1f:77a2:ed0d:0:c32:e82e:3822:2c93 port 56845
* using HTTP/3
* [HTTP/3] [0] OPENED stream for https://stats.ffmuc.net/
* [HTTP/3] [0] [:method: HEAD]
* [HTTP/3] [0] [:scheme: https]
* [HTTP/3] [0] [:authority: stats.ffmuc.net]
* [HTTP/3] [0] [:path: /]
* [HTTP/3] [0] [user-agent: curl/8.16.0]
* [HTTP/3] [0] [accept: */*]
> HEAD / HTTP/3
> Host: stats.ffmuc.net
> User-Agent: curl/8.16.0
> Accept: */*
>
* Request completely sent off
< HTTP/3 200
< cache-control: no-store
< content-type: text/html; charset=UTF-8
< x-content-type-options: nosniff
< x-frame-options: deny
< x-xss-protection: 1; mode=block
< date: Mon, 29 Sep 2025 08:54:02 GMT
< strict-transport-security: max-age=15768000; includeSubdomains; preload;
< x-ffmuc-edge: webfrontend05
< alt-svc: h3=":443"; ma=60
<
{ [0 bytes data]
  0     0    0     0    0     0      0      0 --:--:-- --:--:-- --:--:--     0
* Connection #0 to host stats.ffmuc.net:443 left intact
```

tcpdump output of working curl:
```
webfrontend05.in.ffmuc.net:~#  tcpdump -i vlan102 port 443 and host 2001:678:ed0:2::3 and udp -n
tcpdump: verbose output suppressed, use -v[v]... for full protocol decode
listening on vlan102, link-type EN10MB (Ethernet), snapshot length 262144 bytes
10:54:46.711180 IP6 2001:678:ed0:2::3.57903 > 2001:678:ed0:ff00::3.443: UDP, length 1200
10:54:46.713699 IP6 2001:678:ed0:2::3.57903 > 2001:678:ed0:ff00::3.443: UDP, length 1200
10:54:46.713759 IP6 2001:678:ed0:ff00::3.443 > 2001:678:ed0:2::3.57903: UDP, length 59
10:54:46.757438 IP6 2001:678:ed0:2::3.57903 > 2001:678:ed0:ff00::3.443: UDP, length 1200
10:54:46.757438 IP6 2001:678:ed0:2::3.57903 > 2001:678:ed0:ff00::3.443: UDP, length 1200
10:54:46.758671 IP6 2001:678:ed0:ff00::3.443 > 2001:678:ed0:2::3.57903: UDP, length 1232
10:54:46.758675 IP6 2001:678:ed0:ff00::3.443 > 2001:678:ed0:2::3.57903: UDP, length 1232
10:54:46.758676 IP6 2001:678:ed0:ff00::3.443 > 2001:678:ed0:2::3.57903: UDP, length 1147
10:54:46.797663 IP6 2001:678:ed0:2::3.57903 > 2001:678:ed0:ff00::3.443: UDP, length 1200
10:54:46.797663 IP6 2001:678:ed0:2::3.57903 > 2001:678:ed0:ff00::3.443: UDP, length 61
10:54:46.797663 IP6 2001:678:ed0:2::3.57903 > 2001:678:ed0:ff00::3.443: UDP, length 42
10:54:46.797697 IP6 2001:678:ed0:2::3.57903 > 2001:678:ed0:ff00::3.443: UDP, length 42
10:54:46.797697 IP6 2001:678:ed0:2::3.57903 > 2001:678:ed0:ff00::3.443: UDP, length 102
10:54:46.797973 IP6 2001:678:ed0:ff00::3.443 > 2001:678:ed0:2::3.57903: UDP, length 62
```

not working curl:
```
➜  ~ curl -o/dev/null -v --http3-only https://stats.ffmuc.net -I --resolve stats.ffmuc.net:443:\[2001:678:ed0:ff00::3\]
* Added stats.ffmuc.net:443:[2001:678:ed0:ff00::3] to DNS cache
* Hostname stats.ffmuc.net was found in DNS cache
  % Total    % Received % Xferd  Average Speed   Time    Time     Time  Current
                                 Dload  Upload   Total   Spent    Left  Speed
  0     0    0     0    0     0      0      0 --:--:-- --:--:-- --:--:--     0*   Trying [2001:678:ed0:ff00::3]:443...
  0     0    0     0    0     0      0      0 --:--:--  0:00:09 --:--:--     0* ngtcp2_conn_handle_expiry returned error: ERR_HANDSHAKE_TIMEOUT
* Failed to connect to stats.ffmuc.net port 443 after 10003 ms: Failed sending data to the peer
  0     0    0     0    0     0      0      0 --:--:--  0:00:10 --:--:--     0
* closing connection #0
curl: (55) ngtcp2_conn_handle_expiry returned error: ERR_HANDSHAKE_TIMEOUT
```

tcpdump output of not working curl:
```
10:55:03.772960 IP6 2001:678:ed0:2::3.59014 > 2001:678:ed0:ff00::3.443: UDP, length 1200
10:55:03.772960 IP6 2001:678:ed0:2::3.59014 > 2001:678:ed0:ff00::3.443: UDP, length 1200
10:55:03.773310 IP6 2001:678:ed0:ff00::3.443 > 2001:678:ed0:2::3.59014: UDP, length 59
10:55:03.911983 IP6 2001:678:ed0:2::3.59014 > 2001:678:ed0:ff00::3.443: UDP, length 1200
10:55:04.188871 IP6 2001:678:ed0:2::3.59014 > 2001:678:ed0:ff00::3.443: UDP, length 1200
10:55:04.700782 IP6 2001:678:ed0:2::3.59014 > 2001:678:ed0:ff00::3.443: UDP, length 1200
10:55:05.757112 IP6 2001:678:ed0:2::3.59014 > 2001:678:ed0:ff00::3.443: UDP, length 1200
10:55:07.874276 IP6 2001:678:ed0:2::3.59014 > 2001:678:ed0:ff00::3.443: UDP, length 1200
10:55:12.112498 IP6 2001:678:ed0:2::3.59014 > 2001:678:ed0:ff00::3.443: UDP, length 1200
10:55:13.776741 IP6 2001:678:ed0:2::3.59014 > 2001:678:ed0:ff00::3.443: UDP, length 1200
10:55:13.776858 IP6 2001:678:ed0:ff00::3.443 > 2001:678:ed0:2::3.59014: UDP, length 58
```

curl version used:
```
➜  ~ curl --version
curl 8.16.0 (aarch64-apple-darwin25.0.0) libcurl/8.16.0 OpenSSL/3.5.2 zlib/1.2.12 brotli/1.1.0 zstd/1.5.7 AppleIDN libssh2/1.11.1 nghttp2/1.67.1 ngtcp2/1.16.0 nghttp3/1.12.0 librtmp/2.3
Release-Date: 2025-09-10
Protocols: dict file ftp ftps gopher gophers http https imap imaps ipfs ipns ldap ldaps mqtt pop3 pop3s rtmp rtsp scp sftp smb smbs smtp smtps telnet tftp ws wss
Features: alt-svc AsynchDNS brotli GSS-API HSTS HTTP2 HTTP3 HTTPS-proxy IDN IPv6 Kerberos Largefile libz NTLM SPNEGO SSL threadsafe TLS-SRP UnixSockets zstd
```

### Expected Behavior

Curl works every time.

### Steps to Reproduce the Behavior

Run curl multiple times like this:
```
curl -o/dev/null -v --http3-only https://stats.ffmuc.net -I --resolve stats.ffmuc.net:443:\[2001:678:ed0:ff00::3\]
curl -o/dev/null -v --http3-only https://stats.ffmuc.net -I -4 --resolve stats.ffmuc.net:443:185.150.99.3
```

### What is your configuration?

https://github.com/freifunkMUC/ffmuc-salt-public/blob/main/haproxy/haproxy.cfg

### Output of `haproxy -vv`

```plain
HAProxy version 3.2.5-1ppa1~noble 2025/09/26 - https://haproxy.org/
Status: long-term supported branch - will stop receiving fixes around Q2 2030.
Known bugs: http://www.haproxy.org/bugs/bugs-3.2.5.html
Running on: Linux 6.8.0-83-generic #83-Ubuntu SMP PREEMPT_DYNAMIC Fri Sep  5 21:46:54 UTC 2025 x86_64
Build options :
  TARGET  = linux-glibc
  CC      = x86_64-linux-gnu-gcc
  CFLAGS  = -O2 -g -fwrapv -g -O2 -fno-omit-frame-pointer -mno-omit-leaf-frame-pointer -flto=auto -ffat-lto-objects -fstack-protector-strong -fstack-clash-protection -Wformat -Werror=format-security -fcf-protection -fdebug-prefix-map=/build/haproxy-lF8h75/haproxy-3.2.5=/usr/src/haproxy-3.2.5-1ppa1~noble -Wdate-time -D_FORTIFY_SOURCE=3
  OPTIONS = USE_OPENSSL=1 USE_LUA=1 USE_SLZ=1 USE_OT=1 USE_QUIC=1 USE_PROMEX=1 USE_PCRE2=1 USE_PCRE2_JIT=1 USE_QUIC_OPENSSL_COMPAT=1
  DEBUG   =

Feature list : -51DEGREES +ACCEPT4 +BACKTRACE -CLOSEFROM +CPU_AFFINITY +CRYPT_H -DEVICEATLAS +DL -ENGINE +EPOLL -EVPORTS +GETADDRINFO -KQUEUE -LIBATOMIC +LIBCRYPT +LINUX_CAP +LINUX_SPLICE +LINUX_TPROXY +LUA +MATH -MEMORY_PROFILING +NETFILTER +NS -OBSOLETE_LINKER +OPENSSL -OPENSSL_AWSLC -OPENSSL_WOLFSSL +OT -PCRE +PCRE2 +PCRE2_JIT -PCRE_JIT +POLL +PRCTL -PROCCTL +PROMEX -PTHREAD_EMULATION +QUIC +QUIC_OPENSSL_COMPAT +RT +SLZ +SSL -STATIC_PCRE -STATIC_PCRE2 +TFO +THREAD +THREAD_DUMP +TPROXY -WURFL -ZLIB +ACME

Default settings :
  bufsize = 16384, maxrewrite = 1024, maxpollevents = 200

Built with multi-threading support (MAX_TGROUPS=32, MAX_THREADS=1024, default=6).
Built with SSL library version : OpenSSL 3.0.13 30 Jan 2024
Running on SSL library version : OpenSSL 3.0.13 30 Jan 2024
SSL library supports TLS extensions : yes
SSL library supports SNI : yes
SSL library supports : TLSv1.0 TLSv1.1 TLSv1.2 TLSv1.3
OpenSSL providers loaded : default
QUIC: connection socket-owner mode support : yes
QUIC: GSO emission support : yes
Built with Lua version : Lua 5.4.6
Built with the Prometheus exporter as a service
Built with network namespace support.
Built with OpenTracing support.
Built with libslz for stateless compression.
Compression algorithms supported : identity("identity"), deflate("deflate"), raw-deflate("deflate"), gzip("gzip")
Built with transparent proxy support using: IP_TRANSPARENT IPV6_TRANSPARENT IP_FREEBIND
Built with PCRE2 version : 10.42 2022-12-11
PCRE2 library supports JIT : yes
Encrypted password support via crypt(3): yes
Built with gcc compiler version 13.3.0

Available polling systems :   
      epoll : pref=300,  test result OK
       poll : pref=200,  test result OK
     select : pref=150,  test result OK
Total: 3 (3 usable), will use epoll.

Available multiplexer protocols :
(protocols marked as <default> cannot be specified using 'proto' keyword)
       quic : mode=HTTP  side=FE     mux=QUIC  flags=HTX|NO_UPG|FRAMED
         h2 : mode=HTTP  side=FE|BE  mux=H2    flags=HTX|HOL_RISK|NO_UPG
         h1 : mode=HTTP  side=FE|BE  mux=H1    flags=HTX|NO_UPG
  <default> : mode=HTTP  side=FE|BE  mux=H1    flags=HTX
       fcgi : mode=HTTP  side=BE     mux=FCGI  flags=HTX|HOL_RISK|NO_UPG
       spop : mode=SPOP  side=BE     mux=SPOP  flags=HOL_RISK|NO_UPG
  <default> : mode=SPOP  side=BE     mux=SPOP  flags=HOL_RISK|NO_UPG
       none : mode=TCP   side=FE|BE  mux=PASS  flags=NO_UPG
  <default> : mode=TCP   side=FE|BE  mux=PASS  flags=

Available services : prometheus-exporter
Available filters :
        [BWLIM] bwlim-in
        [BWLIM] bwlim-out
        [CACHE] cache
        [COMP] compression
        [FCGI] fcgi-app
        [  OT] opentracing
        [SPOE] spoe
        [TRACE] trace
```

### Last Outputs and Backtraces

```plain
echo "trace h3 level developer" | socat /run/haproxy/admin.sock  - 
echo "trace h3 sink stdout" | socat /run/haproxy/admin.sock  - 
echo "trace h3 start now" | socat /run/haproxy/admin.sock  - 

Sadly doesn't yield any message.
```

**Comment by awlx** [comment]
Here is the pcap from a hanging session:

[h3.pcap.txt](https://github.com/user-attachments/files/22593973/h3.pcap.txt)

**Comment by WRMSRwasTaken** [comment]
I am seeing the same issue with:

```
HAProxy version 3.2.4-98813a1 2025/08/13 - https://haproxy.org/
Status: long-term supported branch - will stop receiving fixes around Q2 2030.
Known bugs: http://www.haproxy.org/bugs/bugs-3.2.4.html
Running on: Linux 6.15.11-hardened1-1-hardened #1 SMP PREEMPT_DYNAMIC Mon, 25 Aug 2025 21:30:25 +0000 x86_64
Build options : 
  TARGET  = linux-glibc
  CC      = cc
  CFLAGS  = -O2 -g -fwrapv -march=x86-64 -mtune=generic -O2 -pipe -fno-plt -fexceptions -Wp,-D_FORTIFY_SOURCE=3 -Wformat -Werror=format-security -fstack-clash-protection -fcf-protection -fno-omit-frame-pointer -mno-omit-leaf-frame-pointer -flto=auto -fwrapv
  OPTIONS = USE_GETADDRINFO=1 USE_OPENSSL=1 USE_LUA=1 USE_ZLIB=1 USE_QUIC=1 USE_PROMEX=1 USE_PCRE2=1 USE_PCRE2_JIT=1
  DEBUG   = 

Feature list : -51DEGREES +ACCEPT4 +BACKTRACE -CLOSEFROM +CPU_AFFINITY +CRYPT_H -DEVICEATLAS +DL -ENGINE +EPOLL -EVPORTS +GETADDRINFO -KQUEUE -LIBATOMIC +LIBCRYPT +LINUX_CAP +LINUX_SPLICE +LINUX_TPROXY +LUA +MATH -MEMORY_PROFILING +NETFILTER +NS -OBSOLETE_LINKER +OPENSSL -OPENSSL_AWSLC -OPENSSL_WOLFSSL -OT -PCRE +PCRE2 +PCRE2_JIT -PCRE_JIT +POLL +PRCTL -PROCCTL +PROMEX -PTHREAD_EMULATION +QUIC -QUIC_OPENSSL_COMPAT +RT -SLZ +SSL -STATIC_PCRE -STATIC_PCRE2 +TFO +THREAD +THREAD_DUMP +TPROXY -WURFL +ZLIB +ACME

Default settings :
  bufsize = 16384, maxrewrite = 1024, maxpollevents = 200

Built with multi-threading support (MAX_TGROUPS=32, MAX_THREADS=1024, default=64).
Built with SSL library version : OpenSSL 3.5.2 5 Aug 2025
Running on SSL library version : OpenSSL 3.5.3 16 Sep 2025
SSL library supports TLS extensions : yes
SSL library supports SNI : yes
SSL library supports : TLSv1.0 TLSv1.1 TLSv1.2 TLSv1.3
OpenSSL providers loaded : default
QUIC: connection socket-owner mode support : yes
QUIC: GSO emission support : yes
Built with Lua version : Lua 5.4.8
Built with the Prometheus exporter as a service
Built with network namespace support.
Built with zlib version : 1.3.1
Running on zlib version : 1.3.1
Compression algorithms supported : identity("identity"), deflate("deflate"), raw-deflate("deflate"), gzip("gzip")
Built with transparent proxy support using: IP_TRANSPARENT IPV6_TRANSPARENT IP_FREEBIND
Built with PCRE2 version : 10.46 2025-08-27
PCRE2 library supports JIT : yes
Encrypted password support via crypt(3): yes
Built with gcc compiler version 15.2.1 20250813

Available polling systems :
      epoll : pref=300,  test result OK
       poll : pref=200,  test result OK
     select : pref=150,  test result OK
Total: 3 (3 usable), will use epoll.

Available multiplexer protocols :
(protocols marked as <default> cannot be specified using 'proto' keyword)
       quic : mode=HTTP  side=FE     mux=QUIC  flags=HTX|NO_UPG|FRAMED
         h2 : mode=HTTP  side=FE|BE  mux=H2    flags=HTX|HOL_RISK|NO_UPG
         h1 : mode=HTTP  side=FE|BE  mux=H1    flags=HTX|NO_UPG
  <default> : mode=HTTP  side=FE|BE  mux=H1    flags=HTX
       fcgi : mode=HTTP  side=BE     mux=FCGI  flags=HTX|HOL_RISK|NO_UPG
       spop : mode=SPOP  side=BE     mux=SPOP  flags=HOL_RISK|NO_UPG
  <default> : mode=SPOP  side=BE     mux=SPOP  flags=HOL_RISK|NO_UPG
       none : mode=TCP   side=FE|BE  mux=PASS  flags=NO_UPG
  <default> : mode=TCP   side=FE|BE  mux=PASS  flags=

Available services : prometheus-exporter
Available filters :
	[BWLIM] bwlim-in
	[BWLIM] bwlim-out
	[CACHE] cache
	[COMP] compression
	[FCGI] fcgi-app
	[SPOE] spoe
	[TRACE] trace
```
```
curl 8.16.0 (x86_64-pc-linux-gnu) libcurl/8.16.0 OpenSSL/3.5.3 zlib/1.3.1 brotli/1.1.0 zstd/1.5.7 libidn2/2.3.7 libpsl/0.21.5 libssh2/1.11.1 nghttp2/1.67.1 nghttp3/1.11.0
Release-Date: 2025-09-10
Protocols: dict file ftp ftps gopher gophers http https imap imaps ipfs ipns mqtt pop3 pop3s rtsp scp sftp smb smbs smtp smtps telnet tftp ws wss
Features: alt-svc AsynchDNS brotli GSS-API HSTS HTTP2 HTTP3 HTTPS-proxy IDN IPv6 Kerberos Largefile libz NTLM PSL SPNEGO SSL threadsafe TLS-SRP UnixSockets zstd
```
```
Linux lb 6.15.11-hardened1-1-hardened #1 SMP PREEMPT_DYNAMIC Mon, 25 Aug 2025 21:30:25 +0000 x86_64 GNU/Linux
```

~~Interestingly: I am seeing this problem on native IPv4 and IPv6 connections with a MTU of 1500, but not on a tunneled IPv6 connection with a MTU of 1446.~~
It took quite a few more tries with the tunneled connection, but I am hitting the problem there aswell.

On failing, my curl displays this:
```
  % Total    % Received % Xferd  Average Speed   Time    Time     Time  Current
                                 Dload  Upload   Total   Spent    Left  Speed
  0     0    0     0    0     0      0      0 --:--:-- --:--:-- --:--:--     0* Host wrm.sr:443 was resolved.
* IPv6: (none)
* IPv4: 213.206.184.75
*   Trying 213.206.184.75:443...
*  CAfile: /etc/ssl/certs/ca-certificates.crt
*  CApath: none
  0     0    0     0    0     0      0      0 --:--:--  0:01:10 --:--:--     0* QUIC connection has been shut down
* QUIC connect to 213.206.184.75 port 443 failed: Could not connect to server
* Failed to connect to wrm.sr port 443 after 71768 ms: Could not connect to server
  0     0    0     0    0     0      0      0 --:--:--  0:01:11 --:--:--     0
* closing connection #0
curl: (7) QUIC connection has been shut down
```

**Comment by awlx** [comment]
I also tried to play with different settings for:
```
    tune.quic.max-frame-loss 40
    tune.quic.reorder-ratio 60
```

But it doesn't seem to make any difference. Firefox users report big impact since enabling h3 as well (slow page loads and sometimes connection interruptions).

**Comment by cognet** [comment]
@awlx @WRMSRwasTaken I've been trying to reproduce the issue, but nothing so far, it seems to work fine for me.
Can you think of anything in your setup that could explain it? Do you have maybe some packet loss on your network?
Using traces was a good idea, can you maybe use "quic" instead of "h3" to get the traces, so that we get informations from the lower layer?

Thanks!

**Comment by awlx** [comment]
I've attached the `quic` traces :).

[quic-trace.txt](https://github.com/user-attachments/files/22679456/quic-trace.txt)


```
Oct 03 12:59:16 webfrontend05 haproxy[1629570]: [01|quic|5|_frame.c:1281] qc_frm_free(): leaving : qc@0x7dc83380f000 idle_timer_task@0x7dc827580800 flags=0x48
Oct 03 12:59:16 webfrontend05 haproxy[1629570]: [01|quic|5|uic_rx.c:1155] qc_parse_pkt_frms(): leaving on error : qc@0x7dc83380f000 idle_timer_task@0x7dc827580800 flags=0x48
Oct 03 12:59:16 webfrontend05 haproxy[1629570]: [01|quic|0|uic_rx.c:1294] packet parsing failed -> dropped : qc@0x7dc83380f000 idle_timer_task@0x7dc827580800 flags=0x48 pkt@0x7dc83398f000 el=I pn=2
```

This makes me curious.

Maybe it's good to know those are VMs running with virtio network drivers in my case.

I can reproduce this with multiple different DSL, Starlink and Fiber connections and towards different target servers like the one of @WRMSRwasTaken

**Comment by WRMSRwasTaken** [comment]
I wanted to get traces today aswell, but patched my systems this morning due to the OpenSSL CVE, currently I am not able to reproduce this :( Still trying...


So if @awlx also can reproduce this also to my nodes this sounds like a client issue to me.

I'm not running VMs, but rather LXC (via Incus) containers, however I am also using veth interfaces.

**Comment by krombel** [comment]
I can confirm it with curl 8.16.0 on my side as well (with both hosts)
<details>
<summary>logs</summary>

curl
```
$ bin/curl --version
curl 8.16.0 (aarch64-apple-darwin24.4.0) libcurl/8.16.0 OpenSSL/3.5.4 zlib/1.2.12 brotli/1.1.0 zstd/1.5.7 AppleIDN libssh2/1.11.1 nghttp2/1.67.1 ngtcp2/1.16.0 nghttp3/1.12.0 librtmp/2.3
Release-Date: 2025-09-10
Protocols: dict file ftp ftps gopher gophers http https imap imaps ipfs ipns ldap ldaps mqtt pop3 pop3s rtmp rtsp scp sftp smb smbs smtp smtps telnet tftp ws wss
Features: alt-svc AsynchDNS brotli GSS-API HSTS HTTP2 HTTP3 HTTPS-proxy IDN IPv6 Kerberos Largefile libz NTLM SPNEGO SSL threadsafe TLS-SRP UnixSockets zstd
```
wrm.sr
```
$ bin/curl -o/dev/null -v --http3-only https://wrm.sr -I
  % Total    % Received % Xferd  Average Speed   Time    Time     Time  Current
                                 Dload  Upload   Total   Spent    Left  Speed
  0     0    0     0    0     0      0      0 --:--:-- --:--:-- --:--:--     0* Host wrm.sr:443 was resolved.
* IPv6: 2a09:e1c1:efc1:1337::443
* IPv4: 213.206.184.75
*   Trying [2a09:e1c1:efc1:1337::443]:443...
*   Trying 213.206.184.75:443...
  0     0    0     0    0     0      0      0 --:--:--  0:00:09 --:--:--     0* ngtcp2_conn_handle_expiry returned error: ERR_HANDSHAKE_TIMEOUT
  0     0    0     0    0     0      0      0 --:--:--  0:00:10 --:--:--     0* ngtcp2_conn_handle_expiry returned error: ERR_HANDSHAKE_TIMEOUT
* Failed to connect to wrm.sr port 443 after 10205 ms: Failed sending data to the peer
  0     0    0     0    0     0      0      0 --:--:--  0:00:10 --:--:--     0
* closing connection #0
curl: (55) ngtcp2_conn_handle_expiry returned error: ERR_HANDSHAKE_TIMEOUT
```
stats.ffmuc.net
```
$ bin/curl -o/dev/null -v --http3-only https://stats.ffmuc.net -I --resolve stats.ffmuc.net:443:\[2001:678:ed0:ff00::3\]
* Added stats.ffmuc.net:443:[2001:678:ed0:ff00::3] to DNS cache
* Hostname stats.ffmuc.net was found in DNS cache
  % Total    % Received % Xferd  Average Speed   Time    Time     Time  Current
                                 Dload  Upload   Total   Spent    Left  Speed
  0     0    0     0    0     0      0      0 --:--:-- --:--:-- --:--:--     0*   Trying [2001:678:ed0:ff00::3]:443...
  0     0    0     0    0     0      0      0 --:--:--  0:00:09 --:--:--     0* ngtcp2_conn_handle_expiry returned error: ERR_HANDSHAKE_TIMEOUT
* Failed to connect to stats.ffmuc.net port 443 after 10003 ms: Failed sending data to the peer
  0     0    0     0    0     0      0      0 --:--:--  0:00:10 --:--:--     0
* closing connection #0
curl: (55) ngtcp2_conn_handle_expiry returned error: ERR_HANDSHAKE_TIMEOUT

```

</details>

**Comment by wtarreau** [comment]
Impossible as well for me to reproduce (with curl-8.14.1 as comes on deb13). I also tested with IPv6 just in case we'd have an issue there but can't spot that error. I'm pretty convinced that latency plays a role, I'll retry on a higher latency link.

**Comment by wtarreau** [comment]
Still the same over 12ms and 100ms links.

**Comment by wtarreau** [comment]
And same with openssl 3.0.13 + limited-quic. Now the next thing to try is to change the client, but rebuilding openssl+nghttp3+ngtcp2+curl is always a pain :-/ Thus if one would have either a static x86_64 binary or (more likely) just the dynamic one with all libs appearing in `ldd curl` present in a tarball, that would be an immense time saver (feel free to mail them to me if you don't know where to place them, this should remain reasonably small compressed).

**Comment by WRMSRwasTaken** [comment]
Trying to play with tc netem (delay & loss) and MTU sizes hasn't yield any meaningful results here so far, as I currently can't reproduce it. But ima keep trying...

**Comment by wtarreau** [comment]
OK thanks. Let's wait for Annika to see if it still happens for her, and yes, it's totally possible that it's a client-side issue (ssl lib, ngtcp2 etc) as well, so if it vanishes after an update we can't rule out this possibility.

**Comment by cognet** [comment]
@wtarreau I'm actually able to reproduce it, only in very specific conditions : with curl as provided on macos by homebrew, and haproxy running on my FreeBSD box (with OpenSSL 1.1.1, but I don't think the OpenSSL version matters), I'm investigating

**Comment by awlx** [comment]
That makes me curious, we have two users at Freifunk Munich reporting issues as well with Firefox (latest stable) and Win11, which I was never able to reproduce with any Chrome/Firefox derivate on MacOS only curl on MacOS showed the same(?) behaviour with stuck connections. 

I was blaming them for their adblockers etc until I was able to reproduce it with curl on Mac.

Ofc, I don't really know if it's related as it's hard to reproduce for them.

**Comment by wtarreau** [comment]
Issues in QUIC are always difficult to reproduce and observer, in part because browsers tend to give up early and to refrain from using QUIC again with the site you're testing. We've had long painful sessions like this where we didn't know why they wouldn't try anymore (there's no way to force them).

**Comment by awlx** [comment]
One of our users @GoliathLabs disabled QUIC completely in his Firefox (143.0.4.) on Windows and since then has no longer the issue of hanging connections towards the servers mentioned above. 

I've also played with some QUIC related tuning settings a bit more but it doesn't make a difference for the `curl` or `Firefox` issues.

https://github.com/freifunkMUC/ffmuc-salt-public/blob/main/haproxy/haproxy.cfg#L41-L42

For those wondering this is the setting to completely disable H3 support in Firefox.
<img width="1920" height="395" alt="Image" src="https://github.com/user-attachments/assets/003ca2bd-e1fd-4986-8996-0c2c5ee0861b" />

**Comment by wtarreau** [comment]
It's interesting that it happens with two different clients. This doesn't tell us why it fails here but it tends to reinforce the idea that the issue is well on the haproxy side. Now we still have to determine what components are participating to the problem (compatibility mode for ssl libs, openssl 3.5 lib, RTT, MTU, GSO, IPv4 vs IPv6, etc).

**Comment by awlx** [comment]
At least I can reproduce it with IPv4 and IPv6 so this seems not the be the culprit (I first thought it's IPv6 only but sadly it's not - it would make the investigation easier maybe).

I can try to disable GSO  with [tune.quic.disable-udp-gso](https://docs.haproxy.org/3.2/configuration.html#3.2-tune.quic.disable-udp-gso) if you think there is a chance this helps :).

**Comment by wtarreau** [comment]
Yeah, while I don't think that GSO has any impact at this phase, if it doesn't cost much to try, it would help narrow the issue down.

**Comment by awlx** [comment]
Disabled it but it still hangs with `curl`. So this doesn't seem to make a difference.

**Comment by wtarreau** [comment]
Thanks. Are you able to try it locally ? It would be quite helpful to know if it also fails on loopback or not, at least to reduce the diversity of components involved in the reproducing tests. For me for now it doesn't fail locally nor remotely, for different curl versions, and tested with different libs (quictls, aws-lc, openssl+limited-quic).

It might be possible that some components recently changed something which becomes incompatible with our stack, which could explain the difficulty to reproduce it.

**Comment by awlx** [comment]
Tried it on localhost with https://github.com/stunnel/static-curl/releases/download/8.16.0/curl-linux-x86_64-glibc-8.16.0.tar.xz and on a host on in the same rack also on a host farther away. I can't reproduce it with this version. 

So it maybe really something which is explicitly triggered by curl build with homebrew on MacOS and Firefox on Windows.

With this version on MacOS it also doesn't seem to happen:
https://github.com/stunnel/static-curl/releases/download/8.16.0/curl-macos-arm64-8.16.0.tar.xz

Infos about the libs used:
https://github.com/stunnel/static-curl/releases/tag/8.16.0

My still affected version uses those libs:
```
curl 8.16.0 (aarch64-apple-darwin25.0.0) libcurl/8.16.0 OpenSSL/3.6.0 zlib/1.2.12 brotli/1.1.0 zstd/1.5.7 AppleIDN libssh2/1.11.1 nghttp2/1.67.1 ngtcp2/1.16.0 nghttp3/1.12.0 librtmp/2.3
```

So the affected version uses a  newer version of nghttp3 and OpenSSL, than the one which works.

**Comment by wtarreau** [comment]
OK this is super helpful! And in addition thanks for the link to a newly built binary, it always helps, even if in this specific case it doesn't fail. I could indeed really fuel the theory of client libs vs haproxy and could explain why Olivier managed to trigger it from his mac.

**Comment by awlx** [comment]
I just checked, Firefox [uses](https://firefox-source-docs.mozilla.org/networking/http/http3.html) the [neqo library](https://github.com/mozilla/neqo) for QUIC so sadly not `nghttp3`.

**Comment by wtarreau** [comment]
Indeed, but maybe something changed recently among several libs (e.g. in reaction to a weakness or something). Still trying...

**Comment by haproxyFred** [comment]
I have not taken very much time to read all the comments here. Perhaps I have missed something. This issue really looks like the one fixed by this patch:

```
commit d753f24096dafdef227fe66621513086c2c663c1
Author: Frederic Lecaille <flecaille@haproxy.com>
Date:   Wed Aug 27 14:18:25 2025 +0200

    BUG/MINOR: quic: reorder fragmented RX CRYPTO frames by their offsets
    
    This issue impacts the QUIC listeners. It is the same as the one fixed by this
    commit:
    
            BUG/MINOR: quic: repeat packet parsing to deal with fragmented CRYPTO
    
    As chrome, ngtcp2 client decided to fragment its CRYPTO frames but in a much
    more agressive way. This could be fixed with a list local to qc_parse_pkt_frms()
    to please chrome thanks to the commit above. But this is not sufficient for
    ngtcp2 which often splits its ClientHello message into more than 10 fragments
    with very small ones. This leads the packet parser to interrupt the CRYPTO frames
    parsing due to the ncbuf gap size limit.
    
    To fix this, this patch approximatively proceeds the same way but with an
    ebtree to reorder the CRYPTO by their offsets. These frames are directly
    inserted into a local ebtree. Then this ebtree is reused to provide the
    reordered CRYPTO data to the underlying ncbuf (non contiguous buffer). This way
    there are very few less chances for the ncbufs used to store CRYPTO data
    to reach a too much fragmented state.
    
    Must be backported as far as 2.6.
```

The problem mentioned above arrived with ngtcp2 lib which began to split and mix its CRYPTO data into several frames by packet. The issue was supposed to be solved using an ebtree to store and reorder these frames by their offsets (by packet) before providing the CRYPTO data to the TLS stack thanks to a non contiguous buffer. ngtcp does this more aggressively than chrome. Before an ebtree, a list was used. This was sufficient to fix the issue with chrome as client.

I have also noted from the tcpdump traces that the curl sends more than one Initial packet. Perhaps the issue happens when the packets are not treated in the right order (by their packet number) leading to a ncbuf fragmented state which cannot be handled. A fix could be to use an ncbuf by packet.

**Comment by cognet** [comment]
@haproxyFred From what I can tell the last hipothesis may be correct, ncb_add() ends up failing because there is not enough space left for the gap.
I'll try to see what it means to have a ncbuf per packet.

**Comment by awlx** [comment]
It indeed seems to relate to ngtcp2. I can now reproduce the issue with the following config:
```
ARCHES="arm64" CURL_VERSION=8.16.0 TLS_LIB="" OPENSSL_VERSION=3.5.2 bash curl-static-mac.sh
```

```
➜  bin ./curl-macos-arm64 -V
curl 8.16.0 (aarch64-apple-darwin) libcurl/8.16.0 OpenSSL/3.5.2 zlib/1.3.1 brotli/1.1.0 zstd/1.5.7 c-ares/1.34.5 libidn2/2.3.8 libpsl/0.21.5 libssh2/1.11.1 nghttp2/1.67.1 ngtcp2/1.16.0 nghttp3/1.12.0
Release-Date: 2025-09-10
Protocols: dict file ftp ftps gopher gophers http https imap imaps ipfs ipns mqtt pop3 pop3s scp sftp smb smbs smtp smtps telnet tftp ws wss
Features: alt-svc asyn-rr AsynchDNS brotli HSTS HTTP2 HTTP3 HTTPS-proxy HTTPSRR IDN IPv6 Largefile libz NTLM PSL SSL SSLS-EXPORT threadsafe TLS-SRP TrackMemory UnixSockets zstd
```

Which uses `--with-ngtcp2`.

The issue goes away if I compile with:
```
ARCHES="arm64" CURL_VERSION=8.16.0 TLS_LIB=openssl OPENSSL_VERSION=3.5.2 bash curl-static-mac.sh
```

Which uses the flag `--with-openssl-quic` instead of `ngtcp2`.

```
./curl-macos-arm64  -V
curl 8.16.0 (aarch64-apple-darwin) libcurl/8.16.0 OpenSSL/3.5.2 zlib/1.3.1 brotli/1.1.0 zstd/1.5.7 c-ares/1.34.5 libidn2/2.3.8 libpsl/0.21.5 libssh2/1.11.1 nghttp2/1.67.1 nghttp3/1.12.0
Release-Date: 2025-09-10
Protocols: dict file ftp ftps gopher gophers http https imap imaps ipfs ipns mqtt pop3 pop3s scp sftp smb smbs smtp smtps telnet tftp ws wss
Features: alt-svc asyn-rr AsynchDNS brotli HSTS HTTP2 HTTP3 HTTPS-proxy HTTPSRR IDN IPv6 Largefile libz NTLM PSL SSL SSLS-EXPORT threadsafe TLS-SRP TrackMemory UnixSockets zstd
```


Which seems to confirm that it has something to do with the change in `CRYPTO` frames.

I used this script for the builds:
https://github.com/stunnel/static-curl/blob/main/curl-static-mac.sh

Maybe if you use the [Linux script](https://github.com/stunnel/static-curl/blob/main/curl-static-cross.sh#L750) and also force `ngtcp2` (afaik the same options can be used) being used it also fails.

**Comment by haproxyFred** [comment]
The patch I have mentioned really seemed to fix this issue. This is confirmed by the interop tests with ngtcp2 as client. I cannot reproduce this issue with a recent ngtcp2 client which always splits its CRYPTO data frames. But this client sends **only one packet with Initial CRYPTO data**. I guess the issue happens when the clients sends more than one packet with Initial CRYPTO data inside. Perhaps the issue happens only when the second packet is treated before the first one. Hmmm or perhaps the issue happens even for the first packet, only because there is too much data, too much little frames to be handled by the ncbuf. If this is the case, the issue is into the ncbuf implementation.

**Comment by awlx** [comment]
I wonder if it only happens if enough latency is induced so an additional out of order arrival etc triggers it. As I can't reproduce it on localhost so far.

**Comment by cognet** [comment]
@haproxyFred I can reproduce the issue with master, so I have that patch

**Comment by wtarreau** [comment]
OK I can finally reproduce it:
```
14:24:03.818690 IP 10.0.3.45.51676 > 10.0.3.2.4443: UDP, length 1200
14:24:03.818690 IP 10.0.3.45.51676 > 10.0.3.2.4443: UDP, length 1200
14:24:03.819048 IP 10.0.3.2.4443 > 10.0.3.45.51676: UDP, length 59
14:24:03.825669 IP 10.0.3.45.51676 > 10.0.3.2.4443: UDP, length 1200
14:24:03.838669 IP 10.0.3.45.51676 > 10.0.3.2.4443: UDP, length 1200
14:24:03.864116 IP 10.0.3.45.51676 > 10.0.3.2.4443: UDP, length 1200
14:24:03.914151 IP 10.0.3.45.51676 > 10.0.3.2.4443: UDP, length 1200
14:24:04.013546 IP 10.0.3.45.51676 > 10.0.3.2.4443: UDP, length 1200
14:24:04.211960 IP 10.0.3.45.51676 > 10.0.3.2.4443: UDP, length 1200
14:24:04.606634 IP 10.0.3.45.51676 > 10.0.3.2.4443: UDP, length 1200
14:24:05.395964 IP 10.0.3.45.51676 > 10.0.3.2.4443: UDP, length 1200
```

I used the build procedure above (beware: s/arm64/aarch64 on linux/arm):
```
$ ./release/bin/curl-linux-aarch64-glibc -V
curl 8.16.0 (aarch64-pc-linux-gnu) libcurl/8.16.0 OpenSSL/3.5.2 zlib/1.3.1 brotli/1.1.0 zstd/1.5.7 c-ares/1.34.5 libidn2/2.3.8 libpsl/0.21.5 libssh2/1.11.1 nghttp2/1.67.1 ngtcp2/1.16.0 nghttp3/1.12.0
Release-Date: 2025-09-10
Protocols: dict file ftp ftps gopher gophers http https imap imaps ipfs ipns mqtt pop3 pop3s rtsp scp sftp smb smbs smtp smtps telnet tftp ws wss
Features: alt-svc asyn-rr AsynchDNS brotli HSTS HTTP2 HTTP3 HTTPS-proxy HTTPSRR IDN IPv6 Largefile libz NTLM PSL SSL SSLS-EXPORT threadsafe TLS-SRP TrackMemory UnixSockets zstd
```

So I've built with ngtcp2 and openssl-3.5.2 like this:
```
$ ARCHES="aarch64" CURL_VERSION=8.16.0 TLS_LIB="" OPENSSL_VERSION=3.5.2 bash curl-static-cross.sh 
```

I'm just using a regular rsa2048-bit cert BTW. I'm now trying to narrow this down to the simplest config. And I confirm it fails with latest master. Now we can more easily enable traces and inject debug code!

**Comment by wtarreau** [comment]
For now it fails:
- with OpenSSL 3.0 + limited-quic
- with QuicTLS 3.0 with and without limited-quic
- with aws-lc 1.39

With the latter I issued a "show quic full" during the failed attempt, it gives this:
```
* 0x7f4fe40a9a80[05]: scid=3747743e24d1ddb9........................ dcid=453fc0bb745f63d08ff2bc97631a4d8f5f000fdb
  loc. TPs: odcid=3290f4b349d172d6b9ba4df35446df17755d4bcd iscid=3747743e24d1ddb9
    midle_timeout=30000ms mudp_payload_sz=2048 ack_delay_exp=3 mack_delay=25ms act_cid_limit=8
    md=6860400 msd_bidi_l=68604 msd_bidi_r=6174360 msd_uni=68604 ms_bidi=100 ms_uni=3
    (no_act_migr,stless_rst_tok)
  rem. TPs: iscid=
    midle_timeout=0ms mudp_payload_sz=0 ack_delay_exp=0 mack_delay=0ms act_cid_limit=0
    md=0 msd_bidi_l=0 msd_bidi_r=0 msd_uni=0 ms_bidi=0 ms_uni=0

  st=handshake        mux=null                                      expire=03s 
  fd=61               local_addr=10.0.3.2:4443 foreign_addr=10.0.3.45:56085
  [initl] rx.ackrng=1      tx.inflight=0     (0%)
  cc: state=ss ssthresh=4294967295 K=0 last_w_max=0 wdiff=12520
  srtt=333   rttvar=166  rttmin=0    ptoc=0   
  cwnd=12520             cwnd_last_max=12520 
  sentbytes=59           sentbytesgso=0            sentpkts=1     
  lostpkts=0             reorderedpkts=0     
 droppars=10    
```
The connection normally disappears after `expire` reaches 0, leaving the client in a hanging state until it times out. This indicates to me that we're dropping some packets that maybe we shouldn't.

**Comment by cognet** [comment]
We are absolutely dropping packets because we fail to add some frames to the ncbuf

**Comment by wtarreau** [comment]
OK!

I'm seeing that we're failing on this one in qc_parse_pkt_frms() (trace added locally):
```
	if (cf_err) {
		TRACE_DEVEL("goto error", QUIC_EV_CONN_PRSHPKT, qc);
		goto err;
	}
```

The only place where we set cf_err is here a few lines above:
```
		case QUIC_RX_RET_FRM_AGAIN:
			TRACE_STATE("AGAIN encountered", QUIC_EV_CONN_PRSHPKT, qc);
			cf_err = 1;
			break;
```

*But I don't understand because I'm not getting that trace. Still puzzled for now.*
Edit: It in fact is, approx 40-50 lines above, the rest was polluted by all the frames listed in qc_frm_free(). So the first error is when "AGAIN" is logged on return from qc_handle_crypto_frm():
```
<0>2025-10-06T14:47:27.091542+02:00 [02|quic|2|uic_rx.c:1120] frame handled : qc@0x7f962410b4a0(F) idle_timer_task@0x7f962411dd40 flags=0x40 frm@0x7f962412f810 CRYPTO cfoff=151 cflen=3
<0>2025-10-06T14:47:27.091543+02:00 [02|quic|5|_frame.c:1274] qc_frm_free(): entering : qc@0x7f962410b4a0(F) idle_timer_task@0x7f962411dd40 flags=0x40 frm@0x7f962412f810 CRYPTO cfoff=151 cflen=3
<0>2025-10-06T14:47:27.091544+02:00 [02|quic|5|_frame.c:1289] qc_frm_free(): leaving : qc@0x7f962410b4a0(F) idle_timer_task@0x7f962411dd40 flags=0x40
<0>2025-10-06T14:47:27.091544+02:00 [02|quic|5|quic_rx.c:672] qc_handle_crypto_frm(): entering : qc@0x7f962410b4a0(F) idle_timer_task@0x7f962411dd40 flags=0x40
<0>2025-10-06T14:47:27.091545+02:00 [02|quic|4|quic_rx.c:726] cannot bufferize frame due to gap size limit : qc@0x7f962410b4a0(F) idle_timer_task@0x7f962411dd40 flags=0x40
<0>2025-10-06T14:47:27.091546+02:00 [02|quic|5|quic_rx.c:740] qc_handle_crypto_frm(): leaving : qc@0x7f962410b4a0(F) idle_timer_task@0x7f962411dd40 flags=0x40
<0>2025-10-06T14:47:27.091547+02:00 [02|quic|3|uic_rx.c:1115] AGAIN encountered : qc@0x7f962410b4a0(F) idle_timer_task@0x7f962411dd40 flags=0x40
```

It's the NCB_RET_GAP_SIZE in return of ncb_add(), likely what Olivier mentioned. I don't know much about that part though, I seem to remember that there was a constraint when overlapping data had to be inserted and that ought not to happen, but maybe that's precisely what is being excerted by newer versions of ngtcp2.

**Comment by WRMSRwasTaken** [comment]
FWIW I'm using OpenSSL 3.5.3 without limited-quic and it happened there aswell, if that makes any difference

**Comment by GoliathLabs** [comment]
Just wanted to throw in a huge thank you for your work!!
Debugging these kinds of issues is definitely not trivial. Big shout out to all of you! :) Highly appreciated!

**Comment by wtarreau** [comment]
Given that I seem to be seeing crypto frames of 1, 2, 3, 4 and 5 bytes in this trace, my understanding is that we've reached the limitations of the current ncbuf design (it was meant to deal with reasonable sizes, e.g. small packets, not creating single-byte holes). The only approach I'm seeing here is to switch the ncbuf design to a bitmap, and reserve 11% of the size for the bitmap. It doesn't look dramatic though, and could possibly even simplify the logic. I just don't know how this may affect performance. In the worst case it would require to read/write 11% extra data into memory to update the map (basically writing 0xFF when filling, and 0x00 when emptying).

Given the number of occurrences of these calls, it doesn't seem too difficult to experiment with:
```
     12 ncb_is_null(
      9 ncb_data(
      7 ncb_advance(
      3 ncb_is_empty(
      3 ncb_add(
      2 ncb_size(
      2 ncb_make(
      2 ncb_init(
      2 ncb_head(
      1 ncb_orig(
      1 ncb_is_full(
```
The issue would be more to decide whether or not to backport this at once as it would be a sensible change!

Maybe there are still other solutions with the current design but that reminds me some whiteboard meetings long ago where we (apparently wrongly) agreed that this specific case had no valid reason to happen and that it was not a problem if we couldn't refine the granularity further.

**Comment by wtarreau** [comment]
Forgot to CC @a-denoyelle for tracking.

**Comment by awlx** [comment]
If you want testing on a real world env, I can also rollout the experiment once it's there to my non-profits `DoH` server which gets about [500req/s](https://stats.ffmuc.net/d/aab5f489-3e89-45f7-9db1-bc8f73f68936/haproxy-metrics) and we could probably see a raise in H3 usage as well. Then we can compare the real world performance difference.

That's at least something I can offer when I always give you the complicated cases :D.

**Comment by wtarreau** [comment]
Many thanks Annika, we'll definitely abuse your offer once we have something to test ;-)

**Comment by haproxyFred** [comment]
@cognet what I meant is that this issue may happen only and only if the client is built against ngtcp2 and if **it needs to send more than one packet to send its Initial CRYPTO data**. This is not common. Most of the time, a QUIC client sends only one packet to initiate the connection. So I did not want to say that the bug fix I have mentioned could fix this new issue. It could fix it only if the client sends only one packet with Initial CRYPTO data: its role is to provide the CRYPTO data to the ncbuf() in the right order thanks to the ebtree. This never fails.

This is confirmed by the QUIC traces attached to this issue (quic-trace.txt) I have noticed lately only now. The size of the CRYPTO data depends on the TLS stack and how it is configured for the connection. According to the QUIC traces, the CRYPTO data could be added to the ncbuf for the first packet but with at least a hole at 139 offset. This is when haproxy receives the second packet that the problems arise.

During the interop tests, ngtcp2 never sends two Initial packets. This is also the case on the command line. I think that this issue should be reproducible with the correct TLS stack. My recent ngtcp2 client is built againt OpenSSL 3.5.0. According to Willy, OpenSSL 3.5.2 generates more CRYPTO data for the client. Not sure this is normal at all.

So, If we can add all the CRYPTO data to an ncbuf by packet, this could be sufficient to fix this issue. Not sure this is easy to do.

**Comment by haproxyFred** [comment]
Well I have asked Tasuhiro how to make a ngtcp2 client produce more than two Initial packets (in fact datagrams). Its answer: "Easiest way is use X25519MLKEM768 if TLS stack supports it."

And I can now reproduce this issue like that with ngtcp2 client built against OpenSSL 3.5 (3.5.2 for now on on my side).

  `osslclient 127.0.0.1 4443 --groups=X25519MLKEM768`

No need to make an HTTP request. Note than when you build ngtcp2 against OpenSSL 3.5, as it uses the OSSL API, the new client example name is `osslclient`.

**Comment by a-denoyelle** [comment]
Just for the record, chrome seems to be the first one to implement fragmented CRYPTO frames, a feature labelled as "Chaos protection".

https://quiche.googlesource.com/quiche/+/cb6b51054274cb2c939264faf34a1776e0a5bab7

We already experienced issues when confronting haproxy to it and refine CRYPTO algo parsing multiple times to handle this, which seems to be enough at the time.

However, now ngtcp2 also implements a similar chaos protection.
```
commit 89c29fd8611d5e6d2f6b1f475c5e3494c376028c
Author: Tatsuhiro Tsujikawa <tatsuhiro.t@gmail.com>
Date:   Mon Aug 4 22:48:06 2025 +0900

    Crumble Client Initial CRYPTO (aka chaos protection)
```

It seems to be even more aggressive than chrome, which causes haproxy to suffer again from CRYPTO frame parsing error due to the internal limitation of our owned non contiguous buffer storage type. Thus, I'm working since this week on a new buffer implementation to definitely get rid of this internal limitation, so that haproxy is able to buffer any CRYPTO frames even under extreme fragmentation conditions.

**Comment by a-denoyelle** [comment]
@awlx and to anyone who is interested, you can try the branch [`20251014-ade-implement-ncbuf2`](https://github.com/haproxy/haproxy/tree/20251014-ade-implement-ncbuf2) which should solve the issue. Note that this is still currently in development so there may be other problems. Thanks by advance for your help.

**Comment by awlx** [comment]
```
HAProxy version 3.3-dev9-219ef9677f9f3 2025/10/17 - https://haproxy.org/
Status: development branch - not safe for use in production.
Known bugs: https://github.com/haproxy/haproxy/issues?q=is:issue+is:open
Running on: Linux 6.8.0-85-generic #85-Ubuntu SMP PREEMPT_DYNAMIC Thu Sep 18 15:26:59 UTC 2025 x86_64
```

Deployed it on one of the machines and so far my curl looks good 🚀 
```
while true; do curl -o/dev/null -v --http3-only https://stats.ffmuc.net -I --resolve stats.ffmuc.net:443:\[2001:678:ed0:ff00::3\]; done
```

Here is the haproxy dashboard for this host:
https://stats.ffmuc.net/d/aab5f489-3e89-45f7-9db1-bc8f73f68936/haproxy-metrics?orgId=1&from=now-7d&to=now&timezone=browser&var-host=webfrontend05&var-proxy=$__all&var-sv=$__all&refresh=1m&var-query0=


System resources for this host:
https://stats.ffmuc.net/d/lsTdmFIZz/gateway3a-extended-system-dashboard?var-inter=10s&orgId=1&from=now-1h&to=now&timezone=browser&var-datasource=000000001&var-server=webfrontend05&var-mountpoint=$__all&var-cpu=$__all&var-disk=$__all&var-netif=$__all&refresh=1m&editIndex=2

**Comment by awlx** [comment]
As everything seemed very stable, the whole Munich PoP is now running the version with ncbuf2. I am waiting for user feedback if they also see a difference now :).

**Comment by wtarreau** [comment]
This is excellent Annika, thanks a lot for your tests and feedback!

**Comment by awlx** [comment]
No problems during the weekend with this build. 

@GoliathLabs who had issues before reported no hangs anymore. 

I rolled the patched version to the Vienna PoP as well :).

**Comment by a-denoyelle** [comment]
@awlx thank you for your testing this is immensely useful. Note however that I found an issue in the new buffer implementation, which would cause haproxy to close the handshake with error CRYPTO_ERROR. Using ngtcp2 in bursts as a client this can be reproduced easily with about a 1% error rate.

I updated the code and push a new branch with this latest issue fixed. Here is its link https://github.com/haproxy/haproxy/tree/20251014-ade-implement-ncbmbuf (buffer type is renamed from `ncbuf2` to `ncbmbuf`).

**Comment by awlx** [comment]
Cool, awesome. Will roll it out over the next hour :).

**Comment by awlx** [comment]
More feedback from users, they also can't replicate the hangs anymore with either Firefox or Edge 🚀. 

The new version also seems stable @a-denoyelle for us, it's running on all our machines at the moment.

**Comment by a-denoyelle** [comment]
I have just merged in master the new ncbmbuf implementation and the associated QUIC bug fix to switch to it. This is scheduled for a backport.

**Comment by capflam** [comment]
Fixes wlll not be backported to 2.6.
