### ISSUE TITLE
Unusable server idle connection leading to error and redispatch

### ISSUE THREAD

**Issue by aaliddell** [haproxy/haproxy#2092]
### Detailed Description of the Problem

When using h2 frontend and h2 backend under low load, the proxy uses 1-2 connections to each backend and these connections can become idle. However, the 1 remaining idle backend connection appears to get into a state where the underlying TCP connection has closed but HAproxy keeps trying to use it and never attempts to create a new one despite every request failing (with flags SC iirc) or being redispatched. If all backends fall into this state, all requests will fail 503. The affected backends do not get put into down state though, as the http check on a secondary port remains working and using `observe layer7` does not help. Testing with requests directly to the backend from the HAproxy host, it responds fine so it does not appear to be a connectivity issue (plus health checks are working).

Below is the stats UI when the proxy is in this state, you can see server_2 is redispatching everything to server_1. It reports 1 idle connection but the bytes in/out counters are not increasing over time as the sessions and redis counters are inrementing. Similar values are reported in `show servers conn` on the api.

![haproxy-1](https://user-images.githubusercontent.com/9061354/227946167-78f0cd16-3c3c-4ecf-abb1-f634d42d2049.PNG)
![haproxy-2](https://user-images.githubusercontent.com/9061354/227946175-447710f9-3a8d-435d-a1e8-9c53c053984d.PNG)

Looking at socket stats with `ss`, the idle connection to server_2 does not exist, so it seems HAproxy is repeatedly trying to reuse a closed socket:

```
root@hostname:~# nsenter -t $(pidof -s haproxy) -n ss -tpa | grep 4252
ESTAB     0      0      [ipv6 of haproxy]:53446         [ipv6 of server_1]:4252       users:(("haproxy",pid=1474250,fd=33))
```

Observing tcpdump at both sides, I see zero traffic (connection attempts nor data) on the main port to server_2 but can see the health checks on the secondary port.

If I then do a `set server ... state maint` then `set server ... state ready` with the API on the affected backend server then the problem resolves.

Some environment specific details:
- Running under docker and haproxy and the backends are within the same host and network
- h2 connections are carrying gRPC, which may have very long-lived requests
- Observed in multiple recent versions (at least 2.6 and 2.7)
- Potentially related to switching to IPv6 for connections to backends, but maybe was happening before. Can be tested reverting this if you think may be relevant?

Things I have tried:
- Reducing various associated timeouts (server, http-keep-alive, server-fin etc). Even after the keep alive timeout should have triggered, the connection is not being closed
- Using check with observe layer7, this makes no difference
- Using redispatch. This works to workaround the failed backend but to recover the backend it must be cycled again manually and will not autorecover

I have tried searching for related issues here and in discourse; the only potentially related topic I could find was this one with no solution: https://discourse.haproxy.org/t/frequent-connection-retries-and-timeouts-with-grpc/5689/1

If there's any API commands you would like me to try when in this state please let me know

### Expected Behavior

The idle connection should be closed when it has failed and a new one opened, without having to manually force the server into maintenance

### Steps to Reproduce the Behavior

I have not yet found a way of determistically triggering this every time but it happens intermittently when both the backend and HAproxy are starting at the same time. Seems potentially race-condition'y as sometimes no servers are affected, often 1 is affected and sometimes multiple are.

### Do you have any idea what may have caused this?

I see a comment below on the HAproxy site:

> pool-purge-delay: Frequency at which HAProxy will close idle and unused connections. Only half of the idle connections will be closed after this period of time The default is 5 seconds.

If there is only a single idle connection, will this 'half' of 1 mean none get closed?

Alternatively, is the use of srvtcpka preventing the connection ever looking idle?

### What is your configuration?

```haproxy
Minimal config of the affected frontend/backend:

global
    maxconn 1000
    log stdout local0

defaults
    log global
    mode http
    maxconn 1000
    option contstats
    option log-separate-errors
    option redispatch

    # These values have been experimented with extensively and cannot resolve the problem
    timeout connect 10s
    timeout client 1d
    timeout server 1d
    timeout http-request 5s
    timeout http-keep-alive 30s
    timeout client-fin 10s
    timeout server-fin 10s

    option clitcpka
    clitcpka-idle 60s
    clitcpka-intvl 60s
    option srvtcpka
    srvtcpka-idle 60s
    srvtcpka-intvl 60s

resolvers dns_resolver
    nameserver dns_1 127.0.0.11:53
    accepted_payload_size 8192
    hold valid 2s


frontend fe_example
    bind :::42520 v6only proto h2

    option httplog
    option logasap
    option forwardfor

    default_backend be_example

backend be_example
    balance leastconn

    option httpchk
    http-check connect port 10480
    http-check send meth GET uri / ver HTTP/1.1
    http-check expect status 200

    default-server proto h2 check observe layer7 resolvers dns_resolver init-addr none inter 3s fastinter 1s fall 3 rise 2 on-marked-down shutdown-sessions
    server-template server_ 5 the_backend_dns_name:4252
```

### Output of `haproxy -vv`

```plain
HAProxy version 2.7.5-8d23021 2023/03/17 - https://haproxy.org/
Status: stable branch - will stop receiving fixes around Q1 2024.
Known bugs: http://www.haproxy.org/bugs/bugs-2.7.5.html
Running on: Linux 5.10.0-21-cloud-amd64 #1 SMP Debian 5.10.162-1 (2023-01-21) x86_64
Build options :
  TARGET  = linux-glibc
  CPU     = generic
  CC      = cc
  CFLAGS  = -O2 -g -Wall -Wextra -Wundef -Wdeclaration-after-statement -Wfatal-errors -Wtype-limits -Wshift-negative-value -Wshift-overflow=2 -Wduplicated-cond -Wnull-dereference -fwrapv -Wno-address-of-packed-member -Wno-unused-label -Wno-sign-compare -Wno-unused-parameter -Wno-clobbered -Wno-missing-field-initializers -Wno-cast-function-type -Wno-string-plus-int -Wno-atomic-alignment
  OPTIONS = USE_PCRE2=1 USE_PCRE2_JIT=1 USE_LINUX_TPROXY=1 USE_GETADDRINFO=1 USE_OPENSSL=1 USE_LUA=1 USE_SLZ=1 USE_TFO=1 USE_PROMEX=1
  DEBUG   = -DDEBUG_STRICT -DDEBUG_MEMORY_POOLS

Feature list : -51DEGREES +ACCEPT4 +BACKTRACE -CLOSEFROM +CPU_AFFINITY +CRYPT_H -DEVICEATLAS +DL -ENGINE +EPOLL -EVPORTS +GETADDRINFO -KQUEUE +LIBCRYPT +LINUX_SPLICE +LINUX_TPROXY +LUA -MEMORY_PROFILING +NETFILTER +NS -OBSOLETE_LINKER +OPENSSL -OPENSSL_WOLFSSL -OT -PCRE +PCRE2 +PCRE2_JIT -PCRE_JIT +POLL +PRCTL -PROCCTL +PROMEX -PTHREAD_EMULATION -QUIC +RT +SHM_OPEN +SLZ -STATIC_PCRE -STATIC_PCRE2


Default settings :
  bufsize = 16384, maxrewrite = 1024, maxpollevents = 200

Built with multi-threading support (MAX_TGROUPS=16, MAX_THREADS=256, default=1).
Built with OpenSSL version : OpenSSL 1.1.1n  15 Mar 2022
Running on OpenSSL version : OpenSSL 1.1.1n  15 Mar 2022
OpenSSL library supports TLS extensions : yes
OpenSSL library supports SNI : yes
OpenSSL library supports : TLSv1.0 TLSv1.1 TLSv1.2 TLSv1.3
Built with Lua version : Lua 5.3.3
Built with the Prometheus exporter as a service
Built with network namespace support.
Support for malloc_trim() is enabled.
Built with libslz for stateless compression.
Compression algorithms supported : identity("identity"), deflate("deflate"), raw-deflate("deflate"), gzip("gzip")
Built with transparent proxy support using: IP_TRANSPARENT IPV6_TRANSPARENT IP_F
REEBIND
Built with PCRE2 version : 10.32 2018-09-10
PCRE2 library supports JIT : yes
Encrypted password support via crypt(3): yes
Built with gcc compiler version 8.3.0

Available polling systems :
      epoll : pref=300,  test result OK
       poll : pref=200,  test result OK
     select : pref=150,  test result OK
Total: 3 (3 usable), will use epoll.

Available multiplexer protocols :
(protocols marked as <default> cannot be specified using 'proto' keyword)
         h2 : mode=HTTP  side=FE|BE  mux=H2    flags=HTX|HOL_RISK|NO_UPG
       fcgi : mode=HTTP  side=BE     mux=FCGI  flags=HTX|HOL_RISK|NO_UPG
  <default> : mode=HTTP  side=FE|BE  mux=H1    flags=HTX
         h1 : mode=HTTP  side=FE|BE  mux=H1    flags=HTX|NO_UPG
  <default> : mode=TCP   side=FE|BE  mux=PASS  flags=
       none : mode=TCP   side=FE|BE  mux=PASS  flags=NO_UPG

Available services : prometheus-exporter
Available filters :
        [BWLIM] bwlim-in
        [BWLIM] bwlim-out
        [CACHE] cache
        [COMP] compression
        [FCGI] fcgi-app
        [SPOE] spoe
        [TRACE] trace
```

### Last Outputs and Backtraces

```plain
No crash
```

**Comment by capflam** [comment]
Could perform a `show fd` on the CLI  ? To do so, you must configure a stats socket.

In addition, do you have an idea of the latest working version you ran ?

**Comment by aaliddell** [comment]
> Could perform a show fd on the CLI ? To do so, you must configure a stats socket.

Here is the result filtered to only the frontend/backend in question. If there's something missed by this filter let me know, but there's a few other frontends etc in the config I am testing on. In this example, it is server_1 that is in the broken state, so FD 26 here:

```
root@64a88877957e:/# echo "show fd" | socat stdio /api.sock | grep example
      7 : st=0x120121(Cl heopI W:sRa R:srA) ref=0 gid=1 tmask=0x1 umask=0x0 prmsk=0x1 pwmsk=0x0 owner=0x5646ddbe1090 iocb=0x5646dc83ec70(sock_accept_iocb) l.st=RDY fe=fe_example fam=ipv6 lport=42520
     25 : st=0x000121(cl heopI W:sRa R:srA) ref=0 gid=1 tmask=0x1 umask=0x0 prmsk=0x1 pwmsk=0x0 owner=0x5646dddbd050 iocb=0x5646dc83f040(sock_conn_iocb) back=0 cflg=0x80000300 cerr=0 fam=ipv6 lport=42520 rport=56254 fe=fe_example mux=H2 ctx=0x5646dddbd120 h2c.st0=FRH .err=0 .maxid=241 .lastid=-1 .flg=0x110200 .nbst=1 .nbsc=1 .fctl_cnt=0 .send_cnt=0 .tree_cnt=1 .orph_cnt=0 .sub=1 .dsi=0 .dbuf=0@(nil)+0/0 .mbuf=[1..1|32],h=[0@(nil)+0/0],t=[0@(nil)+0/0] .task=0x5646dddbd650 .exp=<NEVER> last_h2s=0x5646dddd1140 h2s.id=7 .st=HCR .flg=0x7001 .rxbuf=0@(nil)+0/0 .sc=0x5646dddbd970(.flg=0x00000000 .app=0x5646dddcef70) .sd=0x5646dddbd920(.flg=0x02805001) .subs=0x5646dddbd980(ev=1 tl=0x5646dddbcf00 tl.calls=0 tl.ctx=0x5646dddbd970 tl.fct=sc_conn_io_cb) xprt=RAW
     26 : st=0x001c22(cl HEOpi W:sRa R:sRa) ref=0 gid=1 tmask=0x1 umask=0x0 prmsk=0x0 pwmsk=0x0 owner=0x5646dddd2190 iocb=0x5646dc83f040(sock_conn_iocb) back=1 cflg=0x005c0301 cerr=0 fam=ipv6 lport=46130 sv=be_example/server_1 mux=H2 ctx=0x5646dddcfb00 h2c.st0=PRF .err=0 .maxid=-1 .lastid=-1 .flg=0x8000 .nbst=0 .nbsc=0 .fctl_cnt=0 .send_cnt=0 .tree_cnt=0 .orph_cnt=0 .sub=3 .dsi=-1 .dbuf=0@(nil)+0/0 .mbuf=[1..1|32],h=[0@(nil)+0/0],t=[0@(nil)+0/0] .task=0x5646dddd16b0 .exp=<NEVER> xprt=RAW
     34 : st=0x010121(cL heopI W:sRa R:srA) ref=0 gid=1 tmask=0x1 umask=0x0 prmsk=0x1 pwmsk=0x0 owner=0x5646ddddcc20 iocb=0x5646dc83f040(sock_conn_iocb) back=1 cflg=0x00000300 cerr=0 fam=ipv6 lport=48368 rport=4252 sv=be_example/server_2 mux=H2 ctx=0x5646ddddd730 h2c.st0=FRH .err=0 .maxid=235 .lastid=-1 .flg=0x218600 .nbst=1 .nbsc=1 .fctl_cnt=0 .send_cnt=0 .tree_cnt=1 .orph_cnt=0 .sub=1 .dsi=235 .dbuf=0@(nil)+0/0 .mbuf=[1..1|32],h=[0@(nil)+0/0],t=[0@(nil)+0/0] .task=0x5646ddddcda0 .exp=<NEVER> last_h2s=0x5646dddd2360 h2s.id=3 .st=HCL .flg=0x7002 .rxbu
```

> In addition, do you have an idea of the latest working version you ran ?

Not off the top of my head, I may have to do some bisection testing. I don't recall seeing this in early 2.x releases, but that may be because config has changed since then.


Some further details from testing:
- Restarting just the backend repeatedly does not cause the issue
- Restarting a failed backend does not clear the issue despite observing the backend go into down state. Only manual movement into maint mode or haproxy restart clears the issue so far
- Restarting just haproxy repeatedly does not cause the issue
- Restarting both backend and haproxy concurrently causes the issue with non-deterministic results

Observing the traffic during startup when the issue occurs: the final traffic sent to the failed backend is a syn followed by a reset, then haproxy never attempts to connect again (these port numbers won't line up with FDs above as I caught them at different times):

```
14:18:57.694178 IP6 (flowlabel 0x245cf, hlim 64, next-header TCP (6) payload length: 32) ipv6_of_backend.4252 > ipv6_of_haproxy.55744: Flags [F.], cksum 0x8def (incorrect -> 0x668d), seq 1861, ack 2071, win 502, options [nop,nop,TS val 2518470766 ecr 4273317454], length 0
14:18:57.694255 IP6 (flowlabel 0x790e1, hlim 64, next-header TCP (6) payload length: 32) ipv6_of_haproxy.55744 > ipv6_of_backend.4252: Flags [F.], cksum 0x8def (incorrect -> 0x4e24), seq 2071, ack 1862, win 502, options [nop,nop,TS val 4273323702 ecr 2518470766], length 0
14:18:57.694272 IP6 (flowlabel 0x245cf, hlim 64, next-header TCP (6) payload length: 32) ipv6_of_backend.4252 > ipv6_of_haproxy.55744: Flags [.], cksum 0x8def (incorrect -> 0x4e24), ack 2072, win 502, options [nop,nop,TS val 2518470766 ecr 4273323702], length 0
14:18:59.329545 IP6 (flowlabel 0xd566d, hlim 64, next-header TCP (6) payload length: 40) ipv6_of_haproxy.50442 > ipv6_of_backend.4252: Flags [S], cksum 0x8df7 (incorrect -> 0x3064), seq 3321114527, win 64320, options [mss 1340,sackOK,TS val 4273325337 ecr 0,nop,wscale 7], length 0
14:18:59.329558 IP6 (flowlabel 0x3b703, hlim 64, next-header TCP (6) payload length: 20) ipv6_of_backend.4252 > ipv6_of_haproxy.50442: Flags [R.], cksum 0x8de3 (incorrect -> 0x56cc), seq 0, ack 3321114528, win 0, length 0

```

**Comment by aaliddell** [comment]
I notice there has been some recent commits to the fd handling code for a race condition on closure (although under a very different load scenario); is it worthwhile me testing 2.8dev5 rather than latest stable? Otherwise I'll start stepping back through minor versions to see if I can find a start point

**Comment by capflam** [comment]
Thanks for debugging !

There is something really strange with your fd 26. The H2 connection is in `PREFACE` state. It means the preface was not sent to the server.  However the  flags for the tcp connection are `CO_FL_WAIT_L4_CONN | CO_FL_ERROR | CO_FL_SOCK_WR_SH | CO_FL_SOCK_RD_SH | CO_FL_XPRT_READY | CO_FL_CTRL_READY | CO_FL_SAFE_LIST`. And here it is totally weird. An error was reported. There is `CO_FL_WAIT_L4_CONN` flag, it means the error was reported during the connect stage. but the connection is mark to be in an idle list (the safe one). It is impossible. AFAIK, an H2 connection in `PREFACE` state cannot be in an idle list.

I may have wrong but it seems unrelated to the recent fixes about FDs.

Wait a minute, I'm able to get such connection :) I need more time to investigate. Stay tuned.

**Comment by capflam** [comment]
Ok, So I'm able to reproduce the bug. I must see with @wtarreau how to fix it properly. In the meantime, the following patch does the trick on my side:
```diff
diff --git a/src/mux_h2.c b/src/mux_h2.c
index 61d6d4a11..e550bf8a1 100644
--- a/src/mux_h2.c
+++ b/src/mux_h2.c
@@ -654,6 +654,7 @@ h2c_is_dead(const struct h2c *h2c)
 {
        if (eb_is_empty(&h2c->streams_by_id) &&     /* don't close if streams exist */
            ((h2c->flags & H2_CF_ERROR) ||          /* errors close immediately */
+            (h2c->flags & H2_CF_ERR_PENDING && h2c->st0 < H2_CS_SETTINGS1) || /* early error during connect */
             (h2c->st0 >= H2_CS_ERROR && !h2c->task) || /* a timeout stroke earlier */
             (!(h2c->conn->owner)) || /* Nobody's left to take care of the connection, drop it now */
             (!br_data(h2c->mbuf) &&  /* mux buffer empty, also process clean events below */
@@ -3858,6 +3859,7 @@ static int h2_send(struct h2c *h2c)
                        h2c->flags &= ~(H2_CF_MUX_MFULL | H2_CF_DEM_MROOM);
        }
 
+schedule:
        if (conn->flags & CO_FL_ERROR) {
                h2c->flags |= H2_CF_ERR_PENDING;
                if (h2c->flags & H2_CF_RCVD_SHUT)
@@ -3876,7 +3878,7 @@ static int h2_send(struct h2c *h2c)
                TRACE_DEVEL("leaving with everything sent", H2_EV_H2C_SEND, h2c->conn);
                goto end;
        }
-schedule:
+
        if (!(conn->flags & CO_FL_ERROR) && !(h2c->wait_event.events & SUB_RETRY_SEND)) {
                TRACE_STATE("more data to send, subscribing", H2_EV_H2C_SEND, h2c->conn);
                conn->xprt->subscribe(conn, conn->xprt_ctx, SUB_RETRY_SEND, &h2c->wait_event);
```

**Comment by aaliddell** [comment]
Awesome, relieved it's not just me misconfiguring things 😌 

I have applied your patch atop the 2.7.5 tag and so far cannot recreate the issue in over ~15 restarts and cannot get an fd with that set of flags. If I revert the patch and rebuild then I can see the issue again in ~50% of restarts, which means my local build is consistent with the images I was using.

If you come up with an alternate fix I can test that too, although it sounds like you have a working repro anyway.

**Comment by capflam** [comment]
Cool, thanks ! The fix will be more or less this one. I'm on it.

**Comment by capflam** [comment]
Now pushed ! the fix will be backported as usual with other pending fixes. Thanks !

**Comment by aaliddell** [comment]
That's a phenomenal turnaround time, thanks 👍 

I'll test your final fix this afternoon and if you hear no more by this evening you can assume it works great

**Comment by capflam** [comment]
In fact, the 2.6 does not seem to be affected by this issue. @aaliddell, are you sure you observed the issue on 2.6 ?

**Comment by aaliddell** [comment]
Potentially not; I thought we had been observing this for longer than we have been on 2.7 but perhaps we moved to 2.7 earlier than I remember. If the code-path to cause the issue isn't possible in 2.6 then it's likely my memory that is wrong here

**Comment by capflam** [comment]
Ok, thanks for clarifying. The patch cannot be backported to 2.6 because the code is slightly different. And my reproducer for the 2.7 does not trigger the issue on 2.6. So, I guess there is no bug on 2.6. Or not the same one :) I'm closing now. Thanks again !
