### ISSUE TITLE
Delays on large HTTP requests

### ISSUE THREAD

**Issue by hont512** [haproxy/haproxy#1496]
### Detailed Description of the Problem

I get 2-8 seconds delay on HTTP-requests that are bigger than 1 packet and have specific TCP packets order

Server-side TCP-dump for good request (made with Wget, processed by "http-request redirect"):
```
13:24:27.382852 IP C.C.C.C.55381 > S.S.S.S.80: Flags [S], seq 494219268, win 64240, options [mss 1460,nop,wscale 8,nop,nop,sackOK], length 0
13:24:27.382870 IP S.S.S.S.80 > C.C.C.C.55381: Flags [S.], seq 1303729737, ack 494219269, win 64240, options [mss 1460,nop,nop,sackOK,nop,wscale 7], length 0
13:24:27.436150 IP C.C.C.C.55381 > S.S.S.S.80: Flags [.], ack 1, win 1026, length 0
13:24:27.438140 IP C.C.C.C.55381 > S.S.S.S.80: Flags [P.], seq 1:1461, ack 1, win 1026, length 1460: HTTP: GET /favicon.ico HTTP/1.1
13:24:27.480341 IP S.S.S.S.80 > C.C.C.C.55381: Flags [.], ack 1461, win 501, length 0
13:24:27.534037 IP C.C.C.C.55381 > S.S.S.S.80: Flags [P.], seq 1461:2339, ack 1, win 1026, length 878: HTTP
13:24:27.534049 IP S.S.S.S.80 > C.C.C.C.55381: Flags [.], ack 2339, win 501, length 0
13:24:27.534295 IP S.S.S.S.80 > C.C.C.C.55381: Flags [P.], seq 1:95, ack 2339, win 501, length 94: HTTP: HTTP/1.1 301 Moved Permanently
13:24:27.628305 IP C.C.C.C.55381 > S.S.S.S.80: Flags [.], ack 95, win 1026, length 0
13:24:27.842889 IP C.C.C.C.55381 > S.S.S.S.80: Flags [F.], seq 2339, ack 95, win 1026, length 0
13:24:27.842972 IP S.S.S.S.80 > C.C.C.C.55381: Flags [F.], seq 95, ack 2340, win 501, length 0
13:24:27.896416 IP C.C.C.C.55381 > S.S.S.S.80: Flags [.], ack 96, win 1026, length 0
```

Bad request (made with Chromium on same PC):
```
05:31:04.126689 IP C.C.C.C.14078 > S.S.S.S.80: Flags [S], seq 2022574747, win 64240, options [mss 1460,nop,wscale 8,nop,nop,sackOK], length 0
05:31:04.126742 IP S.S.S.S.80 > C.C.C.C.14078: Flags [S.], seq 2531783150, ack 2022574748, win 42340, options [mss 1460,nop,nop,sackOK,nop,wscale 10], length 0
05:31:04.180344 IP C.C.C.C.14078 > S.S.S.S.80: Flags [.], ack 1, win 1026, length 0
05:31:04.180653 IP C.C.C.C.14078 > S.S.S.S.80: Flags [P.], seq 1461:2339, ack 1, win 1026, length 878: HTTP
05:31:04.180670 IP S.S.S.S.80 > C.C.C.C.14078: Flags [.], ack 1, win 42, options [nop,nop,sack 1 {1461:2339}], length 0
05:31:04.183913 IP C.C.C.C.14078 > S.S.S.S.80: Flags [.], seq 1:1461, ack 1, win 1026, length 1460: HTTP: GET /favicon.ico HTTP/1.1
05:31:04.183924 IP S.S.S.S.80 > C.C.C.C.14078: Flags [.], ack 2339, win 41, length 0
05:31:04.184158 IP S.S.S.S.80 > C.C.C.C.14078: Flags [P.], seq 1:95, ack 2339, win 42, length 94: HTTP: HTTP/1.1 301 Moved Permanently
05:31:04.457854 IP S.S.S.S.80 > C.C.C.C.14078: Flags [P.], seq 1:95, ack 2339, win 42, length 94: HTTP: HTTP/1.1 301 Moved Permanently
05:31:04.745828 IP S.S.S.S.80 > C.C.C.C.14078: Flags [P.], seq 1:95, ack 2339, win 42, length 94: HTTP: HTTP/1.1 301 Moved Permanently
05:31:05.289905 IP S.S.S.S.80 > C.C.C.C.14078: Flags [P.], seq 1:95, ack 2339, win 42, length 94: HTTP: HTTP/1.1 301 Moved Permanently
05:31:06.345971 IP S.S.S.S.80 > C.C.C.C.14078: Flags [P.], seq 1:95, ack 2339, win 42, length 94: HTTP: HTTP/1.1 301 Moved Permanently
05:31:07.186186 IP S.S.S.S.80 > C.C.C.C.14078: Flags [F.], seq 95, ack 2339, win 42, length 0
05:31:07.237529 IP C.C.C.C.14078 > S.S.S.S.80: Flags [.], ack 1, win 1026, length 0
05:31:08.489894 IP S.S.S.S.80 > C.C.C.C.14078: Flags [FP.], seq 1:95, ack 2339, win 42, length 94: HTTP: HTTP/1.1 301 Moved Permanently
05:31:08.540655 IP C.C.C.C.14078 > S.S.S.S.80: Flags [.], ack 96, win 1026, length 0
05:31:08.543914 IP C.C.C.C.14078 > S.S.S.S.80: Flags [F.], seq 2339, ack 96, win 1026, length 0
05:31:08.543925 IP S.S.S.S.80 > C.C.C.C.14078: Flags [.], ack 2340, win 42, length 0
```

Here we can see:
- Second part of request (04.180653) arrived on NIC before first part (04.183913)
- It's not a problem itself - the request was read and processed by Haproxy 100% same as the "good" one
- Server sent answer to Client with flags PSH-ACK (04.184158)
- Somehow the Client didn't receive that answer and didn't answer ACK
- Server made retries with same PSH-ACK flags and they also didn't come to Client
- Then after 4 seconds of retries Server sent answer with FIN-PSH-ACK and it was received by Client (08.489894)
-- I confirmed it with Client-side TCPdump - during those ~4 seconds - there are really no incoming packets.

### Expected Behavior

No delay

### Steps to Reproduce the Behavior

Reproducing is difficult
I think that it's related together to software+network details

I'm lucky myself - I've tried 3 different PC (Win\Linux) and 2 different internet providers. 
Following the below rules - I get "backwards TCP order with delay" in 100% attempts
However, some collegues always have good TCP order and no delays...

Rules:
- Only HTTP, not HTTPS
- Request-size bigger than MTU (tested range 2300-6000 bytes)
- Request sent with browser 
-- Tested with several Chromium-like browsers, making large Cookie-header with EditThisCookie plugin. While Wget on same PC cause no problems.
- No VPN 
- Client about 50ms away from Server (not sure if it matters)

Type of response makes no difference. Tested not just empty-body 301-redirects like in example, but also LUA-applet-generated 200-answers with large content.

### Do you have any idea what may have caused this?

As far as I understand that packet order is rare but normal case and there are no reasons to dig into reasons for it

Delays probably caused by some details about TCP-sequences that make first PSH-ACK packets to be filtered or delayed in some places. That's just assumption, I still even not 100% sure that haproxy is related itself )

### What is your configuration?

```haproxy
mode http
```

Details probably not related since it happens outside Haproxy

I've played with options about smart-accept\connect, TFO, keep-alive, buffer-request and few others - no difference

Also I've tried different server hardware, kernels and kernel configs
```


### Output of `haproxy -vv`

```plain
HA-Proxy version 2.0.26-4cfdf4-27 2021/12/14 - https://haproxy.org/
Build options :
  TARGET  = linux-glibc
  CPU     = native
  CC      = gcc
  CFLAGS  = -O3 -march=native -fno-strict-aliasing -Wdeclaration-after-statement -fwrapv -Wno-address-of-packed-member -Wno-unused-label -Wno-sign-compare -Wno-unused-parameter -Wno-old-style-declaration -Wno-ignored-qualifiers -Wno-clobbered -Wno-missing-field-initializers -Wno-implicit-fallthrough -Wno-stringop-overflow -Wno-cast-function-type -Wtype-limits -Wshift-negative-value -Wshift-overflow=2 -Wduplicated-cond -Wnull-dereference
  OPTIONS = USE_PCRE=1 USE_PCRE_JIT=1 USE_THREAD=1 USE_REGPARM=1 USE_GETADDRINFO=1 USE_OPENSSL=1 USE_LUA=1 USE_ZLIB=1 USE_TFO=1 USE_NS=1 USE_SYSTEMD=1

Feature list : +EPOLL -KQUEUE -MY_EPOLL -MY_SPLICE +NETFILTER +PCRE +PCRE_JIT -PCRE2 -PCRE2_JIT +POLL -PRIVATE_CACHE +THREAD -PTHREAD_PSHARED +REGPARM -STATIC_PCRE -STATIC_PCRE2 +TPROXY +LINUX_TPROXY +LINUX_SPLICE +LIBCRYPT +CRYPT_H -VSYSCALL +GETADDRINFO +OPENSSL +LUA +FUTEX +ACCEPT4 -CLOSEFROM -MY_ACCEPT4 +ZLIB -SLZ +CPU_AFFINITY +TFO +NS +DL +RT -DEVICEATLAS -51DEGREES -WURFL +SYSTEMD -OBSOLETE_LINKER +PRCTL +THREAD_DUMP -EVPORTS

Default settings :
  bufsize = 16384, maxrewrite = 1024, maxpollevents = 200

Built with multi-threading support (MAX_THREADS=64, default=16).
Built with OpenSSL version : OpenSSL 1.1.1l  24 Aug 2021
Running on OpenSSL version : OpenSSL 1.1.1l  24 Aug 2021
OpenSSL library supports TLS extensions : yes
OpenSSL library supports SNI : yes
OpenSSL library supports : TLSv1.0 TLSv1.1 TLSv1.2 TLSv1.3
Built with Lua version : Lua 5.3.6
Built with network namespace support.
Built with transparent proxy support using: IP_TRANSPARENT IPV6_TRANSPARENT IP_FREEBIND
Built with zlib version : 1.2.11
Running on zlib version : 1.2.11
Compression algorithms supported : identity("identity"), deflate("deflate"), raw-deflate("deflate"), gzip("gzip")
Built with PCRE version : 8.39 2016-06-14
Running on PCRE version : 8.39 2016-06-14
PCRE library supports JIT : yes
Encrypted password support via crypt(3): yes

Available polling systems :
      epoll : pref=300,  test result OK
       poll : pref=200,  test result OK
     select : pref=150,  test result OK
Total: 3 (3 usable), will use epoll.

Available multiplexer protocols :
(protocols marked as <default> cannot be specified using 'proto' keyword)
              h2 : mode=HTX        side=FE|BE     mux=H2
              h2 : mode=HTTP       side=FE        mux=H2
       <default> : mode=HTX        side=FE|BE     mux=H1
       <default> : mode=TCP|HTTP   side=FE|BE     mux=PASS

Available services : none

Available filters :
        [SPOE] spoe
        [COMP] compression
        [CACHE] cache
        [TRACE] trace

Linux TST 5.15.0-2-amd64 #1 SMP Debian 5.15.5-1 (2021-11-26) x86_64 GNU/Linux
```

**Comment by lukastribus** [comment]
This is clearly not a haproxy issue, which you also say yourself. This issue tracker is for tracking bugs and feature requests directly relating to haproxy.
